# LogicTest: !local-prepared
# We've seen this test hit a timeout in fakedist configs under race.
skip under race

statement ok
CREATE TABLE t (x INT PRIMARY KEY, y INT NOT NULL, z INT NOT NULL, w INT, INDEX i (x), INDEX i2 (z))

statement ok
INSERT INTO t VALUES (1, 2, 3, 4), (5, 6, 7, 8)

statement error pgcode 0A000 .* contains duplicate column \"y\"
ALTER TABLE t ALTER PRIMARY KEY USING COLUMNS (y, y)

statement ok
ALTER TABLE t ALTER PRIMARY KEY USING COLUMNS (y, z)

query IIII rowsort
SELECT * FROM t@t_pkey
----
1 2 3 4
5 6 7 8

statement ok
INSERT INTO t VALUES (9, 10, 11, 12)

query IIII rowsort
SELECT * from t@t_pkey
----
1 2 3 4
5 6 7 8
9 10 11 12

statement ok
UPDATE t SET x = 2 WHERE z = 7

query IIII rowsort
SELECT * from t@t_pkey
----
1 2 3 4
2 6 7 8
9 10 11 12

query T
SELECT feature_name FROM crdb_internal.feature_usage
WHERE feature_name IN ('sql.schema.alter_table.alter_primary_key') AND usage_count > 0
ORDER BY feature_name
----
sql.schema.alter_table.alter_primary_key

# Test primary key changes on storing indexes with different column families (the randomizer will do this for us).
statement ok
DROP TABLE t;

statement ok
CREATE TABLE t (
  x INT PRIMARY KEY, y INT, z INT NOT NULL, w INT, v INT,
  INDEX i1 (y) STORING (w, v), INDEX i2 (z) STORING (y, v)
);

statement ok
INSERT INTO t VALUES (1, 2, 3, 4, 5), (6, 7, 8, 9, 10), (11, 12, 13, 14, 15);

statement ok
ALTER TABLE t ALTER PRIMARY KEY USING COLUMNS (z);

statement ok
INSERT INTO t VALUES (16, 17, 18, 19, 20)

query III rowsort
SELECT y, w, v FROM t@i1
----
2 4 5
7 9 10
12 14 15
17 19 20

query III rowsort
SELECT y, z, v FROM t@i2
----
2 3 5
7 8 10
12 13 15
17 18 20

# Regression test for issue #81522.
statement error pgcode 42611 expressions such as \"gen_random_uuid\(\)\" are not allowed in primary index definition
ALTER TABLE t ALTER PRIMARY KEY USING COLUMNS (gen_random_uuid());

# Test that composite values are encoded correctly in covering indexes.
statement ok
CREATE TABLE t_composite (x INT PRIMARY KEY, y DECIMAL NOT NULL);

statement ok
INSERT INTO t_composite VALUES (1, 1.0), (2, 1.001)

statement ok
ALTER TABLE t_composite ALTER PRIMARY KEY USING COLUMNS (y)

query IT rowsort
SELECT * FROM t_composite@t_composite_pkey
----
1 1.0
2 1.001

# Test that we can drop tables after a primary key change.
statement ok
DROP TABLE t_composite

subtest foreign_keys

# Test primary key changes on tables with inbound and outbound FK's.
statement ok
CREATE TABLE fk1 (x INT NOT NULL);

statement ok
CREATE TABLE fk2 (x INT NOT NULL, UNIQUE INDEX i (x));

statement ok
ALTER TABLE fk1 ADD CONSTRAINT fk FOREIGN KEY (x) REFERENCES fk2(x);

statement ok
INSERT INTO fk2 VALUES (1);

statement ok
INSERT INTO fk1 VALUES (1)

statement ok
ALTER TABLE fk1 ALTER PRIMARY KEY USING COLUMNS (x)

statement ok
INSERT INTO fk2 VALUES (2);

statement ok
INSERT INTO fk1 VALUES (2)

statement ok
ALTER TABLE fk2 ALTER PRIMARY KEY USING COLUMNS (x)

statement ok
INSERT INTO fk2 VALUES (3);
INSERT INTO fk1 VALUES (3)

# Test some self-referencing foreign keys.
statement ok
CREATE TABLE self (a INT PRIMARY KEY, x INT, y INT, z INT, w INT NOT NULL,
  INDEX (x), UNIQUE INDEX (y), INDEX (z));

statement ok
INSERT INTO self VALUES (1, 1, 1, 1, 1);

statement ok
ALTER TABLE self ADD CONSTRAINT fk1 FOREIGN KEY (z) REFERENCES self (y);

statement ok
ALTER TABLE self ADD CONSTRAINT fk2 FOREIGN KEY (x) REFERENCES self (y);

statement ok
ALTER TABLE self ALTER PRIMARY KEY USING COLUMNS (w)

statement ok
INSERT INTO self VALUES (2, 1, 2, 1, 2);
INSERT INTO self VALUES (3, 2, 3, 2, 3)

# Set up a bunch of foreign key references pointing into and out of a table.
statement ok
CREATE TABLE t1 (x INT PRIMARY KEY, y INT NOT NULL, z INT, w INT, INDEX (y), INDEX (z), UNIQUE INDEX (w));

statement ok
CREATE TABLE t2 (y INT, UNIQUE INDEX (y));

statement ok
CREATE TABLE t3 (z INT, UNIQUE INDEX (z));

statement ok
CREATE TABLE t4 (w INT, INDEX (w));

statement ok
CREATE TABLE t5 (x INT, INDEX (x));

statement ok
INSERT INTO t1 VALUES (1, 1, 1, 1);
INSERT INTO t2 VALUES (1);
INSERT INTO t3 VALUES (1);
INSERT INTO t4 VALUES (1);
INSERT INTO t5 VALUES (1);

statement ok
ALTER TABLE t1 ADD CONSTRAINT fk1 FOREIGN KEY (y) REFERENCES t2(y);

statement ok
ALTER TABLE t1 ADD CONSTRAINT fk2 FOREIGN KEY (z) REFERENCES t3(z);

statement ok
ALTER TABLE t4 ADD CONSTRAINT fk3 FOREIGN KEY (w) REFERENCES t1(w);

statement ok
ALTER TABLE t5 ADD CONSTRAINT fk4 FOREIGN KEY (x) REFERENCES t1(x);

statement ok
ALTER TABLE t1 ALTER PRIMARY KEY USING COLUMNS (y)

statement ok
INSERT INTO t2 VALUES (5);
INSERT INTO t3 VALUES (6);
INSERT INTO t1 VALUES (7, 5, 6, 8);
INSERT INTO t4 VALUES (8);
INSERT INTO t5 VALUES (7)

statement error insert on table "t1" violates foreign key constraint "fk1"
INSERT INTO t1 VALUES (100, 100, 100, 100)

statement error insert on table "t4" violates foreign key constraint "fk3"
INSERT INTO t4 VALUES (101)

# Ensure that we still rewrite a primary index if the index column has name "rowid".
statement ok
DROP TABLE IF EXISTS t;

statement ok
CREATE TABLE t (rowid INT PRIMARY KEY, y INT NOT NULL, FAMILY (rowid, y));

statement ok
ALTER TABLE t ALTER PRIMARY KEY USING COLUMNS (y)

onlyif config schema-locked-disabled
query TT
SHOW CREATE t
----
t  CREATE TABLE public.t (
     rowid INT8 NOT NULL,
     y INT8 NOT NULL,
     CONSTRAINT t_pkey PRIMARY KEY (y ASC),
     UNIQUE INDEX t_rowid_key (rowid ASC),
     FAMILY fam_0_rowid_y (rowid, y)
   );

skipif config schema-locked-disabled
query TT
SHOW CREATE t
----
t  CREATE TABLE public.t (
     rowid INT8 NOT NULL,
     y INT8 NOT NULL,
     CONSTRAINT t_pkey PRIMARY KEY (y ASC),
     UNIQUE INDEX t_rowid_key (rowid ASC),
     FAMILY fam_0_rowid_y (rowid, y)
   ) WITH (schema_locked = true);

subtest index_rewrites
# Test that indexes that need to get rewritten indeed get rewritten.
statement ok
DROP TABLE IF EXISTS t;

statement ok
CREATE TABLE t (
  x INT PRIMARY KEY,
  y INT NOT NULL, -- will be new primary key.
  z INT NOT NULL,
  w INT,
  v JSONB,
  INDEX i1 (w), -- will get rewritten.
  INDEX i2 (y), -- will get rewritten.
  UNIQUE INDEX i3 (z) STORING (y), -- will be rewritten.
  UNIQUE INDEX i4 (z), -- will be rewritten.
  UNIQUE INDEX i5 (w) STORING (y), -- will be rewritten.
  INVERTED INDEX i6 (v), -- will be rewritten.
  INDEX i7 (z) USING HASH WITH (bucket_count=4), -- will be rewritten.
  FAMILY (x, y, z, w, v)
);

# Because of #146725 we can't have schema_locked set, since this
# fallback to the legacy schema changer.
skipif config schema-locked-disabled
statement ok
ALTER TABLE t SET (schema_locked = false);

statement ok
INSERT INTO t VALUES (1, 2, 3, 4, '{}');

statement ok
ALTER TABLE t ALTER PRIMARY KEY USING COLUMNS (y)

query TT
SHOW CREATE t
----
t  CREATE TABLE public.t (
     x INT8 NOT NULL,
     y INT8 NOT NULL,
     z INT8 NOT NULL,
     w INT8 NULL,
     v JSONB NULL,
     crdb_internal_z_shard_4 INT8 NOT VISIBLE NOT NULL AS (mod(fnv32(md5(crdb_internal.datums_to_bytes(z))), 4:::INT8)) VIRTUAL,
     CONSTRAINT t_pkey PRIMARY KEY (y ASC),
     INDEX i1 (w ASC),
     INDEX i2 (y ASC),
     UNIQUE INDEX i3 (z ASC),
     UNIQUE INDEX i4 (z ASC),
     UNIQUE INDEX i5 (w ASC),
     INVERTED INDEX i6 (v),
     INDEX i7 (z ASC) USING HASH WITH (bucket_count=4),
     UNIQUE INDEX t_x_key (x ASC),
     FAMILY fam_0_x_y_z_w_v (x, y, z, w, v)
   );

# Test that the indexes we expect got rewritten. All should have been rewritten,
# so all indexID should be larger than 7.

# The order in which index IDs are assigned differs between the legacy and
# declarative schema changers.
skipif config local-legacy-schema-changer
query IT
SELECT index_id, index_name FROM crdb_internal.table_indexes WHERE descriptor_name = 't' ORDER BY index_name
----
9   i1
11  i2
13  i3
15  i4
17  i5
19  i6
21  i7
25  t_pkey
23  t_x_key

onlyif config local-legacy-schema-changer
query IT
SELECT index_id, index_name FROM crdb_internal.table_indexes WHERE descriptor_name = 't' ORDER BY index_name
----
11  i1
13  i2
15  i3
17  i4
19  i5
21  i6
23  i7
9   t_pkey
25  t_x_key

# Make sure that each index can index join against the new primary key;

query T nosort
SELECT * FROM [EXPLAIN SELECT * FROM t@i1] WHERE info !~ '(distribution|vectorized):.*'
----
·
• index join
│ table: t@t_pkey
│
└── • scan
      missing stats
      table: t@i1
      spans: FULL SCAN

query IIIIT
SELECT * FROM t@i1
----
1 2 3 4 {}

query T nosort
SELECT * FROM [EXPLAIN SELECT * FROM t@i2] WHERE info !~ '(distribution|vectorized):.*'
----
·
• index join
│ table: t@t_pkey
│
└── • scan
      missing stats
      table: t@i2
      spans: FULL SCAN

query IIIIT
SELECT * FROM t@i2
----
1 2 3 4 {}

query T nosort
SELECT * FROM [EXPLAIN SELECT * FROM t@i3] WHERE info !~ '(distribution|vectorized):.*'
----
·
• index join
│ table: t@t_pkey
│
└── • scan
      missing stats
      table: t@i3
      spans: FULL SCAN

query IIIIT
SELECT * FROM t@i3
----
1 2 3 4 {}

query T nosort
SELECT * FROM [EXPLAIN SELECT * FROM t@i4] WHERE info !~ '(distribution|vectorized):.*'
----
·
• index join
│ table: t@t_pkey
│
└── • scan
      missing stats
      table: t@i4
      spans: FULL SCAN

query IIIIT
SELECT * FROM t@i4
----
1 2 3 4 {}

query T nosort
SELECT * FROM [EXPLAIN SELECT * FROM t@i5] WHERE info !~ '(distribution|vectorized):.*'
----
·
• index join
│ table: t@t_pkey
│
└── • scan
      missing stats
      table: t@i5
      spans: FULL SCAN

query IIIIT
SELECT * FROM t@i5
----
1 2 3 4 {}

query T nosort
SELECT * FROM [EXPLAIN SELECT * FROM t@i7] WHERE info !~ '(distribution|vectorized):.*'
----
·
• index join
│ table: t@t_pkey
│
└── • scan
      missing stats
      table: t@i7
      spans: FULL SCAN

query IIIIT
SELECT * FROM t@i5
----
1 2 3 4 {}

# Make sure the create_statement from `SHOW CREATE` can indeed recreate the
# table without error.

let $index_rewrites_t_create_statement
SELECT create_statement FROM [SHOW CREATE t];

statement ok
DROP TABLE IF EXISTS t;

statement ok
$index_rewrites_t_create_statement

subtest end

subtest hash_sharded

statement ok
DROP TABLE IF EXISTS t;

statement ok
CREATE TABLE t (
  x INT PRIMARY KEY,
  y INT NOT NULL,
  z INT,
  INDEX i1 (z) USING HASH WITH (bucket_count=5),
  FAMILY (x, y, z)
);

statement ok
INSERT INTO t VALUES (1, 2, 3);

# Because of #146725 we can't have schema_locked set, since this
# fallback to the legacy schema changer.
skipif config schema-locked-disabled
statement ok
ALTER TABLE t SET (schema_locked = false);

statement ok
ALTER TABLE t ALTER PRIMARY KEY USING COLUMNS (y) USING HASH WITH (bucket_count=10)

query TT
SHOW CREATE t
----
t  CREATE TABLE public.t (
     x INT8 NOT NULL,
     y INT8 NOT NULL,
     z INT8 NULL,
     crdb_internal_z_shard_5 INT8 NOT VISIBLE NOT NULL AS (mod(fnv32(md5(crdb_internal.datums_to_bytes(z))), 5:::INT8)) VIRTUAL,
     crdb_internal_y_shard_10 INT8 NOT VISIBLE NOT NULL AS (mod(fnv32(md5(crdb_internal.datums_to_bytes(y))), 10:::INT8)) VIRTUAL,
     CONSTRAINT t_pkey PRIMARY KEY (y ASC) USING HASH WITH (bucket_count=10),
     INDEX i1 (z ASC) USING HASH WITH (bucket_count=5),
     UNIQUE INDEX t_x_key (x ASC),
     FAMILY fam_0_x_y_z (x, y, z)
   );

query T nosort
SELECT * FROM [EXPLAIN INSERT INTO t VALUES (4, 5, 6)] WHERE info !~ '(distribution|vectorized):.*'
----
·
• insert fast path
  into: t(x, y, z, crdb_internal_z_shard_5, crdb_internal_y_shard_10)
  auto commit
  size: 7 columns, 1 row

# Ensure that all of the indexes have been rewritten.
skipif config local-legacy-schema-changer
query IT
SELECT index_id, index_name FROM crdb_internal.table_indexes WHERE descriptor_name = 't' ORDER BY index_name
----
3  i1
7  t_pkey
5  t_x_key

onlyif config local-legacy-schema-changer
query IT
SELECT index_id, index_name FROM crdb_internal.table_indexes WHERE descriptor_name = 't' ORDER BY index_name
----
5  i1
3  t_pkey
7  t_x_key

query III
SELECT * FROM t@t_pkey
----
1 2 3

query III
SELECT * FROM t@t_x_key
----
1 2 3

query III
SELECT * FROM t@i1
----
1 2 3


statement ok
DROP TABLE IF EXISTS t;

statement ok
CREATE TABLE t (
  x INT PRIMARY KEY USING HASH WITH (bucket_count=5),
  y INT NOT NULL,
  z INT,
  INDEX i (z),
  FAMILY (x, y, z)
);

statement ok
INSERT INTO t VALUES (1, 2, 3);

# Because of #146725 we can't have schema_locked set, since this
# fallback to the legacy schema changer.
skipif config schema-locked-disabled
statement ok
ALTER TABLE t SET (schema_locked = false);

statement ok
ALTER TABLE t ALTER PRIMARY KEY USING COLUMNS (y)

query TT
SHOW CREATE t
----
t  CREATE TABLE public.t (
     crdb_internal_x_shard_5 INT8 NOT VISIBLE NOT NULL AS (mod(fnv32(md5(crdb_internal.datums_to_bytes(x))), 5:::INT8)) VIRTUAL,
     x INT8 NOT NULL,
     y INT8 NOT NULL,
     z INT8 NULL,
     CONSTRAINT t_pkey PRIMARY KEY (y ASC),
     INDEX i (z ASC),
     UNIQUE INDEX t_x_key (x ASC) USING HASH WITH (bucket_count=5),
     FAMILY fam_0_x_y_z (x, y, z)
   );

query III
SELECT * FROM t@t_x_key
----
1 2 3

query III
SELECT * FROM t@i
----
1 2 3

# Ensure we don't rewrite default primary index even if its name isn't rowid.
statement ok
DROP TABLE IF EXISTS t;

statement ok
CREATE TABLE t (rowid INT NOT NULL);

onlyif config schema-locked-disabled
query TT
SHOW CREATE t
----
t  CREATE TABLE public.t (
     rowid INT8 NOT NULL,
     rowid_1 INT8 NOT VISIBLE NOT NULL DEFAULT unique_rowid(),
     CONSTRAINT t_pkey PRIMARY KEY (rowid_1 ASC)
   );

skipif config schema-locked-disabled
query TT
SHOW CREATE t
----
t  CREATE TABLE public.t (
     rowid INT8 NOT NULL,
     rowid_1 INT8 NOT VISIBLE NOT NULL DEFAULT unique_rowid(),
     CONSTRAINT t_pkey PRIMARY KEY (rowid_1 ASC)
   ) WITH (schema_locked = true);

statement ok
ALTER TABLE t ALTER PRIMARY KEY USING COLUMNS (rowid)

# Legacy schema changer will keep the rowid column.
onlyif config schema-locked-disabled
skipif config local-legacy-schema-changer
query TT
SHOW CREATE t
----
t  CREATE TABLE public.t (
     rowid INT8 NOT NULL,
     CONSTRAINT t_pkey PRIMARY KEY (rowid ASC)
   );

skipif config schema-locked-disabled
query TT
SHOW CREATE t
----
t  CREATE TABLE public.t (
     rowid INT8 NOT NULL,
     CONSTRAINT t_pkey PRIMARY KEY (rowid ASC)
   ) WITH (schema_locked = true);

# Regression for old primary key not using PrimaryIndexEncoding as its encoding type.
subtest encoding_bug

# This test ensures that while the old primary key is in the mutations list it is
# able to be updated and deleted with the primary index encoding.
statement ok
DROP TABLE IF EXISTS t;

statement ok
CREATE TABLE t (x INT PRIMARY KEY, y INT NOT NULL, z INT NOT NULL, FAMILY (x, y, z));

statement ok
INSERT INTO t VALUES (1, 2, 3);

statement ok
ALTER TABLE t ALTER PRIMARY KEY USING COLUMNS (z);

statement ok
UPDATE t SET y = 3 WHERE z = 3

# Test for #45363.

statement ok
DROP TABLE IF EXISTS t;

statement ok
CREATE TABLE t (x INT PRIMARY KEY, y INT NOT NULL) WITH (schema_locked = false);

statement ok
BEGIN TRANSACTION ISOLATION LEVEL SERIALIZABLE;
SET LOCAL autocommit_before_ddl = false;

statement ok
ALTER TABLE t ALTER PRIMARY KEY USING COLUMNS (y)

statement error pq: relation "t" \([0-9]+\): unimplemented: cannot perform other schema changes in the same transaction as a primary key change
CREATE INDEX ON t (y)

statement ok
ROLLBACK

statement ok
DROP TABLE IF EXISTS t;

statement ok
CREATE TABLE t (x INT PRIMARY KEY, y INT NOT NULL) WITH (schema_locked = false)

statement ok
BEGIN TRANSACTION ISOLATION LEVEL SERIALIZABLE;
SET LOCAL autocommit_before_ddl = false;

statement ok
ALTER TABLE t ALTER PRIMARY KEY USING COLUMNS (y)

statement error pq: relation "t" \([0-9]+\): unimplemented: cannot perform other schema changes in the same transaction as a primary key change
ALTER TABLE t ADD COLUMN z INT

statement ok
ROLLBACK

subtest add_pk_rowid
# Tests for #45509.
statement ok
DROP TABLE IF EXISTS t;

statement ok
CREATE TABLE t (x INT PRIMARY KEY)

statement error pq: multiple primary keys for table "t" are not allowed
ALTER TABLE t ADD PRIMARY KEY (x)

statement ok
DROP TABLE IF EXISTS t;

statement disable-cf-mutator ok
CREATE TABLE t (x INT NOT NULL)

statement ok
ALTER TABLE t ADD PRIMARY KEY (x)

# Row ID isn't removed by legacy schema changer.
onlyif config schema-locked-disabled
skipif config local-legacy-schema-changer
query TT
SHOW CREATE t
----
t  CREATE TABLE public.t (
     x INT8 NOT NULL,
     CONSTRAINT t_pkey PRIMARY KEY (x ASC)
   );

skipif config schema-locked-disabled
query TT
SHOW CREATE t
----
t  CREATE TABLE public.t (
     x INT8 NOT NULL,
     CONSTRAINT t_pkey PRIMARY KEY (x ASC)
   ) WITH (schema_locked = true);

statement ok
DROP TABLE IF EXISTS t;

statement disable-cf-mutator ok
CREATE TABLE t (x INT NOT NULL);

statement ok
ALTER TABLE t ADD PRIMARY KEY (x) USING HASH WITH (bucket_count=4)

onlyif config schema-locked-disabled
skipif config local-legacy-schema-changer
query TT
SHOW CREATE t
----
t  CREATE TABLE public.t (
     x INT8 NOT NULL,
     crdb_internal_x_shard_4 INT8 NOT VISIBLE NOT NULL AS (mod(fnv32(md5(crdb_internal.datums_to_bytes(x))), 4:::INT8)) VIRTUAL,
     CONSTRAINT t_pkey PRIMARY KEY (x ASC) USING HASH WITH (bucket_count=4, shard_columns=(x))
   );

skipif config schema-locked-disabled
query TT
SHOW CREATE t
----
t  CREATE TABLE public.t (
     x INT8 NOT NULL,
     crdb_internal_x_shard_4 INT8 NOT VISIBLE NOT NULL AS (mod(fnv32(md5(crdb_internal.datums_to_bytes(x))), 4:::INT8)) VIRTUAL,
     CONSTRAINT t_pkey PRIMARY KEY (x ASC) USING HASH WITH (bucket_count=4)
   ) WITH (schema_locked = true);

statement ok
DROP TABLE IF EXISTS t;

statement disable-cf-mutator ok
CREATE TABLE t (x INT NOT NULL);

statement ok
ALTER TABLE t ADD CONSTRAINT "my_pk" PRIMARY KEY (x)

# Row ID isn't removed by legacy schema changer.
onlyif config schema-locked-disabled
skipif config local-legacy-schema-changer
query TT
SHOW CREATE t
----
t  CREATE TABLE public.t (
     x INT8 NOT NULL,
     CONSTRAINT my_pk PRIMARY KEY (x ASC)
   );

skipif config schema-locked-disabled
query TT
SHOW CREATE t
----
t  CREATE TABLE public.t (
     x INT8 NOT NULL,
     CONSTRAINT my_pk PRIMARY KEY (x ASC)
   ) WITH (schema_locked = true);

statement ok
CREATE INDEX i ON t (x)

skipif config schema-locked-disabled
statement ok
ALTER TABLE t SET (schema_locked = false);

statement error pgcode 42P07 constraint with name \"i\" already exists
ALTER TABLE t DROP CONSTRAINT "my_pk", ADD CONSTRAINT "i" PRIMARY KEY (x);

skipif config schema-locked-disabled
statement ok
ALTER TABLE t SET (schema_locked = true);

# Regression for #45362.
statement ok
DROP TABLE IF EXISTS t;

statement ok
CREATE TABLE t (x INT NOT NULL) WITH (schema_locked = false)

statement ok
BEGIN TRANSACTION ISOLATION LEVEL SERIALIZABLE;
SET LOCAL autocommit_before_ddl = false;

statement ok
ALTER TABLE t ADD COLUMN y INT

statement error pq: unimplemented: cannot perform a primary key change on t with other schema changes on t in the same transaction
ALTER TABLE t ALTER PRIMARY KEY USING COLUMNS (x)

statement ok
ROLLBACK

# Ensure that starting a primary key change that does not
# enqueue any mutations doesn't start a job.
# TODO (rohany): This test might become obselete when #44923 is fixed.
statement ok
DROP TABLE IF EXISTS t;

statement ok
CREATE TABLE t (x INT NOT NULL);

statement ok
ALTER TABLE t ALTER PRIMARY KEY USING COLUMNS (x)

query I
SELECT job_id FROM [SHOW JOBS] WHERE
description = 'CLEANUP JOB for ''ALTER TABLE test.public.t ALTER PRIMARY KEY USING COLUMNS (y)''' AND
status = 'running'
----

subtest add_drop_pk

statement ok
DROP TABLE IF EXISTS t;

# Legacy schema changer statements
statement ok
CREATE TABLE t (x INT PRIMARY KEY, y INT NOT NULL, FAMILY (x), FAMILY (y)) WITH (schema_locked = false)

statement error pq: relation "t" \([0-9]+\): unimplemented: primary key dropped without subsequent addition of new primary key in same transaction
ALTER TABLE t DROP CONSTRAINT "t_pkey"

statement error pq: multiple primary keys for table "t" are not allowed
ALTER TABLE t ADD CONSTRAINT "t_pkey" PRIMARY KEY (y), DROP CONSTRAINT "t_pkey"

statement error pq: multiple primary keys for table "t" are not allowed
ALTER TABLE t ADD CONSTRAINT "t_pkey" PRIMARY KEY (y)

statement ok
ALTER TABLE t DROP CONSTRAINT "t_pkey", ADD CONSTRAINT "t_pkey" PRIMARY KEY (y)

statement ok
ALTER TABLE t DROP CONSTRAINT "t_pkey", ADD CONSTRAINT "t_pkey_v2" PRIMARY KEY (y)

# The legacy schema changer does not leave behind an index on the old primary key column.
onlyif config local-legacy-schema-changer
query TT
SHOW CREATE t
----
t  CREATE TABLE public.t (
     x INT8 NOT NULL,
     y INT8 NOT NULL,
     CONSTRAINT t_pkey_v2 PRIMARY KEY (y ASC),
     FAMILY fam_0_x (x),
     FAMILY fam_1_y (y)
   );

# The declarative schema changer leaves behind an index on the old primary key column.
skipif config local-legacy-schema-changer
query TT
SHOW CREATE t
----
t  CREATE TABLE public.t (
     x INT8 NOT NULL,
     y INT8 NOT NULL,
     CONSTRAINT t_pkey PRIMARY KEY (y ASC),
     UNIQUE INDEX t_x_key (x ASC),
     FAMILY fam_0_x (x),
     FAMILY fam_1_y (y)
   );

statement ok
ALTER TABLE t ADD CONSTRAINT IF NOT EXISTS "t_pkey" PRIMARY KEY (x)

# Test that we can issue a DROP CONSTRAINT + ADD PRIMARY KEY
# in the same transaction.
statement ok
DROP TABLE t;

statement ok
CREATE TABLE t (x INT PRIMARY KEY, y INT NOT NULL, FAMILY (x), FAMILY (y)) WITH (schema_locked = false)

statement ok
BEGIN TRANSACTION ISOLATION LEVEL SERIALIZABLE;
SET LOCAL autocommit_before_ddl = false;

statement ok
ALTER TABLE t DROP CONSTRAINT "t_pkey"

statement ok
ALTER TABLE t ADD CONSTRAINT "t_pkey" PRIMARY KEY (y)

statement ok
ROLLBACK;

statement ok
DROP TABLE t;

statement ok
CREATE TABLE t (x INT PRIMARY KEY, y INT NOT NULL, FAMILY (x), FAMILY (y))  WITH (schema_locked = false)

statement ok
BEGIN TRANSACTION ISOLATION LEVEL SERIALIZABLE;
SET LOCAL autocommit_before_ddl = false;

statement ok
ALTER TABLE t DROP CONSTRAINT "t_pkey"

statement ok
ALTER TABLE t ADD CONSTRAINT "t_pkey_v2" PRIMARY KEY (y)

statement ok
COMMIT

query TT
SHOW CREATE t
----
t  CREATE TABLE public.t (
     x INT8 NOT NULL,
     y INT8 NOT NULL,
     CONSTRAINT t_pkey_v2 PRIMARY KEY (y ASC),
     FAMILY fam_0_x (x),
     FAMILY fam_1_y (y)
   );

# Ensure that we can't use a table with a dropped primary key
# in any DML statements.
statement ok
DROP TABLE t;

statement ok
CREATE TABLE t (x INT PRIMARY KEY, y INT NOT NULL) WITH (schema_locked = false)

statement ok
BEGIN TRANSACTION ISOLATION LEVEL SERIALIZABLE;
SET LOCAL autocommit_before_ddl = false;

statement ok
ALTER TABLE t DROP CONSTRAINT t_pkey

statement error pgcode 55C02 requested table does not have a primary key
INSERT INTO t VALUES (1, 1)

statement ok
ROLLBACK

statement ok
BEGIN TRANSACTION ISOLATION LEVEL SERIALIZABLE;
SET LOCAL autocommit_before_ddl = false;

statement ok
ALTER TABLE t DROP CONSTRAINT t_pkey

statement error pgcode 55C02 pq: requested table does not have a primary key
DELETE FROM t WHERE x = 1

statement ok
ROLLBACK

statement ok
BEGIN TRANSACTION ISOLATION LEVEL SERIALIZABLE;
SET LOCAL autocommit_before_ddl = false;

statement ok
ALTER TABLE t DROP CONSTRAINT t_pkey

statement error pgcode 55C02 pq: requested table does not have a primary key
UPDATE t SET x = 1 WHERE y = 1

statement ok
ROLLBACK

statement ok
BEGIN TRANSACTION ISOLATION LEVEL SERIALIZABLE;
SET LOCAL autocommit_before_ddl = false;

statement ok
ALTER TABLE t DROP CONSTRAINT t_pkey

statement error pgcode 55C02 pq: requested table does not have a primary key
SELECT * FROM t

statement ok
ROLLBACK

# Ensure that DDL statements that don't add a primary key
# as their first operation don't succeed either.

statement ok
BEGIN TRANSACTION ISOLATION LEVEL SERIALIZABLE;
SET LOCAL autocommit_before_ddl = false;

statement ok
ALTER TABLE t DROP CONSTRAINT t_pkey

statement error pgcode 55C02 pq: requested table does not have a primary key
CREATE INDEX ON t(x)

statement ok
ROLLBACK

statement ok
BEGIN TRANSACTION ISOLATION LEVEL SERIALIZABLE;
SET LOCAL autocommit_before_ddl = false;

statement ok
ALTER TABLE t DROP CONSTRAINT t_pkey

statement error pgcode 55C02 pq: requested table does not have a primary key
ALTER TABLE t ADD COLUMN z INT

statement ok
ROLLBACK

statement ok
BEGIN TRANSACTION ISOLATION LEVEL SERIALIZABLE;
SET LOCAL autocommit_before_ddl = false;

statement ok
ALTER TABLE t DROP CONSTRAINT t_pkey

statement error pgcode 55C02 pq: requested table does not have a primary key
ALTER TABLE t ADD COLUMN z INT, ADD PRIMARY KEY (x)

statement ok
ROLLBACK

# Ensure that other changes in the same transaction
# as a DROP PRIMARY KEY get rolled back on failure.
statement ok
DROP TABLE IF EXISTS t1, t2 CASCADE;

statement ok
CREATE TABLE t1 (x INT PRIMARY KEY, y INT NOT NULL) WITH (schema_locked = false);

statement ok
CREATE TABLE t2 (x INT) WITH (schema_locked = false)

statement ok
BEGIN TRANSACTION ISOLATION LEVEL SERIALIZABLE;
SET LOCAL autocommit_before_ddl = false;

statement ok
ALTER TABLE t1 DROP CONSTRAINT t1_pkey

statement ok
INSERT INTO t2 VALUES (1)

statement error pq: relation "t1" \([0-9]+\): unimplemented: primary key dropped without subsequent addition of new primary key in same transaction
COMMIT

query I
SELECT * FROM t2
----

statement ok
DROP TABLE IF EXISTS t;

statement disable-cf-mutator ok
CREATE TABLE t (x INT PRIMARY KEY, y INT NOT NULL) WITH (schema_locked = false)

onlyif config local-legacy-schema-changer
statement error pq: table "t" does not have a primary key, cannot perform ADD COLUMN z INT8 AS \(x \+ 1\) STORED
ALTER TABLE t DROP CONSTRAINT t_pkey, ADD COLUMN z INT AS (x + 1) STORED, ADD PRIMARY KEY (y)

# The declarative schema changer supports this, since it defers the primary key
# swap until it sees the new PK being added.
skipif config local-legacy-schema-changer
statement ok
ALTER TABLE t DROP CONSTRAINT t_pkey, ADD COLUMN z INT AS (x + 1) STORED, ADD PRIMARY KEY (y)

skipif config local-legacy-schema-changer
query TT
SHOW CREATE t
----
t  CREATE TABLE public.t (
     x INT8 NOT NULL,
     y INT8 NOT NULL,
     z INT8 NULL AS (x + 1:::INT8) STORED,
     CONSTRAINT t_pkey PRIMARY KEY (y ASC),
     UNIQUE INDEX t_x_key (x ASC)
   );

subtest create_table_change_pk

statement ok
DROP TABLE IF EXISTS t CASCADE

statement ok
BEGIN TRANSACTION ISOLATION LEVEL SERIALIZABLE;
SET LOCAL autocommit_before_ddl = false;

statement ok
CREATE TABLE t (x INT NOT NULL, y INT, FAMILY (x, y), INDEX (y))

statement ok
ALTER TABLE t ADD PRIMARY KEY (x)

statement ok
COMMIT

onlyif config schema-locked-disabled
query TT
SHOW CREATE t
----
t  CREATE TABLE public.t (
     x INT8 NOT NULL,
     y INT8 NULL,
     rowid INT8 NOT VISIBLE NOT NULL DEFAULT unique_rowid(),
     CONSTRAINT t_pkey PRIMARY KEY (x ASC),
     INDEX t_y_idx (y ASC),
     FAMILY fam_0_x_y_rowid (x, y, rowid)
   );

# Ensure that index y got rewritten. If it was not rewritten,
# it would have an id less than 3.
query IT
SELECT index_id, index_name FROM crdb_internal.table_indexes WHERE descriptor_name = 't' ORDER BY index_id
----
3  t_pkey
5  t_y_idx

# Repeat the above test using ALTER PRIMARY KEY.

statement ok
DROP TABLE IF EXISTS t

statement ok
BEGIN TRANSACTION ISOLATION LEVEL SERIALIZABLE;
SET LOCAL autocommit_before_ddl = false;

statement ok
CREATE TABLE t (x INT NOT NULL, y INT, FAMILY (x, y), INDEX (y))

statement ok
ALTER TABLE t ALTER PRIMARY KEY USING COLUMNS (x)

statement ok
COMMIT

onlyif config schema-locked-disabled
query TT
SHOW CREATE t
----
t  CREATE TABLE public.t (
     x INT8 NOT NULL,
     y INT8 NULL,
     rowid INT8 NOT VISIBLE NOT NULL DEFAULT unique_rowid(),
     CONSTRAINT t_pkey PRIMARY KEY (x ASC),
     INDEX t_y_idx (y ASC),
     FAMILY fam_0_x_y_rowid (x, y, rowid)
   );


skipif config schema-locked-disabled
query TT
SHOW CREATE t
----
t  CREATE TABLE public.t (
     x INT8 NOT NULL,
     y INT8 NULL,
     rowid INT8 NOT VISIBLE NOT NULL DEFAULT unique_rowid(),
     CONSTRAINT t_pkey PRIMARY KEY (x ASC),
     INDEX t_y_idx (y ASC),
     FAMILY fam_0_x_y_rowid (x, y, rowid)
   ) WITH (schema_locked = true);

# Ensure that index y got rewritten. If it was not rewritten,
# it would have an id less than 3.
query IT
SELECT index_id, index_name FROM crdb_internal.table_indexes WHERE descriptor_name = 't' ORDER BY index_id
----
3  t_pkey
5  t_y_idx

# Test when multiple indexes get created and destroyed.
statement ok
DROP TABLE IF EXISTS t

skip_on_retry

statement ok
BEGIN TRANSACTION ISOLATION LEVEL SERIALIZABLE;
SET LOCAL autocommit_before_ddl = false;

statement ok
CREATE TABLE t (
  x INT NOT NULL, y INT, z INT, w INT,
  INDEX i1 (y), UNIQUE INDEX i2 (z),
  INDEX i3 (w) STORING (y, z),
  FAMILY (x, y, z, w)
)

statement ok
ALTER TABLE t ADD PRIMARY KEY (x)

statement ok
COMMIT

onlyif config schema-locked-disabled
query TT
SHOW CREATE t
----
t  CREATE TABLE public.t (
     x INT8 NOT NULL,
     y INT8 NULL,
     z INT8 NULL,
     w INT8 NULL,
     rowid INT8 NOT VISIBLE NOT NULL DEFAULT unique_rowid(),
     CONSTRAINT t_pkey PRIMARY KEY (x ASC),
     INDEX i1 (y ASC),
     UNIQUE INDEX i2 (z ASC),
     INDEX i3 (w ASC) STORING (y, z),
     FAMILY fam_0_x_y_z_w_rowid (x, y, z, w, rowid)
   );

skipif config schema-locked-disabled
query TT
SHOW CREATE t
----
t  CREATE TABLE public.t (
     x INT8 NOT NULL,
     y INT8 NULL,
     z INT8 NULL,
     w INT8 NULL,
     rowid INT8 NOT VISIBLE NOT NULL DEFAULT unique_rowid(),
     CONSTRAINT t_pkey PRIMARY KEY (x ASC),
     INDEX i1 (y ASC),
     UNIQUE INDEX i2 (z ASC),
     INDEX i3 (w ASC) STORING (y, z),
     FAMILY fam_0_x_y_z_w_rowid (x, y, z, w, rowid)
   ) WITH (schema_locked = true);

# All index id's should be larger than 4.
query IT
SELECT index_id, index_name FROM crdb_internal.table_indexes WHERE descriptor_name = 't' ORDER BY index_id
----
5  t_pkey
7  i1
9  i2
11 i3

# Regression for #45889.
# Primary key changes on a hash sharded index that just change the bucket
# count shouldn't cause the old primary key to be copied.
statement ok
DROP TABLE IF EXISTS t CASCADE;

statement ok
CREATE TABLE t (x INT PRIMARY KEY USING HASH WITH (bucket_count=2));

statement ok
ALTER TABLE t ALTER PRIMARY KEY USING COLUMNS (x) USING HASH WITH (bucket_count=3)

# old shard column isn't removed by legacy schema changer.
onlyif config schema-locked-disabled
skipif config local-legacy-schema-changer
query TT
SHOW CREATE t
----
t  CREATE TABLE public.t (
     x INT8 NOT NULL,
     crdb_internal_x_shard_3 INT8 NOT VISIBLE NOT NULL AS (mod(fnv32(md5(crdb_internal.datums_to_bytes(x))), 3:::INT8)) VIRTUAL,
     CONSTRAINT t_pkey PRIMARY KEY (x ASC) USING HASH WITH (bucket_count=3, shard_columns=(x))
   );

skipif config schema-locked-disabled
query TT
SHOW CREATE t
----
t  CREATE TABLE public.t (
     x INT8 NOT NULL,
     crdb_internal_x_shard_3 INT8 NOT VISIBLE NOT NULL AS (mod(fnv32(md5(crdb_internal.datums_to_bytes(x))), 3:::INT8)) VIRTUAL,
     CONSTRAINT t_pkey PRIMARY KEY (x ASC) USING HASH WITH (bucket_count=3)
   ) WITH (schema_locked = true);

# Changes on a hash sharded index that change the columns will cause the old
# primary key to be copied.
statement ok
DROP TABLE t;

statement ok
CREATE TABLE t (x INT PRIMARY KEY USING HASH WITH (bucket_count=2), y INT NOT NULL, FAMILY (x, y));

statement ok
ALTER TABLE t ALTER PRIMARY KEY USING COLUMNS (y) USING HASH WITH (bucket_count=2)

onlyif config schema-locked-disabled
query TT
SHOW CREATE t
----
t  CREATE TABLE public.t (
     crdb_internal_x_shard_2 INT8 NOT VISIBLE NOT NULL AS (mod(fnv32(md5(crdb_internal.datums_to_bytes(x))), 2:::INT8)) VIRTUAL,
     x INT8 NOT NULL,
     y INT8 NOT NULL,
     crdb_internal_y_shard_2 INT8 NOT VISIBLE NOT NULL AS (mod(fnv32(md5(crdb_internal.datums_to_bytes(y))), 2:::INT8)) VIRTUAL,
     CONSTRAINT t_pkey PRIMARY KEY (y ASC) USING HASH WITH (bucket_count=2),
     UNIQUE INDEX t_x_key (x ASC) USING HASH WITH (bucket_count=2),
     FAMILY fam_0_x_y (x, y)
   );

skipif config schema-locked-disabled
query TT
SHOW CREATE t
----
t  CREATE TABLE public.t (
     crdb_internal_x_shard_2 INT8 NOT VISIBLE NOT NULL AS (mod(fnv32(md5(crdb_internal.datums_to_bytes(x))), 2:::INT8)) VIRTUAL,
     x INT8 NOT NULL,
     y INT8 NOT NULL,
     crdb_internal_y_shard_2 INT8 NOT VISIBLE NOT NULL AS (mod(fnv32(md5(crdb_internal.datums_to_bytes(y))), 2:::INT8)) VIRTUAL,
     CONSTRAINT t_pkey PRIMARY KEY (y ASC) USING HASH WITH (bucket_count=2),
     UNIQUE INDEX t_x_key (x ASC) USING HASH WITH (bucket_count=2),
     FAMILY fam_0_x_y (x, y)
   ) WITH (schema_locked = true);

# Validate ALTER ADD PRIMARY KEY idempotence for #59307
statement ok
DROP TABLE t1 CASCADE;

statement ok
create table t1(id integer not null, id2 integer not null, name varchar(32));

query TTT
SELECT index_name, column_name, direction
  FROM [SHOW INDEXES FROM t1]
  WHERE index_name LIKE 'primary%'
  ORDER BY 1,2,3;
----

statement ok
alter table t1 alter primary key using columns(id, id2);

# Row ID isn't removed by legacy schema changer.
skipif config local-legacy-schema-changer
query TTT
SELECT index_name, column_name, direction FROM [SHOW INDEXES FROM t1] ORDER BY 1,2,3
----
t1_pkey  id    ASC
t1_pkey  id2   ASC
t1_pkey  name  N/A

statement ok
alter table t1 alter primary key using columns(id, id2);

# Row ID isn't removed by legacy schema changer.
skipif config local-legacy-schema-changer
query TTT
SELECT index_name, column_name, direction FROM [SHOW INDEXES FROM t1] ORDER BY 1,2,3
----
t1_pkey  id    ASC
t1_pkey  id2   ASC
t1_pkey  name  N/A

# Validate ALTER PRIMARY KEY idempotence with USING HASH for #130191.
statement ok
DROP TABLE IF EXISTS t1;

statement ok
CREATE TABLE t1 (j INT NOT NULL);

statement ok
ALTER TABLE t1 ALTER PRIMARY KEY USING COLUMNS (j) USING HASH;

# Repeating the same ALTER PRIMARY KEY with USING HASH should be a no-op.
statement ok
ALTER TABLE t1 ALTER PRIMARY KEY USING COLUMNS (j) USING HASH;

# Confirm no schema change operations are generated for the no-op.
skipif config local-legacy-schema-changer
query T
EXPLAIN (DDL) ALTER TABLE t1 ALTER PRIMARY KEY USING COLUMNS (j) USING HASH;
----
Schema change plan for ALTER TABLE test.public.t1 ALTER PRIMARY KEY USING COLUMNS (j) USING HASH;
 ├── StatementPhase
 │    └── Stage 1 of 1 in StatementPhase
 └── PreCommitPhase
      └── Stage 1 of 1 in PreCommitPhase
           └── 1 Mutation operation
                └── UndoAllInTxnImmediateMutationOpSideEffects

skipif config local-legacy-schema-changer
query TTT
SELECT index_name, column_name, direction
  FROM [SHOW INDEXES FROM t1]
  WHERE index_name LIKE 't1_pkey%'
  ORDER BY seq_in_index;
----
t1_pkey  crdb_internal_j_shard_16  ASC
t1_pkey  j                         ASC

# Multi-column hash-sharded ALTER PRIMARY KEY idempotence.
statement ok
DROP TABLE IF EXISTS t1;

statement ok
CREATE TABLE t1 (a INT NOT NULL, b INT NOT NULL);

statement ok
ALTER TABLE t1 ALTER PRIMARY KEY USING COLUMNS (a, b) USING HASH;

# Repeating the same multi-column hash-sharded ALTER should be a no-op.
statement ok
ALTER TABLE t1 ALTER PRIMARY KEY USING COLUMNS (a, b) USING HASH;

skipif config local-legacy-schema-changer
query TTT
SELECT index_name, column_name, direction
  FROM [SHOW INDEXES FROM t1]
  WHERE index_name LIKE 't1_pkey%'
  ORDER BY seq_in_index;
----
t1_pkey  crdb_internal_a_b_shard_16  ASC
t1_pkey  a                           ASC
t1_pkey  b                           ASC

# Set up t1 for the next subtest.
statement ok
DROP TABLE IF EXISTS t1;

statement ok
create table t1(id integer not null, id2 integer not null, name varchar(32));

statement ok
alter table t1 alter primary key using columns(id, id2);

skipif config schema-locked-disabled
statement ok
ALTER TABLE t1 SET (schema_locked = false)

# Validate drop and recreate
statement ok
alter table t1 drop constraint t1_pkey, alter primary key using columns(id, id2);

skipif config schema-locked-disabled
statement ok
ALTER TABLE t1 SET (schema_locked = true)

# Row ID isn't removed by legacy schema changer.
skipif config local-legacy-schema-changer
query TTT
SELECT index_name, column_name, direction FROM [SHOW INDEXES FROM t1] ORDER BY 1,2,3
----
t1_pkey  id    ASC
t1_pkey  id2   ASC
t1_pkey  name  N/A

statement ok
alter table t1 alter primary key using columns(id);

# Row ID isn't removed by legacy schema changer.
skipif config local-legacy-schema-changer
query TTT
SELECT index_name, column_name, direction FROM [SHOW INDEXES FROM t1] ORDER BY 1,2,3
----
t1_id_id2_key  id    ASC
t1_id_id2_key  id2   ASC
t1_pkey        id    ASC
t1_pkey        id2   N/A
t1_pkey        name  N/A

statement ok
alter table t1 alter primary key using columns(id desc);

# Row ID isn't removed by legacy schema changer.
skipif config local-legacy-schema-changer
query TTT
SELECT index_name, column_name, direction FROM [SHOW INDEXES FROM t1] ORDER BY 1,2,3
----
t1_id_id2_key  id    ASC
t1_id_id2_key  id2   ASC
t1_id_key      id    ASC
t1_pkey        id    DESC
t1_pkey        id2   N/A
t1_pkey        name  N/A


statement ok
alter table t1 alter primary key using columns(id desc);

# Row ID isn't removed by legacy schema changer.
skipif config local-legacy-schema-changer
query TTT
SELECT index_name, column_name, direction FROM [SHOW INDEXES FROM t1] ORDER BY 1,2,3
----
t1_id_id2_key  id    ASC
t1_id_id2_key  id2   ASC
t1_id_key      id    ASC
t1_pkey        id    DESC
t1_pkey        id2   N/A
t1_pkey        name  N/A

statement ok
alter table t1 alter primary key using columns(id desc);

# Row ID isn't removed by legacy schema changer.
skipif config local-legacy-schema-changer
query TTT
SELECT index_name, column_name, direction FROM [SHOW INDEXES FROM t1] ORDER BY 1,2,3
----
t1_id_id2_key  id    ASC
t1_id_id2_key  id2   ASC
t1_id_key      id    ASC
t1_pkey        id    DESC
t1_pkey        id2   N/A
t1_pkey        name  N/A

statement ok
alter table t1 alter primary key using columns(id) USING HASH WITH (bucket_count=10)

# Row ID isn't removed by legacy schema changer.
skipif config local-legacy-schema-changer
query TTT
SELECT index_name, column_name, direction FROM [SHOW INDEXES FROM t1] ORDER BY 1,2,3
----
t1_id_id2_key  crdb_internal_id_shard_10  ASC
t1_id_id2_key  id                         ASC
t1_id_id2_key  id2                        ASC
t1_id_key      crdb_internal_id_shard_10  ASC
t1_id_key      id                         ASC
t1_id_key1     crdb_internal_id_shard_10  ASC
t1_id_key1     id                         DESC
t1_pkey        crdb_internal_id_shard_10  ASC
t1_pkey        id                         ASC
t1_pkey        id2                        N/A
t1_pkey        name                       N/A

statement ok
CREATE TABLE table_with_virtual_cols (
  id INT PRIMARY KEY,
  new_pk INT NOT NULL,
  virtual_col INT AS (1::int) VIRTUAL,
  FAMILY (id, new_pk)
);
ALTER TABLE table_with_virtual_cols ALTER PRIMARY KEY USING COLUMNS (new_pk)

onlyif config schema-locked-disabled
query TT
SHOW CREATE TABLE table_with_virtual_cols
----
table_with_virtual_cols  CREATE TABLE public.table_with_virtual_cols (
                           id INT8 NOT NULL,
                           new_pk INT8 NOT NULL,
                           virtual_col INT8 NULL AS (1:::INT8) VIRTUAL,
                           CONSTRAINT table_with_virtual_cols_pkey PRIMARY KEY (new_pk ASC),
                           UNIQUE INDEX table_with_virtual_cols_id_key (id ASC),
                           FAMILY fam_0_id_new_pk (id, new_pk)
                         );

skipif config schema-locked-disabled
query TT
SHOW CREATE TABLE table_with_virtual_cols
----
table_with_virtual_cols  CREATE TABLE public.table_with_virtual_cols (
                           id INT8 NOT NULL,
                           new_pk INT8 NOT NULL,
                           virtual_col INT8 NULL AS (1:::INT8) VIRTUAL,
                           CONSTRAINT table_with_virtual_cols_pkey PRIMARY KEY (new_pk ASC),
                           UNIQUE INDEX table_with_virtual_cols_id_key (id ASC),
                           FAMILY fam_0_id_new_pk (id, new_pk)
                         ) WITH (schema_locked = true);

# Test that we do not create new indexes for the old primary key when going
# from sharded to non-sharded and back.
subtest toggle_sharded_no_new_index

statement ok
DROP TABLE IF EXISTS t;

statement ok
CREATE TABLE t (i INT PRIMARY KEY)

query TTT
SELECT index_name,column_name,direction FROM [SHOW INDEXES FROM t]
----
t_pkey  i  ASC

statement ok
ALTER TABLE t ALTER PRIMARY KEY USING COLUMNS (i) USING HASH WITH (bucket_count=2)

query TTT rowsort
SELECT index_name,column_name,direction FROM [SHOW INDEXES FROM t]
----
t_pkey  crdb_internal_i_shard_2  ASC
t_pkey  i                        ASC

statement ok
ALTER TABLE t ALTER PRIMARY KEY USING COLUMNS (i);

query TTT
SELECT index_name,column_name,direction FROM [SHOW INDEXES FROM t]
----
t_pkey  i                        ASC

subtest virtual_primary_index
statement ok
DROP TABLE IF EXISTS t;

statement ok
CREATE TABLE t (
  a INT NOT NULL,
  b INT NOT NULL,
  k INT NOT NULL AS (a+b) VIRTUAL,
  PRIMARY KEY (a),
  INDEX t_idx_b_k (b, k),
  FAMILY "primary" (a, b)
);

statement ok
INSERT INTO t VALUES (1,2), (3,4);

query III colnames,rowsort
SELECT * FROM t@t_pkey;
----
a  b  k
1  2  3
3  4  7

query III colnames,rowsort
SELECT * FROM t@t_idx_b_k;
----
a  b  k
1  2  3
3  4  7

statement ok
ALTER TABLE t ALTER PRIMARY KEY USING COLUMNS (k);

onlyif config schema-locked-disabled
query T
SELECT create_statement FROM [SHOW CREATE TABLE t];
----
CREATE TABLE public.t (
  a INT8 NOT NULL,
  b INT8 NOT NULL,
  k INT8 NOT NULL AS (a + b) VIRTUAL,
  CONSTRAINT t_pkey PRIMARY KEY (k ASC),
  INDEX t_idx_b_k (b ASC, k ASC),
  UNIQUE INDEX t_a_key (a ASC)
);

skipif config schema-locked-disabled
query T
SELECT create_statement FROM [SHOW CREATE TABLE t];
----
CREATE TABLE public.t (
  a INT8 NOT NULL,
  b INT8 NOT NULL,
  k INT8 NOT NULL AS (a + b) VIRTUAL,
  CONSTRAINT t_pkey PRIMARY KEY (k ASC),
  INDEX t_idx_b_k (b ASC, k ASC),
  UNIQUE INDEX t_a_key (a ASC)
) WITH (schema_locked = true);

query III colnames,rowsort
SELECT * FROM t@t_pkey
----
a  b  k
1  2  3
3  4  7

query III colnames,rowsort
SELECT * FROM t@t_a_key
----
a  b  k
1  2  3
3  4  7

query III colnames,rowsort
SELECT * FROM t@t_idx_b_k
----
a  b  k
1  2  3
3  4  7

statement ok
ALTER TABLE t ALTER PRIMARY KEY USING COLUMNS (b, k);

onlyif config schema-locked-disabled
query T
SELECT create_statement FROM [SHOW CREATE TABLE t];
----
CREATE TABLE public.t (
  a INT8 NOT NULL,
  b INT8 NOT NULL,
  k INT8 NOT NULL AS (a + b) VIRTUAL,
  CONSTRAINT t_pkey PRIMARY KEY (b ASC, k ASC),
  INDEX t_idx_b_k (b ASC, k ASC),
  UNIQUE INDEX t_a_key (a ASC),
  UNIQUE INDEX t_k_key (k ASC)
);


skipif config schema-locked-disabled
query T
SELECT create_statement FROM [SHOW CREATE TABLE t];
----
CREATE TABLE public.t (
  a INT8 NOT NULL,
  b INT8 NOT NULL,
  k INT8 NOT NULL AS (a + b) VIRTUAL,
  CONSTRAINT t_pkey PRIMARY KEY (b ASC, k ASC),
  INDEX t_idx_b_k (b ASC, k ASC),
  UNIQUE INDEX t_a_key (a ASC),
  UNIQUE INDEX t_k_key (k ASC)
) WITH (schema_locked = true);

query III colnames,rowsort
SELECT * FROM t@t_pkey
----
a  b  k
1  2  3
3  4  7

query III colnames,rowsort
SELECT * FROM t@t_a_key
----
a  b  k
1  2  3
3  4  7

query III colnames,rowsort
SELECT * FROM t@t_k_key
----
a  b  k
1  2  3
3  4  7

query III colnames,rowsort
SELECT * FROM t@t_idx_b_k
----
a  b  k
1  2  3
3  4  7

statement ok
ALTER TABLE t ALTER PRIMARY KEY USING COLUMNS (a);

onlyif config schema-locked-disabled
query T
SELECT create_statement FROM [SHOW CREATE TABLE t];
----
CREATE TABLE public.t (
  a INT8 NOT NULL,
  b INT8 NOT NULL,
  k INT8 NOT NULL AS (a + b) VIRTUAL,
  CONSTRAINT t_pkey PRIMARY KEY (a ASC),
  INDEX t_idx_b_k (b ASC, k ASC),
  UNIQUE INDEX t_a_key (a ASC),
  UNIQUE INDEX t_k_key (k ASC),
  UNIQUE INDEX t_b_k_key (b ASC, k ASC)
);


skipif config schema-locked-disabled
query T
SELECT create_statement FROM [SHOW CREATE TABLE t];
----
CREATE TABLE public.t (
  a INT8 NOT NULL,
  b INT8 NOT NULL,
  k INT8 NOT NULL AS (a + b) VIRTUAL,
  CONSTRAINT t_pkey PRIMARY KEY (a ASC),
  INDEX t_idx_b_k (b ASC, k ASC),
  UNIQUE INDEX t_a_key (a ASC),
  UNIQUE INDEX t_k_key (k ASC),
  UNIQUE INDEX t_b_k_key (b ASC, k ASC)
) WITH (schema_locked = true);

query III colnames,rowsort
SELECT * FROM t@t_pkey
----
a  b  k
1  2  3
3  4  7

query III colnames,rowsort
SELECT * FROM t@t_a_key
----
a  b  k
1  2  3
3  4  7

query III colnames,rowsort
SELECT * FROM t@t_k_key
----
a  b  k
1  2  3
3  4  7

query III colnames,rowsort
SELECT * FROM t@t_idx_b_k
----
a  b  k
1  2  3
3  4  7

query III colnames,rowsort
SELECT * FROM t@t_b_k_key
----
a  b  k
1  2  3
3  4  7

