# cluster-opt: disable-mvcc-range-tombstones-for-point-deletes

statement ok
SET kv_transaction_buffered_writes_enabled=true

statement ok
CREATE TABLE t1 (pk int primary key, v int, FAMILY (pk, v))

subtest point_delete

statement ok
INSERT INTO t1 VALUES (1,1)

statement ok
BEGIN

statement count 1
DELETE FROM t1 WHERE pk = 1

statement count 0
DELETE FROM t1 WHERE pk = 3

statement ok
COMMIT

subtest repeated_point_delete

statement ok
INSERT INTO t1 VALUES (1,1)

statement ok
BEGIN

statement count 1
DELETE FROM t1 WHERE pk = 1

# The second delete should be served from the write buffer and observe
# the buffered tombstone.
statement count 0
DELETE FROM t1 WHERE pk = 1

statement ok
COMMIT

subtest point_delete_after_write

statement ok
BEGIN

statement ok
INSERT INTO t1 VALUES (1,1)

statement count 1
DELETE FROM t1 WHERE pk = 1

# The second delete should be served from the write buffer and observe
# the buffered tombstone.
statement count 0
DELETE FROM t1 WHERE pk = 1

statement ok
COMMIT

subtest delete_then_insert

statement ok
INSERT INTO t1 VALUES (1,1)

statement ok
BEGIN

statement count 1
DELETE FROM t1 WHERE pk = 1

statement ok
INSERT INTO t1 VALUES (1,1)

statement ok
COMMIT

query II
SELECT * FROM t1
----
1 1

statement ok
CREATE TABLE t2 (k INT PRIMARY KEY);

statement ok
BEGIN;

statement error pgcode 23505 duplicate key value violates unique constraint "t2_pkey"
INSERT INTO t2 VALUES (1), (1);

statement ok
ROLLBACK;

statement ok
BEGIN;

statement ok
INSERT INTO t2 VALUES (1);

statement error pgcode 23505 duplicate key value violates unique constraint "t2_pkey"
INSERT INTO t2 VALUES (1);

statement ok
ROLLBACK;

statement ok
BEGIN;

statement ok
INSERT INTO t2 VALUES (1);

statement ok
DELETE FROM t2 WHERE k = 1;

statement ok
INSERT INTO t2 VALUES (1);

statement ok
COMMIT;

query I
SELECT * FROM t2
----
1
