# These tests specifically for assignment cast situations.
subtest assignment_casts

statement ok
CREATE TABLE a (a timestamp)

statement ok
INSERT INTO a VALUES ('1970-01-01'::timestamptz)

query T
SELECT * FROM a ORDER BY a
----
1970-01-01 00:00:00 +0000 +0000

statement ok
UPSERT INTO a VALUES ('1971-01-01'::timestamptz)

query T
SELECT * FROM a ORDER BY a
----
1970-01-01 00:00:00 +0000 +0000
1971-01-01 00:00:00 +0000 +0000

statement ok
UPDATE a SET a = '2001-01-01'::timestamptz WHERE 1 = 1

query T
SELECT * FROM a ORDER BY a
----
2001-01-01 00:00:00 +0000 +0000
2001-01-01 00:00:00 +0000 +0000
