# Tests for assignment casts.
subtest assignment_casts

statement ok
CREATE TABLE assn_cast (
  c CHAR,
  vc VARCHAR(1),
  qc "char",
  b BIT,
  i INT,
  i2 INT2,
  f4 FLOAT4,
  t timestamp,
  d DECIMAL(10, 0),
  a DECIMAL(10, 0)[],
  s STRING,
  ca CHAR[],
  vba VARBIT(1)[]
)

statement ok
INSERT INTO assn_cast(c) VALUES ('a')

statement ok
INSERT INTO assn_cast(c) VALUES (null), ('b')

statement error value too long for type CHAR
INSERT INTO assn_cast(c) VALUES ('abc')

query T
INSERT INTO assn_cast(c) VALUES (1) RETURNING c
----
1

statement error value too long for type CHAR
INSERT INTO assn_cast(c) VALUES (123)

statement ok
PREPARE insert_c AS INSERT INTO assn_cast(c) VALUES ($1)

statement error value too long for type CHAR
EXECUTE insert_c('foo')

statement error value too long for type CHAR
EXECUTE insert_c('foo'::STRING)

statement ok
DELETE FROM assn_cast

statement ok
EXECUTE insert_c(' ')

statement ok
EXECUTE insert_c(' '::STRING)

query T rowsort
SELECT concat('"', c, '"') FROM assn_cast
----
""
""

statement ok
INSERT INTO assn_cast(vc) VALUES ('a')

statement ok
INSERT INTO assn_cast(vc) VALUES (null), ('b')

statement error value too long for type VARCHAR\(1\)
INSERT INTO assn_cast(vc) VALUES ('abc')

query T
INSERT INTO assn_cast(vc) VALUES (1) RETURNING vc
----
1

statement error value too long for type VARCHAR\(1\)
INSERT INTO assn_cast(vc) VALUES (123)

statement ok
INSERT INTO assn_cast(qc) VALUES ('a')

statement ok
INSERT INTO assn_cast(qc) VALUES (null), ('b')

query T
INSERT INTO assn_cast(qc) VALUES ('abc') RETURNING qc
----
a

# Note: This statement fails in Postgres because the default integer type is an
# INT4, and the INT4 -> "char" cast is explicit. Our default integer type
# is an INT8 and INT8 -> "char" is an assignment cast.
query T
INSERT INTO assn_cast(qc) VALUES (123) RETURNING qc
----
{

# An integer to "char" cast converts the integer into the corresponding 7-bit
# ASCII character. Anything greater than 127 is out of range.
statement error \"char\" out of range
INSERT INTO assn_cast(qc) VALUES (1234)

statement ok
PREPARE insert_qc AS INSERT INTO assn_cast(qc) VALUES ($1)

statement ok
DELETE FROM assn_cast

statement ok
EXECUTE insert_qc('foo')

statement ok
EXECUTE insert_qc('foo'::STRING)

query T rowsort
SELECT qc FROM assn_cast
----
f
f

statement ok
INSERT into assn_cast(b) VALUES ('1')

statement ok
INSERT INTO assn_cast(b) VALUES (null), ('1')

# TODO(mgartner): To match Postgres behavior, this statement should fail with
# the message "value too long for type BIT".
statement ok
INSERT into assn_cast(b) VALUES ('01')

statement error value type int doesn't match type bit of column \"b\"
INSERT into assn_cast(b) VALUES (1)

statement ok
INSERT INTO assn_cast(i) VALUES ('1')

statement ok
INSERT INTO assn_cast(i) VALUES (null), ('1')

statement ok
PREPARE insert_i AS INSERT INTO assn_cast(i) VALUES ($1)

statement ok
EXECUTE insert_i('1')

statement error value type string doesn't match type int of column \"i\"
INSERT INTO assn_cast(i) VALUES ('1'::STRING)

statement error integer out of range for type int2
INSERT INTO assn_cast(i2) VALUES (999999999)

statement ok
PREPARE insert_i2 AS INSERT INTO assn_cast(i2) VALUES ($1)

statement error integer out of range for type int2
EXECUTE insert_i2(99999999)

statement ok
INSERT INTO assn_cast(f4) VALUES (18754999.99)

statement ok
PREPARE insert_f4 AS INSERT INTO assn_cast(f4) VALUES ($1)

statement ok
EXECUTE insert_f4(18754999.99)

query F rowsort
SELECT f4 FROM assn_cast WHERE f4 IS NOT NULL
----
1.8755e+07
1.8755e+07

statement ok
INSERT INTO assn_cast(t) VALUES ('1970-01-01'::timestamptz)

statement ok
INSERT INTO assn_cast(d) VALUES (11.22), (88.99)

statement ok
INSERT INTO assn_cast(d) VALUES (22.33::DECIMAL(10, 0)), (99.11::DECIMAL(10, 2))

statement ok
INSERT INTO assn_cast(d) VALUES (33.11::DECIMAL(10, 0)), (44.44::DECIMAL(10, 0))

statement ok
PREPARE insert_d AS INSERT INTO assn_cast(d) VALUES ($1)

statement ok
EXECUTE insert_d(123.45)

statement ok
PREPARE insert_d2 AS INSERT INTO assn_cast(d) SELECT * FROM (VALUES ($1::DECIMAL(10, 2)))

statement ok
EXECUTE insert_d2(67.89)

query F rowsort
SELECT d FROM assn_cast WHERE d IS NOT NULL
----
11
89
22
99
33
44
123
68

statement ok
INSERT INTO assn_cast(a) VALUES (ARRAY[])

statement ok
INSERT INTO assn_cast(a) VALUES (ARRAY[NULL])

statement ok
INSERT INTO assn_cast(a) VALUES (ARRAY[1.1])

statement ok
INSERT INTO assn_cast(a) VALUES (ARRAY[2.88, NULL, 15])

statement ok
INSERT INTO assn_cast(a) VALUES (ARRAY[3.99, NULL, 16]::DECIMAL(10, 2)[])

statement ok
INSERT INTO assn_cast(a) VALUES (ARRAY[5.55, 6.66::DECIMAL(10, 2)])

statement ok
PREPARE insert_a AS INSERT INTO assn_cast(a) VALUES ($1)

statement ok
EXECUTE insert_a(ARRAY[7.77, 8.88::DECIMAL(10, 2)])

statement ok
PREPARE insert_a2 AS INSERT INTO assn_cast(a) VALUES (ARRAY[$1])

statement ok
EXECUTE insert_a2(20.2)

statement ok
PREPARE insert_a3 AS INSERT INTO assn_cast(a) VALUES (ARRAY[30.12, $1, 32.1])

statement ok
EXECUTE insert_a3(30.9)

query T rowsort
SELECT a FROM assn_cast WHERE a IS NOT NULL
----
{}
{NULL}
{1}
{3,NULL,15}
{4,NULL,16}
{6,7}
{8,9}
{20}
{30,31,32}

statement ok
INSERT INTO assn_cast(s) VALUES (1)

statement ok
PREPARE insert_s AS INSERT INTO assn_cast(s) VALUES ($1)

statement ok
EXECUTE insert_s(2)

query T rowsort
SELECT s FROM assn_cast WHERE s IS NOT NULL
----
1
2

statement error pgcode 22001 value too long for type CHAR
INSERT INTO assn_cast(ca) VALUES (ARRAY['foo', 'a'])

statement ok
PREPARE insert_ca AS INSERT INTO assn_cast(ca) VALUES ($1)

statement error pgcode 22001 value too long for type CHAR
EXECUTE insert_ca(ARRAY['a', 'foo'])

statement error pgcode 22001 bit string length 2 too large for type VARBIT\(1\)
INSERT INTO assn_cast(vba) VALUES (ARRAY[B'11', B'1'])

statement ok
PREPARE insert_vba AS INSERT INTO assn_cast(vba) VALUES ($1)

statement error pgcode 22001 bit string length 2 too large for type VARBIT\(1\)
EXECUTE insert_vba(ARRAY[B'1', B'11'])

# Tests for assignment casts of DEFAULT expressions.
subtest assignment_casts_default

statement ok
CREATE TABLE assn_cast_int_default (
  k INT,
  -- TODO(mgartner): This should not cause the CREATE TABLE statement to fail.
  -- See #74090.
  -- i1 INT2 DEFAULT 9999999,
  i2 INT2 DEFAULT 9999999::INT
)

statement error integer out of range for type int2
INSERT INTO assn_cast_int_default(k) VALUES (1)

statement ok
CREATE TABLE assn_cast_char_default (
  c CHAR DEFAULT 'foo'::TEXT,
  c2 CHAR(2) DEFAULT 'bar',
  qc "char" DEFAULT 'baz'
)

# The default value of c is too long.
statement error value too long for type CHAR
INSERT INTO assn_cast_char_default(c2) VALUES ('ab')

# The default value of c2 is too long.
statement error value too long for type CHAR\(2\)
INSERT INTO assn_cast_char_default(c) VALUES ('a')

# The default value of qc is truncated when inserted.
statement ok
INSERT INTO assn_cast_char_default(c, c2) VALUES ('a', 'ab')

query TTT
SELECT * FROM assn_cast_char_default
----
a ab b

statement ok
CREATE TABLE assn_cast_dec_default (
  k INT,
  d DECIMAL(10, 0) DEFAULT 1.56::DECIMAL(10, 2),
  d1 DECIMAL(10, 1) DEFAULT 1.58
)

statement ok
INSERT INTO assn_cast_dec_default(k) VALUES (1)

query IRR
SELECT * FROM assn_cast_dec_default
----
1  2  1.6


# Tests for assignment casts in UPDATEs.
subtest assignment_casts_update

statement ok
DELETE FROM assn_cast

statement ok
INSERT INTO assn_cast (c) VALUES (NULL)

statement error value too long for type CHAR
UPDATE assn_cast SET c = 'abc'

query T
UPDATE assn_cast SET c = 1 RETURNING c
----
1

statement error value too long for type CHAR
UPDATE assn_cast SET c = 123

statement ok
UPDATE assn_cast SET c = NULL

statement ok
PREPARE update_c AS UPDATE assn_cast SET c = $1

statement error value too long for type CHAR
EXECUTE update_c('foo')

statement error value too long for type CHAR
EXECUTE update_c('foo'::STRING)

statement ok
EXECUTE update_c(' ')

query T
SELECT concat('"', c, '"') FROM assn_cast
----
""

statement ok
EXECUTE update_c(' '::STRING)

query T
SELECT concat('"', c, '"') FROM assn_cast
----
""

statement ok
UPDATE assn_cast SET qc = 'a'

query T
UPDATE assn_cast SET qc = 'abc' RETURNING qc
----
a

# An integer to "char" cast converts the integer into the corresponding 7-bit
# ASCII character. Anything greater than 127 is out of range.
statement error \"char\" out of range
UPDATE assn_cast SET qc = 1234

statement ok
PREPARE update_qc AS UPDATE assn_cast SET qc = $1

statement ok
EXECUTE update_qc('foo')

query T
SELECT qc FROM assn_cast
----
f

statement ok
EXECUTE update_qc('foo'::STRING)

query T
SELECT qc FROM assn_cast
----
f

statement ok
UPDATE assn_cast SET i = '1'

statement ok
PREPARE update_i AS UPDATE assn_cast SET i = $1

statement ok
EXECUTE update_i('1')

statement error value type string doesn't match type int of column \"i\"
UPDATE assn_cast SET i = '1'::STRING

statement error integer out of range for type int2
UPDATE assn_cast SET i2 = 999999999

statement ok
PREPARE update_i2 AS UPDATE assn_cast SET i2 = $1

statement error integer out of range for type int2
EXECUTE update_i2(99999999)

query F
UPDATE assn_cast SET d = 11.22 RETURNING d
----
11

query F
UPDATE assn_cast SET d = 11.22::DECIMAL(10, 0) RETURNING d
----
11

query F
UPDATE assn_cast SET d = 11.22::DECIMAL(10, 2) RETURNING d
----
11

statement ok
PREPARE update_d AS UPDATE assn_cast SET d = $1

statement ok
EXECUTE update_d(123.45)

query F
SELECT d FROM assn_cast
----
123

statement ok
PREPARE update_d2 AS UPDATE assn_cast SET d = (SELECT * FROM (VALUES ($1::DECIMAL(10, 2))))

statement ok
EXECUTE update_d2(67.89)

query F
SELECT d FROM assn_cast
----
68

query T
UPDATE assn_cast SET a = ARRAY[] RETURNING a
----
{}

query T
UPDATE assn_cast SET a = ARRAY[NULL] RETURNING a
----
{NULL}

query T
UPDATE assn_cast SET a = ARRAY[1.1] RETURNING a
----
{1}

query T
UPDATE assn_cast SET a = ARRAY[2.88, NULL, 15] RETURNING a
----
{3,NULL,15}

query T
UPDATE assn_cast SET a = ARRAY[3.99, NULL, 16]::DECIMAL(10, 2)[] RETURNING a
----
{4,NULL,16}

query T
UPDATE assn_cast SET a = ARRAY[5.55, 6.66::DECIMAL(10, 2)] RETURNING a
----
{6,7}

statement ok
PREPARE update_a AS UPDATE assn_cast SET a = $1

statement ok
EXECUTE update_a(ARRAY[7.77, 8.88::DECIMAL(10, 2)])

query T
SELECT a FROM assn_cast
----
{8,9}

statement ok
PREPARE update_a2 AS UPDATE assn_cast SET a = ARRAY[$1]

statement ok
EXECUTE update_a2(20.2)

query T
SELECT a FROM assn_cast
----
{20}

statement ok
PREPARE update_a3 AS UPDATE assn_cast SET a = ARRAY[30.12, $1, 32.1]

statement ok
EXECUTE update_a3(30.9)

query T
SELECT a FROM assn_cast
----
{30,31,32}

statement error value type tuple{int, int} doesn't match type timestamp of column "t"
UPDATE assn_cast SET t = (SELECT (10, 11))

statement error value type decimal doesn't match type timestamp of column "t"
UPDATE assn_cast SET t = 3.2

statement error value type decimal doesn't match type timestamp of column "t"
UPDATE assn_cast SET (i, t) = (1, 3.2)


# Tests for assignment casts in UPSERTs.
subtest assignment_casts_upsert

statement ok
CREATE TABLE assn_cast_upsert (
  k INT PRIMARY KEY,
  c CHAR,
  qc "char",
  i2 INT2,
  d DECIMAL(10, 0),
  a DECIMAL(10, 0)[]
)

statement error value too long for type CHAR
UPSERT INTO assn_cast_upsert (k, c) VALUES (1, 'abc')

statement ok
UPSERT INTO assn_cast_upsert (k, c) VALUES (1, 'a')

statement error value too long for type CHAR
UPSERT INTO assn_cast_upsert (k, c) VALUES (1, 'def')

statement error value too long for type CHAR
UPSERT INTO assn_cast_upsert (k, c) VALUES ('1', 'def')

statement error value too long for type CHAR
UPSERT INTO assn_cast_upsert (k, c) VALUES (1, 123)

statement error value type string doesn't match type int of column \"k\"
UPSERT INTO assn_cast_upsert (k, c) VALUES ('1'::STRING, 'b')

statement ok
UPSERT INTO assn_cast_upsert (k, c) VALUES (1, 'b')

statement ok
UPSERT INTO assn_cast_upsert (k, c) VALUES ('1', 'c')

statement ok
UPSERT INTO assn_cast_upsert (k, c) VALUES (1, NULL)

statement ok
PREPARE upsert_c AS UPSERT INTO assn_cast_upsert (k, c) VALUES ($1, $2)

statement error value too long for type CHAR
EXECUTE upsert_c(1, 'foo')

statement error value too long for type CHAR
EXECUTE upsert_c(2, 'foo')

statement error value too long for type CHAR
EXECUTE upsert_c(1, 'foo'::STRING)

statement ok
EXECUTE upsert_c(1, ' ')

statement ok
EXECUTE upsert_c(2, ' ')

query IT rowsort
SELECT k, concat('"', c, '"') FROM assn_cast_upsert
----
1  ""
2  ""

statement ok
EXECUTE upsert_c(1, ' '::STRING)

statement ok
EXECUTE upsert_c(3, ' '::STRING)

query IT rowsort
SELECT k, concat('"', c, '"') FROM assn_cast_upsert
----
1  ""
2  ""
3  ""

statement ok
DELETE FROM assn_cast_upsert

statement ok
UPSERT INTO assn_cast_upsert (k, qc) VALUES (1, 'a')

query T
UPSERT INTO assn_cast_upsert (k, qc) VALUES (1, 'abc') RETURNING qc
----
a

# An integer to "char" cast converts the integer into the corresponding 7-bit
# ASCII character. Anything greater than 127 is out of range.
statement error \"char\" out of range
UPSERT INTO assn_cast_upsert (k, qc) VALUES (1, 1234)

statement ok
PREPARE upsert_qc AS UPSERT INTO assn_cast_upsert (k, qc) VALUES ($1, $2)

statement ok
EXECUTE upsert_qc(1, 'foo')

query T
SELECT qc FROM assn_cast_upsert
----
f

statement ok
EXECUTE upsert_qc(1, 'bar'::STRING)

query T
SELECT qc FROM assn_cast_upsert
----
b

statement error integer out of range for type int2
UPSERT INTO assn_cast_upsert (k, i2) VALUES (1, 999999999)

statement ok
PREPARE upsert_i2 AS UPSERT INTO assn_cast_upsert (k, i2) VALUES ($1, $2)

statement error integer out of range for type int2
EXECUTE upsert_i2(1, 99999999)

query F
UPSERT INTO assn_cast_upsert (k, d) VALUES (1, 11.22) RETURNING d
----
11

query F
UPSERT INTO assn_cast_upsert (k, d) VALUES (1, 11.22::DECIMAL(10, 0)) RETURNING d
----
11

query F
UPSERT INTO assn_cast_upsert (k, d) VALUES (1, 11.22::DECIMAL(10, 2)) RETURNING d
----
11

statement ok
PREPARE upsert_d AS UPSERT INTO assn_cast_upsert (k, d) VALUES ($1, $2)

statement ok
EXECUTE upsert_d(1, 123.45)

query F
SELECT d FROM assn_cast_upsert
----
123

statement ok
PREPARE upsert_d2 AS UPSERT INTO assn_cast_upsert (k, d) VALUES (1, (SELECT * FROM (VALUES ($1::DECIMAL(10, 2)))))

statement ok
EXECUTE upsert_d2(67.89)

query F
SELECT d FROM assn_cast_upsert
----
68

query T
UPSERT INTO assn_cast_upsert (k, a) VALUES (1, ARRAY[]) RETURNING a
----
{}

query T
UPSERT INTO assn_cast_upsert (k, a) VALUES (1, ARRAY[NULL]) RETURNING a
----
{NULL}

query T
UPSERT INTO assn_cast_upsert (k, a) VALUES (1, ARRAY[1.1]) RETURNING a
----
{1}

query T
UPSERT INTO assn_cast_upsert (k, a) VALUES (1, ARRAY[2.88, NULL, 15]) RETURNING a
----
{3,NULL,15}

query T
UPSERT INTO assn_cast_upsert (k, a) VALUES (1, ARRAY[3.99, NULL, 16]::DECIMAL(10, 2)[]) RETURNING a
----
{4,NULL,16}

query T
UPSERT INTO assn_cast_upsert (k, a) VALUES (1, ARRAY[5.55, 6.66::DECIMAL(10, 2)]) RETURNING a
----
{6,7}

statement ok
PREPARE upsert_a AS UPSERT INTO assn_cast_upsert (k, a) VALUES ($1, $2)

statement ok
EXECUTE upsert_a(1, ARRAY[7.77, 8.88::DECIMAL(10, 2)])

query T
SELECT a FROM assn_cast_upsert
----
{8,9}

statement ok
PREPARE upsert_a2 AS UPSERT INTO assn_cast_upsert (k, a) VALUES ($1, ARRAY[$2])

statement ok
EXECUTE upsert_a2(1, 20.2)

query T
SELECT a FROM assn_cast_upsert
----
{20}

statement ok
PREPARE upsert_a3 AS UPSERT INTO assn_cast_upsert (k, a) VALUES ($1, ARRAY[30.12, $2, 32.1])

statement ok
EXECUTE upsert_a3(1, 30.9)

query T
SELECT a FROM assn_cast_upsert
----
{30,31,32}


# Tests for assignment casts in INSERT .. ON CONFLICT .. DO NOTHING.
subtest assignment_casts_insert_do_nothing

statement ok
CREATE TABLE assn_cast_do_nothing (
  k INT PRIMARY KEY,
  d DECIMAL(10, 0) UNIQUE,
  c CHAR UNIQUE
)

statement error value too long for type CHAR
INSERT INTO assn_cast_do_nothing VALUES (1, 2.34, 'abc') ON CONFLICT DO NOTHING

statement ok
INSERT INTO assn_cast_do_nothing VALUES (1, 2.34, 'a') ON CONFLICT DO NOTHING

# Conflict with k.
statement ok
INSERT INTO assn_cast_do_nothing VALUES (1, 5.67, 'b') ON CONFLICT DO NOTHING

# Conflict with d.
statement ok
INSERT INTO assn_cast_do_nothing VALUES (2, 2.34, 'b') ON CONFLICT DO NOTHING

# Conflict with c.
statement ok
INSERT INTO assn_cast_do_nothing VALUES (2, 5.67, 'a') ON CONFLICT DO NOTHING

statement ok
INSERT INTO assn_cast_do_nothing VALUES ('1', 2.34, 'a') ON CONFLICT (k) DO NOTHING

statement ok
INSERT INTO assn_cast_do_nothing VALUES (1, 2.45, 'a') ON CONFLICT (d) DO NOTHING

statement ok
INSERT INTO assn_cast_do_nothing VALUES (1, 2.45::DECIMAL(10, 2), 'a') ON CONFLICT (d) DO NOTHING

statement ok
INSERT INTO assn_cast_do_nothing VALUES (1, 2.0, 'a') ON CONFLICT (d) DO NOTHING

statement ok
INSERT INTO assn_cast_do_nothing VALUES (1, 2, 'a') ON CONFLICT (d) DO NOTHING

query IRT
SELECT * FROM assn_cast_do_nothing
----
1  2  a

statement ok
PREPARE insert_do_nothing_d AS INSERT INTO assn_cast_do_nothing VALUES ($1, $2, $3) ON CONFLICT (d) DO NOTHING

statement ok
EXECUTE insert_do_nothing_d(1, 2.45, 'a')

statement ok
EXECUTE insert_do_nothing_d(1, 2.45::DECIMAL(10, 2), 'a')

statement ok
EXECUTE insert_do_nothing_d(1, 2.0, 'a')

statement ok
EXECUTE insert_do_nothing_d(1, 2, 'a')

statement error duplicate key value violates unique constraint "assn_cast_do_nothing_pkey"\nDETAIL: Key \(k\)=\(1\) already exists\.
EXECUTE insert_do_nothing_d(1, 2.56, 'a')

query IRT
SELECT * FROM assn_cast_do_nothing
----
1  2  a

statement ok
PREPARE insert_do_nothing_d2 AS INSERT INTO assn_cast_do_nothing VALUES ($1, $2::DECIMAL(10, 0), $3) ON CONFLICT (d) DO NOTHING

statement ok
EXECUTE insert_do_nothing_d2(1, 2.45, 'a')

statement ok
EXECUTE insert_do_nothing_d2(1, 2.45::DECIMAL(10, 2), 'a')

statement ok
EXECUTE insert_do_nothing_d2(1, 2.0, 'a')

statement ok
EXECUTE insert_do_nothing_d2(1, 2, 'a')

statement error duplicate key value violates unique constraint "assn_cast_do_nothing_pkey"\nDETAIL: Key \(k\)=\(1\) already exists\.
EXECUTE insert_do_nothing_d2(1, 2.56, 'a')

query IRT
SELECT * FROM assn_cast_do_nothing
----
1  2  a


# Tests for assignment casts in INSERT .. ON CONFLICT .. DO UPDATE.
subtest assignment_casts_insert_do_update

statement ok
CREATE TABLE assn_cast_do_update (
  k INT PRIMARY KEY,
  d DECIMAL(10, 0) UNIQUE,
  c CHAR UNIQUE
)

statement error value too long for type CHAR
INSERT INTO assn_cast_do_update VALUES (1, 2.34, 'abc') ON CONFLICT (c) DO UPDATE SET c = 'b'

statement ok
INSERT INTO assn_cast_do_update VALUES (1, 2.34, 'a') ON CONFLICT (c) DO UPDATE SET c = 'b'

statement error value too long for type CHAR
INSERT INTO assn_cast_do_update VALUES (1, 2.34, 'a') ON CONFLICT (c) DO UPDATE SET c = 'abc'

statement ok
INSERT INTO assn_cast_do_update VALUES (1, 2.34, 'a') ON CONFLICT (c) DO UPDATE SET c = 'b'

query IRT
SELECT * FROM assn_cast_do_update
----
1  2  b

statement ok
PREPARE insert_do_update_c AS
INSERT INTO assn_cast_do_update VALUES (1, 2.34, $1) ON CONFLICT (c) DO UPDATE SET c = $2

statement error value too long for type CHAR
EXECUTE insert_do_update_c('b', 'abc')

statement error value too long for type CHAR
EXECUTE insert_do_update_c('b', 'abc'::STRING)

statement error duplicate key value violates unique constraint "assn_cast_do_update_pkey"\nDETAIL: Key \(k\)=\(1\) already exists\.
EXECUTE insert_do_update_c('c', 'abc')

statement ok
EXECUTE insert_do_update_c('b', 'c')

query IRT
SELECT * FROM assn_cast_do_update
----
1  2  c

query I
INSERT INTO assn_cast_do_update VALUES ('1', 2.34, 'a')
ON CONFLICT (k) DO UPDATE SET k = '2'
RETURNING k
----
2

query R
INSERT INTO assn_cast_do_update VALUES (1, 2.45, 'a')
ON CONFLICT (d) DO UPDATE SET d = 3.56
RETURNING d
----
4

query R
INSERT INTO assn_cast_do_update VALUES (1, 3.56, 'a')
ON CONFLICT (d) DO UPDATE SET d = 5.12::DECIMAL(10, 2)
RETURNING d
----
5

query IRT
SELECT * FROM assn_cast_do_update
----
2  5  c

statement ok
INSERT INTO assn_cast_do_update VALUES (3, 1.23, 'b')

statement error duplicate key value violates unique constraint "assn_cast_do_update_c_key"\nDETAIL: Key \(c\)=\('c'\) already exists\.
INSERT INTO assn_cast_do_update VALUES (3, 10.12, 'b')
ON CONFLICT (c) DO UPDATE SET c = 'c'

statement error duplicate key value violates unique constraint "assn_cast_do_update_d_key"\nDETAIL: Key \(d\)=\(5\) already exists\.
INSERT INTO assn_cast_do_update VALUES (3, 10.12, 'b')
ON CONFLICT (c) DO UPDATE SET d = 5.45

statement error duplicate key value violates unique constraint "assn_cast_do_update_d_key"\nDETAIL: Key \(d\)=\(5\) already exists\.
INSERT INTO assn_cast_do_update VALUES (3, 10.12, 'b')
ON CONFLICT (c) DO UPDATE SET d = 5.45::DECIMAL(10, 2)


# Tests for assignment casts in cascading UPDATEs.
subtest assignment_casts_update_cascade

statement ok
CREATE TABLE assn_cast_p (p DECIMAL(10, 2) PRIMARY KEY, d DECIMAL(10, 2) UNIQUE);
INSERT INTO assn_cast_p VALUES (1.0, 10.0);

# Test ON UPDATE CASCADE.
statement ok
CREATE TABLE assn_cast_c (c INT PRIMARY KEY, p DECIMAL(10, 0) REFERENCES assn_cast_p(p) ON UPDATE CASCADE);

statement ok
INSERT INTO assn_cast_c VALUES (1, 1.0);

statement error update on table "assn_cast_c" violates foreign key constraint "assn_cast_c_p_fkey"
UPDATE assn_cast_p SET p = 1.2

statement ok
UPDATE assn_cast_p SET p = 2.0

query IF
SELECT * FROM assn_cast_c
----
1  2

statement ok
DROP TABLE assn_cast_c;

statement ok
CREATE TABLE assn_cast_c (c INT PRIMARY KEY, d DECIMAL(10, 0) REFERENCES assn_cast_p(d) ON UPDATE CASCADE);

statement ok
UPSERT INTO assn_cast_c VALUES (2, 10)

statement error update on table "assn_cast_c" violates foreign key constraint "assn_cast_c_d_fkey"
UPSERT INTO assn_cast_p VALUES (2.0, 11.22)

statement ok
UPSERT INTO assn_cast_p VALUES (2.0, 11.00)

statement error update on table "assn_cast_c" violates foreign key constraint "assn_cast_c_d_fkey"
INSERT INTO assn_cast_p VALUES (2.0, 11.00) ON CONFLICT (d) DO UPDATE SET d = 12.99

statement ok
INSERT INTO assn_cast_p VALUES (2.0, 11.00) ON CONFLICT (d) DO UPDATE SET d = 12.0

# Test ON UPDATE SET DEFAULT.
statement ok
DROP TABLE assn_cast_c;

statement ok
CREATE TABLE assn_cast_c (c INT PRIMARY KEY, p DECIMAL(10, 0) DEFAULT 3.1 REFERENCES assn_cast_p(p) ON UPDATE SET DEFAULT);

statement ok
INSERT INTO assn_cast_c VALUES (2, 2.0);

statement error update on table "assn_cast_c" violates foreign key constraint "assn_cast_c_p_fkey"
UPDATE assn_cast_p SET p = 1.2

statement ok
UPDATE assn_cast_p SET p = 3.0

query IF
SELECT * FROM assn_cast_c
----
2  3

statement ok
DROP TABLE assn_cast_c;

statement ok
CREATE TABLE assn_cast_c (c INT PRIMARY KEY, d DECIMAL(10, 0) DEFAULT 3.1 REFERENCES assn_cast_p(d) ON UPDATE SET DEFAULT);

statement ok
INSERT INTO assn_cast_c VALUES (2, 12)

statement error update on table "assn_cast_c" violates foreign key constraint "assn_cast_c_d_fkey"
UPSERT INTO assn_cast_p VALUES (3.0, 3.4)

statement ok
UPSERT INTO assn_cast_p VALUES (3.0, 3.0)

statement error update on table "assn_cast_c" violates foreign key constraint "assn_cast_c_d_fkey"
INSERT INTO assn_cast_p VALUES (3.0, 1) ON CONFLICT (p) DO UPDATE SET d = 3.4

statement error update on table "assn_cast_c" violates foreign key constraint "assn_cast_c_d_fkey"
INSERT INTO assn_cast_p VALUES (4.0, 3.0) ON CONFLICT (d) DO UPDATE SET d = 3.4

statement ok
INSERT INTO assn_cast_p VALUES (3.0, 1) ON CONFLICT (p) DO UPDATE SET d = 3.0

statement ok
INSERT INTO assn_cast_p VALUES (4.0, 3.0) ON CONFLICT (d) DO UPDATE SET d = 3.0


# Tests for assignment casts of computed columns.
subtest assignment_casts_computed

statement ok
CREATE TABLE assn_cast_comp (
  k INT PRIMARY KEY,
  i INT,
  i2 INT2 AS (i + 9999999) STORED,
  t TEXT,
  c CHAR AS (t) STORED,
  d DECIMAL(10, 0),
  d_comp DECIMAL(10, 2) AS (d) STORED,
  d2 DECIMAL(10, 2),
  d2_comp DECIMAL(10, 0) AS (d2) STORED
)

statement error integer out of range for type int2
INSERT INTO assn_cast_comp(k, i) VALUES (1, 1)

statement error value too long for type CHAR
INSERT INTO assn_cast_comp(k, t) VALUES (1, 'foo')

statement ok
INSERT INTO assn_cast_comp(k, d, d2) VALUES (1, 1.56, 2.78)

query IRRRR
SELECT k, d, d_comp, d2, d2_comp FROM assn_cast_comp
----
1  2  2.00  2.78  3

statement error integer out of range for type int2
UPDATE assn_cast_comp SET i = 1 WHERE k = 1

statement error value too long for type CHAR
UPDATE assn_cast_comp SET t = 'foo' WHERE k = 1

statement ok
UPDATE assn_cast_comp SET d = 3.45, d2 = 4.56 WHERE k = 1

query IRRRR
SELECT k, d, d_comp, d2, d2_comp FROM assn_cast_comp
----
1  3  3.00  4.56  5

statement error integer out of range for type int2
UPSERT INTO assn_cast_comp (k, i) VALUES (1, 1)

statement error integer out of range for type int2
UPSERT INTO assn_cast_comp (k, i) VALUES (2, 2)

statement error value too long for type CHAR
UPSERT INTO assn_cast_comp (k, t) VALUES (1, 'foo')

statement error value too long for type CHAR
UPSERT INTO assn_cast_comp (k, t) VALUES (2, 'bar')

statement ok
UPSERT INTO assn_cast_comp (k, d, d2) VALUES (1, 5.43, 7.89)

query IRRRR
SELECT k, d, d_comp, d2, d2_comp FROM assn_cast_comp
----
1  5  5.00  7.89  8


# Tests for assignment casts of ON UPDATE expressions.
subtest assignment_casts_on_update

statement ok
CREATE TABLE assn_cast_on_update (
    k INT PRIMARY KEY,
    i INT UNIQUE,
    d DECIMAL(10, 1) ON UPDATE 1.23,
    d2 DECIMAL(10, 1) ON UPDATE 1.23::DECIMAL(10, 2),
    d_comp DECIMAL(10, 0) AS (d) STORED
)

statement ok
INSERT INTO assn_cast_on_update (k, i) VALUES (1, 10)

statement ok
UPDATE assn_cast_on_update SET i = 11 WHERE k = 1

query IIRRR
SELECT * FROM assn_cast_on_update
----
1  11  1.2  1.2  1

statement ok
UPDATE assn_cast_on_update SET d = NULL, d2 = NULL  WHERE k = 1

statement ok
UPSERT INTO assn_cast_on_update (k, i) VALUES (1, 10)

statement ok
UPSERT INTO assn_cast_on_update (k, i) VALUES (2, 20)

query IIRRR rowsort
SELECT * FROM assn_cast_on_update
----
1  10  1.2   1.2   1
2  20  NULL  NULL  NULL

statement ok
INSERT INTO assn_cast_on_update (k, i) VALUES (2, 20) ON CONFLICT (i) DO UPDATE SET i = 30

query IIRRR rowsort
SELECT * FROM assn_cast_on_update
----
1  10  1.2  1.2  1
2  30  1.2  1.2  1


# Regression tests.
subtest regressions

statement ok
CREATE TABLE t45837 AS SELECT 1.25::decimal AS d

# Test that decimals get rounded when casting.
query T
SELECT d::decimal(10,1) FROM t45837
----
1.3

statement ok
CREATE TABLE t2 AS SELECT 18446744073709551616::FLOAT AS f

statement error pgcode 22003 integer out of range
SELECT f::int FROM t2

statement error integer out of range
SELECT 23414123414::int2

# Regression test for #47327. Test that negative intervals are correctly
# cast to a decimal.
statement ok
CREATE TABLE t0(c0 DECIMAL UNIQUE); INSERT INTO t0(c0) VALUES(0);

statement ok
CREATE TABLE t1(c0 DECIMAL); INSERT INTO t1(c0) VALUES(0);

# Both of these queries should return no rows.
query T
SELECT t0.c0 FROM t0 WHERE t0.c0 BETWEEN t0.c0 AND INTERVAL '-1'::DECIMAL
----

query T
SELECT t1.c0 FROM t1 WHERE t1.c0 BETWEEN t1.c0 AND INTERVAL '-1'::DECIMAL
----

# Regression test for incorrectly casting integers out of range (#64429).
statement ok
CREATE TABLE t64429 (_int8 INT8, _int4 INT4);

statement ok
INSERT INTO t64429 VALUES (3000000000, 300000);

statement error integer out of range for type int2
SELECT _int8::INT2 FROM t64429

statement error integer out of range for type int4
SELECT _int8::INT4 FROM t64429

statement error integer out of range for type int2
SELECT _int4::INT2 FROM t64429

# Also check the negative overflow.
statement ok
DELETE FROM t64429 WHERE true;
INSERT INTO t64429 VALUES (-3000000000, -300000);

statement error integer out of range for type int2
SELECT _int8::INT2 FROM t64429

statement error integer out of range for type int4
SELECT _int8::INT4 FROM t64429

statement error integer out of range for type int2
SELECT _int4::INT2 FROM t64429

# Regression test for #66067. Ensure that there is no correctness bug due to
# improper casting of CHAR and VARCHAR.
statement ok
CREATE TABLE t66067_a (
  a INT,
  c CHAR(26),
  INDEX (c, a)
);

statement ok
CREATE TABLE t66067_b (
  a INT,
  v VARCHAR(40)
);

statement ok
INSERT INTO t66067_a VALUES (1, 'foo');
INSERT INTO t66067_b VALUES (1, 'bar');

query ITIT
SELECT * FROM t66067_b b
INNER LOOKUP JOIN t66067_a a ON b.a = a.a
WHERE b.v = 'bar' AND a.c = 'foo'
----
1  bar  1  foo

query ITI nosort
SELECT i, i::"char"::bytea, length(i::"char")
FROM (VALUES (32), (97), (127), (0), (-1), (-127), (-128)) v(i);
----
32           1
97    a      1
127         1
0     ·      0
-1    [255]  1
-127  [129]  1
-128  [128]  1

statement error pgcode 22003 \"char\" out of range
SELECT 128::"char";

statement error pgcode 22003 \"char\" out of range
SELECT (-129)::"char";

query IFRB
SELECT ' 1 '::int, ' 1.2 '::float, ' 2.3 '::decimal, ' true '::bool
----
1  1.2  2.3  true

query IOTOOOOOO nosort
SELECT i, i::oid, i::oid::text,
  i::oid::regproc, i::oid::regprocedure, i::oid::regnamespace, i::oid::regclass, i::oid::regtype, i::oid::regrole
FROM (VALUES (0), (1)) v(i)
----
0  0  0  -          -          -  -  -  -
1  1  1  array_agg  array_agg  1  1  1  1

query TOOOOOOOOOOOO
SELECT i, i::regproc::oid, i::regprocedure::oid, i::regnamespace::oid, i::regtype::oid, i::regclass::oid, i::regrole::oid,
  i::regproc, i::regprocedure, i::regnamespace, i::regtype, i::regclass, i::regrole
FROM (VALUES ('-')) v(i)
----
-  0  0  0  0  0  0  -  -  -  -  -  -

statement error invalid input syntax for type oid: "-"
SELECT i, i::oid FROM (VALUES ('-')) v(i)

statement error invalid input syntax for type oid: "-"
SELECT '-'::oid

query OOOOOOOOOOOO
SELECT '-'::regclass, '-'::regclass::oid,
  '-'::regproc, '-'::regproc::oid,
  '-'::regprocedure, '-'::regprocedure::oid,
  '-'::regnamespace, '-'::regnamespace::oid,
  '-'::regtype, '-'::regtype::oid,
  '-'::regrole, '-'::regrole::oid
----
-  0  -  0  -  0  -  0  -  0  -  0

# Regression test for #73450. Eliding casts should not cause incorrect results.
subtest regression_73450

statement ok
PREPARE s73450_a AS SELECT $1::INT2

statement error integer out of range for type int2
EXECUTE s73450_a(999999)

statement ok
PREPARE s73450_b AS SELECT $1::CHAR

query T
EXECUTE s73450_b('foo')
----
f

statement ok
CREATE TABLE t73450 (c CHAR);

statement ok
INSERT INTO t73450 VALUES ('f')

query T
SELECT * FROM t73450 WHERE c = 'foo'::CHAR
----
f

statement ok
PREPARE s73450_c AS SELECT * FROM t73450 WHERE c = $1::CHAR

query T
EXECUTE s73450_c('foo')
----
f

# Regression test for #59489. Decimal scale should be enforced for literals
# given in scientific notation.
subtest regression_59489

statement ok
CREATE TABLE t59489 (
  d12_3 DECIMAL(12, 3),
  d4_2 DECIMAL(4, 2)
)

query R
INSERT INTO t59489 (d12_3) VALUES (6000) RETURNING d12_3
----
6000.000

query R
INSERT INTO t59489 (d12_3) VALUES (6e3) RETURNING d12_3
----
6000.000

query R rowsort
SELECT d12_3 FROM t59489
----
6000.000
6000.000

statement error value with precision 4, scale 2 must round to an absolute value less than 10\^2
INSERT INTO t59489 (d4_2) VALUES (600)

statement error value with precision 4, scale 2 must round to an absolute value less than 10\^2
INSERT INTO t59489 (d4_2) VALUES (6e2)

# Regression for #74784. Case expressions with branches of different types in
# the OID family should not cause internal errors.
# TODO(#75103): These CASE expressions are allowed for backward compatibility,
# but ultimately should not allow expressions such as these because implicit
# casts between REG* are not allowed.
statement ok
select CASE WHEN false THEN 1::REGCLASS ELSE 2::REGNAMESPACE END;
select CASE WHEN false THEN 1::REGCLASS ELSE 2::REGPROC END;
select CASE WHEN false THEN 1::REGCLASS ELSE 2::REGPROCEDURE END;
select CASE WHEN false THEN 1::REGCLASS ELSE 2::REGROLE END;
select CASE WHEN false THEN 1::REGCLASS ELSE 2::REGTYPE END;
select CASE WHEN false THEN 1::REGNAMESPACE ELSE 2::REGCLASS END;
select CASE WHEN false THEN 1::REGNAMESPACE ELSE 2::REGPROC END;
select CASE WHEN false THEN 1::REGNAMESPACE ELSE 2::REGPROCEDURE END;
select CASE WHEN false THEN 1::REGNAMESPACE ELSE 2::REGROLE END;
select CASE WHEN false THEN 1::REGNAMESPACE ELSE 2::REGTYPE END;
select CASE WHEN false THEN 1::REGPROC ELSE 2::REGCLASS END;
select CASE WHEN false THEN 1::REGPROC ELSE 2::REGNAMESPACE END;
select CASE WHEN false THEN 1::REGPROC ELSE 2::REGPROCEDURE END;
select CASE WHEN false THEN 1::REGPROC ELSE 2::REGROLE END;
select CASE WHEN false THEN 1::REGPROC ELSE 2::REGTYPE END;
select CASE WHEN false THEN 1::REGPROCEDURE ELSE 2::REGCLASS END;
select CASE WHEN false THEN 1::REGPROCEDURE ELSE 2::REGNAMESPACE END;
select CASE WHEN false THEN 1::REGPROCEDURE ELSE 2::REGPROC END;
select CASE WHEN false THEN 1::REGPROCEDURE ELSE 2::REGROLE END;
select CASE WHEN false THEN 1::REGPROCEDURE ELSE 2::REGTYPE END;
select CASE WHEN false THEN 1::REGROLE ELSE 2::REGCLASS END;
select CASE WHEN false THEN 1::REGROLE ELSE 2::REGNAMESPACE END;
select CASE WHEN false THEN 1::REGROLE ELSE 2::REGPROC END;
select CASE WHEN false THEN 1::REGROLE ELSE 2::REGPROCEDURE END;
select CASE WHEN false THEN 1::REGROLE ELSE 2::REGTYPE END;
select CASE WHEN false THEN 1::REGTYPE ELSE 2::REGCLASS END;
select CASE WHEN false THEN 1::REGTYPE ELSE 2::REGNAMESPACE END;
select CASE WHEN false THEN 1::REGTYPE ELSE 2::REGPROC END;
select CASE WHEN false THEN 1::REGTYPE ELSE 2::REGPROCEDURE END;
select CASE WHEN false THEN 1::REGTYPE ELSE 2::REGROLE END;

# As per the comment on eval.performCast(), the type width for FLOAT4 is
# not available at the time that the cast is done, so the FLOAT4 -> TEXT
# cast results in more digits than it should.
query TT
SELECT (1/3.0)::float4::text, (-1/3.0)::float8::text
----
0.3333333333333333  -0.3333333333333333

statement ok
SET extra_float_digits = -15

# Verify that extra_float_digits applies to casts.
query TT
SELECT (-1/3.0)::float4::text, (1/3.0)::float8::text
----
-0.3  0.3

# Test that default/on update expression is allowed to differ from column type
statement ok
CREATE TABLE def_assn_cast (
  id INT4,
  a INT4 DEFAULT 1.0::FLOAT4,
  b VARCHAR DEFAULT 'true'::BOOL,
  c NAME DEFAULT 'foo'::CHAR
)

statement ok
CREATE TABLE upd_assn_cast (
  id INT4,
  a TEXT ON UPDATE 'POINT(2.0 2.0)'::GEOMETRY,
  b FLOAT8 ON UPDATE 6::INT4,
  c VARCHAR ON UPDATE '{ "customer": "John Doe"}'::JSONB
)

# Ensure insertions are allowed
statement ok
INSERT INTO def_assn_cast(id) VALUES (1)

statement ok
INSERT INTO upd_assn_cast(id) VALUES (1)

statement ok
UPDATE upd_assn_cast SET id = 2

query IITT
SELECT * from def_assn_cast
----
1  1  true  f

query ITFT
SELECT * from upd_assn_cast
----
2  010100000000000000000000400000000000000040  6  {"customer": "John Doe"}


statement error pq: could not parse .* as type .*: invalid .* value
CREATE TABLE fail_assn_cast (
  a BOOL DEFAULT 'foo'
)

statement error pq: expected DEFAULT \(in CREATE TABLE\) expression to have type .*, but .* has type .*
CREATE TABLE fail_assn_cast (
  a DATE DEFAULT 1.0::FLOAT4
)

statement error pq: expected DEFAULT \(in CREATE TABLE\) expression to have type .*, but .* has type .*
CREATE TABLE fail_assn_cast (
  b JSONB DEFAULT 'null'::CHAR
)

statement error pq: expected ON UPDATE expression to have type .*, but .* has type .*
CREATE TABLE fail_assn_cast (
  a INT4 ON UPDATE 1.0::BOOL
)

statement error pq: expected ON UPDATE expression to have type .*, but .* has type .*
CREATE TABLE fail_assn_cast (
  a FLOAT4 ON UPDATE '01/02/03'::DATE
)

statement error pq: expected ON UPDATE expression to have type .*, but .* has type .*
CREATE TABLE fail_assn_cast (
  a NUMERIC ON UPDATE '1-2'::INTERVAL
)

subtest regression_98373

statement ok
CREATE TABLE IF NOT EXISTS t98373 AS
        SELECT
                g::INT2 AS _int2,
                g::INT4 AS _int4,
                g::INT8 AS _int8,
                g::FLOAT8 AS _float8,
                '2001-01-01'::DATE + g AS _date,
                '2001-01-01'::TIMESTAMP + g * '1 day'::INTERVAL AS _timestamp
        FROM
                generate_series(1, 5) AS g;

query T rowsort
SELECT
        regproc(_int2::INT8)::REGPROC AS col865
FROM
        t98373@[0]
----
array_agg
array_agg
array_agg
array_agg
array_agg

subtest regression_112515

statement ok
CREATE TABLE t112515 (f FLOAT);
INSERT INTO t112515 VALUES (-1.5), (-0.5), (0.5), (1.5), (2.5);

query I rowsort
SELECT f::INT FROM t112515
----
-2
0
0
2
2

statement ok
CREATE TABLE t128294 (r REGCLASS);

let $table_id
SELECT 't128294'::REGCLASS::OID;

statement ok
INSERT INTO t128294 (r) VALUES ($table_id);

query T
SELECT (SELECT r FROM t128294) FROM t128294;
----
t128294
