# LogicTest: !3node-tenant

# Create a table, write a row, lock it, then switch users.
statement ok
CREATE TABLE t (k STRING PRIMARY KEY, v STRING)

statement ok
GRANT ALL ON t TO testuser

statement ok
INSERT INTO t VALUES ('a', 'val1'), ('b', 'val2'), ('c', 'val3'), ('l', 'val4'), ('m', 'val5'), ('p', 'val6'), ('s', 'val7'), ('t', 'val8'), ('z', 'val9')

query TTT colnames
ALTER TABLE t SPLIT AT VALUES ('d'), ('r')
----
key                   pretty  split_enforced_until
[242 137 18 100 0 1]  /"d"    2262-04-11 23:47:16.854776 +0000 +0000
[242 137 18 114 0 1]  /"r"    2262-04-11 23:47:16.854776 +0000 +0000

query TTTI colnames,rowsort
SELECT start_key, end_key, replicas, lease_holder FROM [SHOW RANGES FROM TABLE t]
----
start_key  end_key  replicas  lease_holder
NULL       /"d"     {1}       1
/"d"       /"r"     {1}       1
/"r"       NULL     {1}       1

statement count 7
BEGIN; UPDATE t SET v = concat(v, '_updated') WHERE k >= 'b' and k < 'z'

user testuser

statement ok
BEGIN

query TT async,rowsort readReq
SELECT * FROM t
----
a   val1
b   val2_updated
c   val3_updated
l   val4_updated
m   val5_updated
p   val6_updated
s   val7_updated
t   val8_updated
z   val9

user root

query TTT colnames,retry
SELECT user_name, query, phase FROM crdb_internal.cluster_queries WHERE user_name='testuser'
----
user_name   query             phase
testuser    SELECT * FROM t   executing

statement ok
COMMIT

user testuser

awaitquery readReq

statement ok
COMMIT

user root

statement ok
BEGIN

query TT rowsort
SELECT * FROM t FOR UPDATE
----
a   val1
b   val2_updated
c   val3_updated
l   val4_updated
m   val5_updated
p   val6_updated
s   val7_updated
t   val8_updated
z   val9

user testuser

statement ok
BEGIN

statement async deleteReq count 7
DELETE FROM t WHERE k >= 'b' AND k < 'z'

user root

query TTT colnames,retry
SELECT user_name, query, phase FROM crdb_internal.cluster_queries WHERE user_name='testuser'
----
user_name   query                                           phase
testuser    DELETE FROM t WHERE (k >= 'b') AND (k < 'z')    executing

statement ok
COMMIT

user testuser

awaitstatement deleteReq

statement ok
COMMIT
