# LogicTest: local 3node-tenant

# Test that different operations still succeed when the primary key is not in column family 0.

statement ok
CREATE TABLE t (x INT PRIMARY KEY, y INT, z INT, FAMILY (y), FAMILY (z), FAMILY (x));
INSERT INTO t VALUES (1, 2, 3), (4, 5, 6)

query III rowsort
SELECT * FROM t
----
1 2 3
4 5 6

statement ok
UPDATE t SET x = 2 WHERE y = 2

query III rowsort
SELECT * FROM t
----
2 2 3
4 5 6

statement ok
UPDATE t SET z = 3 WHERE x = 4

query III rowsort
SELECT * FROM t
----
2 2 3
4 5 3

query II
SELECT y, z FROM t WHERE x = 2
----
2 3

statement ok
DROP TABLE t;

statement ok
CREATE TABLE t (x DECIMAL PRIMARY KEY, y INT, FAMILY (y), FAMILY (x));

statement ok
INSERT INTO t VALUES (5.607, 1), (5.6007, 2)

query TI rowsort
SELECT * FROM t
----
5.607 1
5.6007 2

# Ensure that primary indexes with encoded composite values that are not in family 0 have their
# composite values stored in the corresponding family.

statement ok
DROP TABLE t;

statement ok
CREATE TABLE t (x DECIMAL, y DECIMAL, z INT, FAMILY (z), FAMILY (y), FAMILY (x), PRIMARY KEY (x, y));

statement ok
INSERT INTO t VALUES (1.00, 2.00, 1)

query TTI
SET tracing=on,kv,results;
SELECT * FROM t;
----
1.00 2.00 1

statement ok
SET tracing=off

query T
SELECT message FROM [SHOW KV TRACE FOR SESSION] WHERE
message LIKE 'fetched: /t/t_pkey/%'
ORDER BY message
----
fetched: /t/t_pkey/1/2.00/x:cf=2 -> /1.00
fetched: /t/t_pkey/1/2/y:cf=1 -> /2.00
fetched: /t/t_pkey/1/2/z:cf=0 -> /1

# Regression test for #131860.

statement ok
CREATE TABLE abc (a INT NOT NULL, b FLOAT NOT NULL, c INT, FAMILY (a), FAMILY (b), FAMILY (c))

statement ok
INSERT INTO abc VALUES (4, -0, 6)

statement ok
ALTER TABLE abc ADD PRIMARY KEY (a, b)

statement ok
UPDATE abc SET c = NULL WHERE a = 4 AND b = -0

query IFI
SELECT * FROM abc
----
4  -0  NULL

statement ok
UPDATE abc SET b = 0 WHERE a = 4 AND b = -0;

query IFI
SELECT * FROM abc
----
4  0  NULL
