# Note: this file does not contain tests for virtual computed columns; those
# are in a separate test file.

statement ok
CREATE TABLE with_no_column_refs (
  a INT,
  b INT,
  c INT AS (3) STORED,
  FAMILY "primary" (a, b, c, rowid)
)

query TT
SHOW CREATE TABLE with_no_column_refs
----
with_no_column_refs  CREATE TABLE public.with_no_column_refs (
                     a INT8 NULL,
                     b INT8 NULL,
                     c INT8 NULL AS (3:::INT8) STORED,
                     rowid INT8 NOT VISIBLE NOT NULL DEFAULT unique_rowid(),
                     CONSTRAINT "primary" PRIMARY KEY (rowid ASC),
                     FAMILY "primary" (a, b, c, rowid)
)

statement ok
CREATE TABLE extra_parens (
  a INT,
  b INT,
  c INT AS ((3)) STORED,
  FAMILY "primary" (a, b, c, rowid)
)

query TT
SHOW CREATE TABLE extra_parens
----
extra_parens  CREATE TABLE public.extra_parens (
              a INT8 NULL,
              b INT8 NULL,
              c INT8 NULL AS (3:::INT8) STORED,
              rowid INT8 NOT VISIBLE NOT NULL DEFAULT unique_rowid(),
              CONSTRAINT "primary" PRIMARY KEY (rowid ASC),
              FAMILY "primary" (a, b, c, rowid)
)


statement error cannot write directly to computed column "c"
INSERT INTO with_no_column_refs VALUES (1, 2, 3)

statement error cannot write directly to computed column "c"
INSERT INTO with_no_column_refs (SELECT 1, 2, 3)

statement error cannot write directly to computed column "c"
INSERT INTO with_no_column_refs (a, c) (SELECT 1, 3)

statement error cannot write directly to computed column "c"
INSERT INTO with_no_column_refs (c) VALUES (1)

statement ok
INSERT INTO with_no_column_refs (a, b) VALUES (1, 2)

statement ok
INSERT INTO with_no_column_refs VALUES (1, 2)

statement error cannot write directly to computed column "c"
UPDATE with_no_column_refs SET c = 1

statement error cannot write directly to computed column "c"
UPDATE with_no_column_refs SET (a, b, c) = (1, 2, 3)

statement error cannot write directly to computed column "c"
UPDATE with_no_column_refs SET (a, b, c) = (SELECT 1, 2, 3)

query I
SELECT c FROM with_no_column_refs
----
3
3

statement ok
CREATE TABLE x (
  a INT DEFAULT 3,
  b INT DEFAULT 7,
  c INT AS (a) STORED,
  d INT AS (a + b) STORED,
  FAMILY "primary" (a, b, c, d, rowid)
)

query TT
SHOW CREATE TABLE x
----
x  CREATE TABLE public.x (
   a INT8 NULL DEFAULT 3:::INT8,
   b INT8 NULL DEFAULT 7:::INT8,
   c INT8 NULL AS (a) STORED,
   d INT8 NULL AS (a + b) STORED,
   rowid INT8 NOT VISIBLE NOT NULL DEFAULT unique_rowid(),
   CONSTRAINT "primary" PRIMARY KEY (rowid ASC),
   FAMILY "primary" (a, b, c, d, rowid)
)

query TTBTTTB colnames
SHOW COLUMNS FROM x
----
column_name  data_type  is_nullable  column_default  generation_expression  indices    is_hidden
a            INT8       true         3:::INT8        ·                      {primary}  false
b            INT8       true         7:::INT8        ·                      {primary}  false
c            INT8       true         NULL            a                      {primary}  false
d            INT8       true         NULL            a + b                  {primary}  false
rowid        INT8       false        unique_rowid()  ·                      {primary}  true

statement error cannot write directly to computed column "c"
INSERT INTO x (c) VALUES (1)

statement ok
INSERT INTO x (a, b) VALUES (1, 2)

query II
SELECT c, d FROM x
----
1 3

statement ok
DELETE FROM x

statement ok
DELETE FROM x

statement ok
DROP TABLE x

statement ok
CREATE TABLE x (
  a INT NOT NULL,
  b INT,
  c INT AS (a) STORED,
  d INT AS (a + b) STORED
)

statement ok
INSERT INTO x (a) VALUES (1)

statement error null value in column "a" violates not-null constraint
INSERT INTO x (b) VALUES (1)

query II
SELECT c, d FROM x
----
1  NULL

statement ok
DROP TABLE x

# Check with upserts
statement ok
CREATE TABLE x (
  a INT PRIMARY KEY,
  b INT,
  c INT AS (b + 1) STORED,
  d INT AS (b - 1) STORED
)

statement ok
INSERT INTO x (a, b) VALUES (1, 1) ON CONFLICT (a) DO UPDATE SET b = excluded.b + 1

query II
SELECT c, d FROM x
----
2 0

statement ok
INSERT INTO x (a, b) VALUES (1, 1) ON CONFLICT (a) DO UPDATE SET b = excluded.b + 1

query IIII
SELECT a, b, c, d FROM x
----
1 2 3 1

statement ok
INSERT INTO x (a, b) VALUES (1, 1) ON CONFLICT (a) DO UPDATE SET b = x.b + 1

query III
SELECT a, b, c FROM x
----
1 3 4

# Update.

statement ok
UPDATE x SET b = 3

query III
SELECT a, b, c FROM x
----
1 3 4

# Update/self-reference.

statement ok
UPDATE x SET b = c

query III
SELECT a, b, c FROM x
----
1 4 5

# Updating with default is not allowed.

statement error cannot write directly to computed column "c"
UPDATE x SET (b, c) = (1, DEFAULT)

# Upsert using the UPSERT shorthand.

statement ok
UPSERT INTO x (a, b) VALUES (1, 2)

query IIII
SELECT a, b, c, d FROM x
----
1 2 3 1

statement ok
TRUNCATE x

# statement ok
# INSERT INTO x VALUES (2, 3) ON CONFLICT (a) DO UPDATE SET a = 2, b = 3

statement ok
UPSERT INTO x VALUES (2, 3)

query IIII
SELECT a, b, c, d FROM x
----
2 3 4 2

statement ok
TRUNCATE x

statement error cannot write directly to computed column "c"
UPSERT INTO x VALUES (2, 3, 12)

statement ok
UPSERT INTO x (a, b) VALUES (2, 3)

query IIII
SELECT a, b, c, d FROM x
----
2 3 4 2

statement ok
DROP TABLE x

# TODO(justin): #22434
# statement ok
# CREATE TABLE x (
#   b INT AS a STORED,
#   a INT
# )
#
# statement ok
# INSERT INTO x VALUES (DEFAULT, 1)
#
# statement ok
# INSERT INTO x VALUES (DEFAULT, '2')
#
# query I
# SELECT b FROM x ORDER BY b
# ----
# 1
# 2
#
# statement ok
# DROP TABLE x

statement error use AS \( <expr> \) STORED or AS \( <expr> \) VIRTUAL
CREATE TABLE y (
  a INT AS 3 STORED
)

statement error use AS \( <expr> \) STORED or AS \( <expr> \) VIRTUAL
CREATE TABLE y (
  a INT AS (3)
)

statement ok
CREATE TABLE tmp (x INT)

statement ok
DROP TABLE tmp

statement error expected computed column expression to have type int, but .* has type string
CREATE TABLE y (
  a INT AS ('not an integer!'::STRING) STORED
)

# We utilize the types from other columns.

statement error expected computed column expression to have type int, but 'a' has type string
CREATE TABLE y (
  a STRING,
  b INT AS (a) STORED
)

statement error context-dependent operators are not allowed in computed column
CREATE TABLE y (
  a TIMESTAMP AS (now()) STORED
)

statement error context-dependent operators are not allowed in computed column
CREATE TABLE y (
  a STRING,
  b TIMESTAMPTZ AS (a::TIMESTAMPTZ) STORED
)

# Make sure the error has a hint that mentions parse_timestamp().
statement error context-dependent operators are not allowed in computed column.*\nHINT:.*use parse_timestamp
CREATE TABLE y (
  a STRING,
  b TIMESTAMP AS (a::TIMESTAMP) STORED
)

# Make sure the error has a hint that mentions AT TIME ZONE.
statement error context-dependent operators are not allowed in computed column.*\nHINT:.*AT TIME ZONE
CREATE TABLE y (
  a TIMESTAMPTZ,
  b STRING AS (a::STRING) STORED
)

# Make sure the error has a hint that mentions AT TIME ZONE.
statement error context-dependent operators are not allowed in computed column.*\nHINT:.*AT TIME ZONE
CREATE TABLE y (
  a TIMESTAMPTZ,
  b TIMESTAMP AS (a::TIMESTAMP) STORED
)

statement error context-dependent operators are not allowed in computed column
CREATE TABLE y (
  a TIMESTAMPTZ,
  b INTERVAL,
  c TIMESTAMPTZ AS (a+ b) STORED
)

statement error volatile functions are not allowed in computed column
CREATE TABLE y (
  a STRING AS (concat('foo', uuid_v4()::STRING)) STORED
)

statement error computed column expression cannot reference computed columns
CREATE TABLE y (
  a INT AS (3) STORED,
  b INT AS (a) STORED
)

statement error column "a" does not exist
CREATE TABLE y (
  b INT AS (a) STORED
)

statement error aggregate functions are not allowed in computed column
CREATE TABLE y (
  b INT AS (count(1)) STORED
)

statement error computed column cannot have default values
CREATE TABLE y (
  a INT AS (3) STORED DEFAULT 4
)

statement ok
CREATE TABLE x (a INT PRIMARY KEY)

statement error computed column "r" cannot reference a foreign key
CREATE TABLE y (
  r INT AS (1) STORED REFERENCES x (a)
)

statement error computed column "r" cannot reference a foreign key
CREATE TABLE y (
  r INT AS (1) STORED REFERENCES x
)

statement error computed column "r" cannot reference a foreign key
CREATE TABLE y (
  a INT,
  r INT AS (1) STORED REFERENCES x
)

# Tests for computed columns that reference foreign key columns.
subtest referencing_fks

statement ok
CREATE TABLE p (p INT PRIMARY KEY)

statement ok
CREATE TABLE c_update (
  p_cascade INT REFERENCES p (p) ON UPDATE CASCADE,
  p_default INT DEFAULT 0 REFERENCES p (p) ON UPDATE SET DEFAULT,
  p_null INT REFERENCES p (p) ON UPDATE SET NULL,
  c_cascade INT AS (p_cascade + 100) STORED,
  c_default INT AS (p_default) STORED,
  c_null INT AS (p_null + 100) STORED
)

statement ok
CREATE TABLE c_delete_cascade (
  p_cascade INT REFERENCES p (p) ON DELETE CASCADE,
  c_cascade INT AS (p_cascade + 100) STORED
)

statement ok
CREATE TABLE c_delete_set (
  p_default INT DEFAULT 0 REFERENCES p (p) ON DELETE SET DEFAULT,
  p_null INT REFERENCES p (p) ON DELETE SET NULL,
  c_default INT AS (p_default) STORED,
  c_null INT AS (p_null + 100) STORED
)

statement ok
INSERT INTO p VALUES (0), (1), (2), (3)

statement ok
INSERT INTO c_update VALUES (1, 1, 1), (2, 2, 2)

statement ok
UPDATE p SET p = 10 WHERE p = 1

query IIIIII colnames,rowsort
SELECT * FROM c_update
----
p_cascade  p_default  p_null  c_cascade  c_default  c_null
2          2          2       102        2          102
10         0          NULL    110        0          NULL

statement ok
INSERT INTO c_delete_cascade VALUES (2), (3);
INSERT INTO c_delete_set VALUES (2, 2), (3, 3);

statement ok
DELETE FROM p WHERE p = 3

query II colnames,rowsort
SELECT * FROM c_delete_cascade
----
p_cascade  c_cascade
2          102

query IIII colnames,rowsort
SELECT * FROM c_delete_set
----
p_default  p_null  c_default  c_null
0          NULL    0          NULL
2          2       2          102

# Regression test for #36036.
statement ok
CREATE TABLE tt (i INT8 AS (1) STORED)

statement error variable sub-expressions are not allowed in computed column
ALTER TABLE tt ADD COLUMN c STRING AS ((SELECT NULL)) STORED

statement error computed column expression cannot reference computed columns
ALTER TABLE tt ADD COLUMN c INT8 AS (i) STORED

# Composite FK.

statement ok
CREATE TABLE xx (
  a INT,
  b INT,
  UNIQUE (a, b)
)

statement error computed column "y" cannot reference a foreign key
CREATE TABLE yy (
  x INT,
  y INT AS (3) STORED,
  FOREIGN KEY (x, y) REFERENCES xx (a, b)
)

statement error computed column "y" cannot reference a foreign key
CREATE TABLE yy (
  x INT,
  y INT AS (3) STORED,
  FOREIGN KEY (y, x) REFERENCES xx (a, b)
)

statement ok
DROP TABLE xx

statement ok
CREATE TABLE y (
  r INT AS (1) STORED,
  INDEX (r)
)

statement error computed column "r" cannot reference a foreign key
ALTER TABLE y ADD FOREIGN KEY (r) REFERENCES x (a)

statement ok
DROP TABLE y

statement error variable sub-expressions are not allowed in computed column
CREATE TABLE y (
  r INT AS ((SELECT 1)) STORED
)

statement error no data source matches prefix: x
CREATE TABLE y (
  r INT AS (x.a) STORED
)

statement error no data source matches prefix: x
CREATE TABLE y (
  q INT,
  r INT AS (x.q) STORED
)

statement ok
CREATE TABLE y (
  q INT,
  r INT AS (y.q) STORED
)

statement ok
DROP TABLE y

# It's ok if they exist and we don't reference them.
statement ok
CREATE TABLE y (
  q INT REFERENCES x (a) ON UPDATE CASCADE,
  r INT AS (3) STORED
)

statement ok
DROP TABLE y

statement ok
DROP TABLE x

# Indexes on computed columns
statement ok
CREATE TABLE x (
  k INT PRIMARY KEY,
  a JSON,
  b TEXT AS (a->>'q') STORED,
  INDEX (b)
)

statement error cannot write directly to computed column
INSERT INTO x (k, a, b) VALUES (1, '{"q":"xyz"}', 'not allowed!'), (2, '{"q":"abc"}', 'also not allowed')

statement error cannot write directly to computed column
UPDATE x SET (k, a, b) = (1, '{"q":"xyz"}', 'not allowed!')

statement ok
INSERT INTO x (k, a) VALUES (1, '{"q":"xyz"}'), (2, '{"q":"abc"}')

query IT
SELECT k, b FROM x ORDER BY b
----
2 abc
1 xyz

statement ok
DROP TABLE x

statement ok
CREATE TABLE x (
  k INT AS ((data->>'id')::INT) STORED PRIMARY KEY,
  data JSON
)

statement ok
INSERT INTO x (data) VALUES
 ('{"id": 1, "name": "lucky"}'),
 ('{"id": 2, "name": "rascal"}'),
 ('{"id": 3, "name": "captain"}'),
 ('{"id": 4, "name": "lola"}')

# ON CONFLICT that modifies a PK.
statement ok
INSERT INTO x (data) VALUES ('{"id": 1, "name": "ernie"}')
ON CONFLICT (k) DO UPDATE SET data = '{"id": 5, "name": "ernie"}'

# ON CONFLICT that modifies a PK which then also conflicts.
statement error duplicate key value
INSERT INTO x (data) VALUES ('{"id": 5, "name": "oliver"}')
ON CONFLICT (k) DO UPDATE SET data = '{"id": 2, "name": "rascal"}'

# Updating a non-PK column.
statement ok
UPDATE x SET data = data || '{"name": "carl"}' WHERE k = 2

query T
SELECT data->>'name' FROM x WHERE k = 2
----
carl

query T
SELECT data->>'name' FROM x WHERE k = 5
----
ernie

# Referencing a computed column.
statement ok
create table y (
  a INT REFERENCES x (k)
)

statement ok
INSERT INTO y VALUES (5)

statement error foreign key
INSERT INTO y VALUES (100)

statement ok
DROP TABLE x CASCADE

statement ok
CREATE TABLE x (
  a INT,
  b INT,
  c INT,
  d INT[] AS (ARRAY[a, b, c]) STORED
)

statement ok
INSERT INTO x (a, b, c) VALUES (1, 2, 3)

query T
SELECT d FROM x
----
{1,2,3}

statement ok
TRUNCATE x

# Make sure we get the permutation on the inserts correct.

statement ok
INSERT INTO x (b, a, c) VALUES (1, 2, 3)

query T
SELECT d FROM x
----
{2,1,3}

# Make sure we get the permutation on the updates correct.
statement ok
UPDATE x SET (c, a, b) = (1, 2, 3)

query T
SELECT d FROM x
----
{2,3,1}

statement ok
UPDATE x SET (a, c) = (1, 2)

query T
SELECT d FROM x
----
{1,3,2}

statement ok
UPDATE x SET c = 2, a = 3, b = 1

query T
SELECT d FROM x
----
{3,1,2}

# Make sure we get the permutation on upserts correct.
statement ok
INSERT INTO x (rowid) VALUES ((SELECT rowid FROM x)) ON CONFLICT(rowid) DO UPDATE SET (a, b, c) = (1, 2, 3)

query T
SELECT d FROM x
----
{1,2,3}

statement ok
INSERT INTO x (rowid) VALUES ((SELECT rowid FROM x)) ON CONFLICT(rowid) DO UPDATE SET (c, a, b) = (1, 2, 3)

query T
SELECT d FROM x
----
{2,3,1}

statement ok
INSERT INTO x (rowid) VALUES ((SELECT rowid FROM x)) ON CONFLICT(rowid) DO UPDATE SET (c, a) = (1, 2)

query T
SELECT d FROM x
----
{2,3,1}

statement ok
DROP TABLE x

statement ok
CREATE TABLE x (
  a INT,
  b INT as (x.a) STORED,
  FAMILY "primary" (a, b, rowid)
)

query TT
SHOW CREATE TABLE x
----
x  CREATE TABLE public.x (
   a INT8 NULL,
   b INT8 NULL AS (a) STORED,
   rowid INT8 NOT VISIBLE NOT NULL DEFAULT unique_rowid(),
   CONSTRAINT "primary" PRIMARY KEY (rowid ASC),
   FAMILY "primary" (a, b, rowid)
)

statement ok
DROP TABLE x

# Check that computed columns are resilient to column renames.
statement ok
CREATE TABLE x (
  a INT,
  b INT AS (a) STORED,
  FAMILY "primary" (a, b, rowid)
)

statement ok
ALTER TABLE x RENAME COLUMN a TO c

query TT
SHOW CREATE TABLE x
----
x  CREATE TABLE public.x (
   c INT8 NULL,
   b INT8 NULL AS (c) STORED,
   rowid INT8 NOT VISIBLE NOT NULL DEFAULT unique_rowid(),
   CONSTRAINT "primary" PRIMARY KEY (rowid ASC),
   FAMILY "primary" (c, b, rowid)
)

statement ok
DROP TABLE x

statement ok
CREATE TABLE x (
  a INT,
  b INT AS (a * 2) STORED,
  FAMILY "primary" (a, b, rowid)
)

query T colnames
SELECT generation_expression FROM information_schema.columns
WHERE table_name = 'x' and column_name = 'b'
----
generation_expression
a * 2

query I
SELECT count(*) FROM information_schema.columns
WHERE table_name = 'x' and generation_expression = ''
----
2

statement ok
INSERT INTO x VALUES (3)

# Verify computed columns work.
statement ok
ALTER TABLE x ADD COLUMN c INT NOT NULL AS (a + 4) STORED

query TT
SHOW CREATE TABLE x
----
x  CREATE TABLE public.x (
   a INT8 NULL,
   b INT8 NULL AS (a * 2:::INT8) STORED,
   rowid INT8 NOT VISIBLE NOT NULL DEFAULT unique_rowid(),
   c INT8 NOT NULL AS (a + 4:::INT8) STORED,
   CONSTRAINT "primary" PRIMARY KEY (rowid ASC),
   FAMILY "primary" (a, b, rowid, c)
)

statement ok
INSERT INTO x VALUES (6)

query III
SELECT * FROM x ORDER BY a
----
3 6 7
6 12 10

# Multiple ADD COLUMNs can only reference columns that are defined previously.
statement error pq: column "t" does not exist, referenced in "lower\(t\)"
ALTER TABLE x
    ADD COLUMN s STRING AS (lower(t)) STORED,
    ADD COLUMN t STRING

statement ok
ALTER TABLE x
    ADD COLUMN s STRING,
    ADD COLUMN t STRING AS (lower(s)) STORED

# Verify a bad statement fails.
statement error pq: could not parse "a" as type int
ALTER TABLE x ADD COLUMN d INT AS (a + 'a') STORED

statement error could not parse "a" as type int
ALTER TABLE x ADD COLUMN d INT AS ('a') STORED

statement error unsupported binary operator
ALTER TABLE x ADD COLUMN d INT AS (a / 0) STORED

# Verify an error during computation fails.
statement error division by zero
ALTER TABLE x ADD COLUMN d INT AS (a // 0) STORED

statement ok
DROP TABLE x

# Regression test for #23109
statement ok
CREATE TABLE x (
  a INT DEFAULT 1,
  b INT AS (2) STORED
)

statement ok
INSERT INTO x (a) SELECT 1

statement ok
DROP TABLE x

statement ok
CREATE TABLE x (
  b INT AS (2) STORED,
  a INT DEFAULT 1
)

statement ok
INSERT INTO x (a) SELECT 1

statement ok
DROP TABLE x

# Verify errors emitted from computed columns contain the column name
statement ok
CREATE TABLE error_check (k INT PRIMARY KEY, s STRING, i INT AS (s::INT) STORED)

statement ok
INSERT INTO error_check VALUES(1, '1')

statement error could not parse "foo" as type int: strconv.ParseInt
INSERT INTO error_check VALUES(2, 'foo')

statement error could not parse "foo" as type int: strconv.ParseInt: parsing "foo": invalid syntax
UPDATE error_check SET s = 'foo' WHERE k = 1

# Upsert -> update
# NOTE: The CBO cannot show the name of the computed column in the error message
# because the computation is part of an overall SQL statement.
statement error could not parse "foo" as type int: strconv.ParseInt: parsing "foo": invalid syntax
UPSERT INTO error_check VALUES (1, 'foo')

# Upsert -> insert
statement error could not parse "foo" as type int: strconv.ParseInt: parsing "foo": invalid syntax
UPSERT INTO error_check VALUES (3, 'foo')

statement ok
CREATE TABLE x (
  a INT PRIMARY KEY,
  b INT AS (a+1) STORED
)

query error value type decimal doesn't match type int of column "a"
INSERT INTO x VALUES(1.4)

# Regression test for #34901: verify that builtins can be used in computed
# column expressions without a "memory budget exceeded" error while backfilling
statement ok
CREATE TABLE t34901 (x STRING)

statement ok
INSERT INTO t34901 VALUES ('a')

statement ok
ALTER TABLE t34901 ADD COLUMN y STRING AS (concat(x, 'b')) STORED

query TT
SELECT * FROM t34901
----
a  ab

# Regression test for #42418.
statement ok
CREATE TABLE t42418 (x INT GENERATED ALWAYS AS (1) STORED);
ALTER TABLE t42418 ADD COLUMN y INT GENERATED ALWAYS AS (1) STORED

query TT
SHOW CREATE t42418
----
t42418  CREATE TABLE public.t42418 (
        x INT8 NULL AS (1:::INT8) STORED,
        rowid INT8 NOT VISIBLE NOT NULL DEFAULT unique_rowid(),
        y INT8 NULL AS (1:::INT8) STORED,
        CONSTRAINT "primary" PRIMARY KEY (rowid ASC),
        FAMILY "primary" (x, rowid, y)
)

# Tests for computed column rewrites.
statement error context-dependent operators are not allowed in computed column
CREATE TABLE trewrite(k INT PRIMARY KEY, ts TIMESTAMPTZ, c STRING AS (ts::STRING) STORED, FAMILY (k,ts,c))

statement ok
SET experimental_computed_column_rewrites = "(ts :: STRING) -> ((ts AT TIME ZONE 'utc')::STRING)";

statement ok
CREATE TABLE trewrite(k INT PRIMARY KEY, ts TIMESTAMPTZ, c STRING AS (ts::STRING) STORED, FAMILY (k,ts,c))

query T
SELECT create_statement FROM [SHOW CREATE TABLE trewrite]
----
CREATE TABLE public.trewrite (
   k INT8 NOT NULL,
   ts TIMESTAMPTZ NULL,
   c STRING NULL AS (timezone('utc':::STRING, ts)::STRING) STORED,
   CONSTRAINT "primary" PRIMARY KEY (k ASC),
   FAMILY fam_0_k_ts_c (k, ts, c)
)

statement ok
DROP TABLE trewrite

statement ok
CREATE TABLE trewrite(k INT PRIMARY KEY, ts TIMESTAMPTZ, FAMILY (k,ts))

statement ok
ALTER TABLE trewrite ADD COLUMN c STRING AS (ts::STRING) STORED

query T
SELECT create_statement FROM [SHOW CREATE TABLE trewrite]
----
CREATE TABLE public.trewrite (
   k INT8 NOT NULL,
   ts TIMESTAMPTZ NULL,
   c STRING NULL AS (timezone('utc':::STRING, ts)::STRING) STORED,
   CONSTRAINT "primary" PRIMARY KEY (k ASC),
   FAMILY fam_0_k_ts (k, ts, c)
)

statement error invalid column rewrites expression
SET experimental_computed_column_rewrites = "bad"

statement error invalid column rewrites expression
SET CLUSTER SETTING sql.defaults.experimental_computed_column_rewrites = "bad"

statement ok
SET experimental_computed_column_rewrites = ""

statement ok
CREATE TABLE trewrite_copy (LIKE trewrite INCLUDING ALL)

query T
SELECT create_statement FROM [SHOW CREATE TABLE trewrite_copy]
----
CREATE TABLE public.trewrite_copy (
   k INT8 NOT NULL,
   ts TIMESTAMPTZ NULL,
   c STRING NULL AS (timezone('utc':::STRING, ts)::STRING) STORED,
   CONSTRAINT "primary" PRIMARY KEY (k ASC),
   FAMILY "primary" (k, ts, c)
)

statement ok
DROP TABLE trewrite

statement ok
DROP TABLE trewrite_copy
