# LogicTest: default parallel-stmts

statement ok
CREATE TABLE kv (
  k INT PRIMARY KEY,
  v INT,
  UNIQUE INDEX foo (v),
  INDEX bar (k, v)
)

statement ok
CREATE TABLE unindexed (
  k INT PRIMARY KEY,
  v INT
)

statement ok
INSERT INTO kv VALUES (1, 2), (3, 4), (5, 6), (7, 8)

statement ok
INSERT INTO unindexed VALUES (1, 2), (3, 4), (5, 6), (7, 8)

query II rowsort
SELECT * FROM kv
----
1 2
3 4
5 6
7 8

statement ok
CREATE VIEW kview AS SELECT k,v FROM kv

query II rowsort
SELECT * FROM kview
----
1 2
3 4
5 6
7 8

statement error "kview" is not a table
DELETE FROM kview

query II rowsort
SELECT * FROM kview
----
1 2
3 4
5 6
7 8

statement ok
DELETE FROM kv WHERE k=3 OR v=6

query II rowsort
SELECT * FROM kv
----
1 2
7 8

# delete a non-existent value.
statement ok
DELETE FROM kv WHERE k=5

query II
DELETE FROM kv RETURNING k, v
----
1 2
7 8

query II
SELECT * FROM kv
----

query T
SELECT message FROM [SHOW KV TRACE FOR SELECT * FROM kv]
 WHERE message LIKE 'fetched:%' OR message LIKE 'output row%'
----

query T
SELECT message FROM [SHOW KV TRACE FOR SELECT * FROM kv@foo]
 WHERE message LIKE 'fetched:%' OR message LIKE 'output row%'
----

query T
SELECT message FROM [SHOW KV TRACE FOR SELECT * FROM kv@bar]
 WHERE message LIKE 'fetched:%' OR message LIKE 'output row%'
----

statement error column name "nonexistent" not found
DELETE FROM kv WHERE nonexistent = 1

statement ok
DELETE FROM unindexed WHERE k=3 OR v=6

query II rowsort
SELECT * FROM unindexed
----
1 2
7 8

query II
DELETE FROM unindexed RETURNING k, v
----
1 2
7 8

query II
SELECT * FROM unindexed
----

statement ok
INSERT INTO unindexed VALUES (1, 2), (3, 4), (5, 6), (7, 8)

query II colnames
DELETE FROM unindexed WHERE k=3 or v=6 RETURNING *
----
k v
3 4
5 6

query II colnames
DELETE FROM unindexed RETURNING unindexed.*
----
k v
1 2
7 8

statement ok
INSERT INTO unindexed VALUES (1, 2), (3, 4), (5, 6), (7, 8)

query II colnames,rowsort
SELECT k, v FROM unindexed
----
k v
1 2
3 4
5 6
7 8

# Check that EXPLAIN does not destroy data (#6613)
query TTT colnames
EXPLAIN DELETE FROM unindexed
----
Tree            Field  Description
delete          ·      ·
 │              from   unindexed
 └── render     ·      ·
      └── scan  ·      ·
·               table  unindexed@primary
·               spans  ALL

query II colnames,rowsort
SELECT k, v FROM unindexed
----
k v
1 2
3 4
5 6
7 8

statement ok
DELETE FROM unindexed

query II colnames
SELECT k, v FROM unindexed
----
k v

statement ok
CREATE TABLE indexed (id int primary key, value int, other int, index (value))

statement ok
DELETE FROM indexed WHERE value = 5

# Check DELETE with ORDER BY clause (MySQL extension)

statement ok
INSERT INTO unindexed VALUES (1, 9), (8, 2), (3, 7), (6, 4)

query TTT
EXPLAIN DELETE FROM unindexed WHERE v = 7 ORDER BY v
----
delete          ·      ·
 │              from   unindexed
 └── nosort     ·      ·
      │         order  +v
      └── scan  ·      ·
·               table  unindexed@primary
·               spans  ALL

query II
DELETE FROM unindexed WHERE k > 1 AND v < 7 ORDER BY v DESC RETURNING v,k
----
4  6
2  8

query II
DELETE FROM unindexed ORDER BY v RETURNING k,v
----
3  7
1  9

# Check DELETE with LIMIT clause (MySQL extension)

statement ok
INSERT INTO unindexed VALUES (1, 2), (3, 4), (5, 6), (7, 8)

query TTT
EXPLAIN DELETE FROM unindexed WHERE v = 5 LIMIT 10
----
delete               ·      ·
 │                   from   unindexed
 └── limit           ·      ·
      └── render     ·      ·
           └── scan  ·      ·
·                    table  unindexed@primary
·                    spans  ALL

query I
SELECT COUNT(*) FROM [DELETE FROM unindexed LIMIT 2 RETURNING v]
----
2

query I
SELECT COUNT(*) FROM [DELETE FROM unindexed LIMIT 1 RETURNING v]
----
1

query I
SELECT COUNT(*) FROM [DELETE FROM unindexed LIMIT 5 RETURNING v]
----
1

query TTT
EXPLAIN DELETE FROM indexed WHERE value = 5 LIMIT 10
----
delete               ·      ·
 │                   from   indexed
 └── limit           ·      ·
      └── render     ·      ·
           └── scan  ·      ·
·                    table  indexed@indexed_value_idx
·                    spans  /5-/6
·                    limit  10

query TTT
EXPLAIN DELETE FROM indexed LIMIT 10
----
delete               ·      ·
 │                   from   indexed
 └── limit           ·      ·
      └── render     ·      ·
           └── scan  ·      ·
·                    table  indexed@primary
·                    spans  ALL
·                    limit  10

query TTT
EXPLAIN DELETE FROM indexed WHERE value = 5 LIMIT 10 RETURNING id
----
delete                ·      ·
 │                    from   indexed
 └── limit            ·      ·
      └── index-join  ·      ·
           ├── scan   ·      ·
           │          table  indexed@indexed_value_idx
           │          spans  /5-/6
           │          limit  10
           └── scan   ·      ·
·                     table  indexed@primary
