# LogicTest: 5node-distsql 5node-distsql-metadata

statement ok
CREATE TABLE data (a INT, b INT, c FLOAT, d DECIMAL, PRIMARY KEY (a, b, c, d))

# Split into ten parts.
statement ok
ALTER TABLE data SPLIT AT SELECT i FROM GENERATE_SERIES(1, 9) AS g(i)

# Relocate the ten parts to the five nodes.
statement ok
ALTER TABLE data TESTING_RELOCATE
  SELECT ARRAY[i%5+1], i FROM GENERATE_SERIES(0, 9) AS g(i)

# Generate all combinations of values 1 to 10.
statement ok
INSERT INTO data SELECT a, b, c::FLOAT, d::DECIMAL FROM
   GENERATE_SERIES(1, 10) AS A(a),
   GENERATE_SERIES(1, 10) AS B(b),
   GENERATE_SERIES(1, 10) AS C(c),
   GENERATE_SERIES(1, 10) AS D(d)

# Verify data placement.
query TTTI colnames
SELECT "Start Key", "End Key", "Replicas", "Lease Holder" FROM [SHOW TESTING_RANGES FROM TABLE data]
----
Start Key  End Key  Replicas  Lease Holder
NULL       /1       {1}       1
/1         /2       {2}       2
/2         /3       {3}       3
/3         /4       {4}       4
/4         /5       {5}       5
/5         /6       {1}       1
/6         /7       {2}       2
/7         /8       {3}       3
/8         /9       {4}       4
/9         NULL     {5}       5

# We hardcode the plan for the testcase that follows to make it easier to debug
# errors caused by changing planning logic.
query T
SELECT "URL" FROM [EXPLAIN (DISTSQL) CREATE STATISTICS s1 ON a FROM data]
----
https://cockroachdb.github.io/distsqlplan/decode.html?eJy0lM-KszAUxfffU8hdfQOBJmr_ueosu5kO7ewGF6m5iIw1kkSYmeK7DyrSsbRRaGbpjSe_czjhnqGQAl_4CTVE78CAgA8EAiAQAoE5xARKJRPUWqrml06wFZ8QUQJZUVamGccEEqkQojOYzOQIEbzxY4575ALVjAIBgYZneYspVXbi6msjuOFAYFeZyNswiGsCsjKXK7XhKULEajIde-CnMkc1mw-R3fiQfWPkMUpp4-hguB3s3wVfeFUhlUCFYsCL67vWntNUYcqNVDNGp5v0_vuUescq-UCjn-5aDgaW2fSKmMOKRrB9RQvnFfnT8_oO845g-7xL53mD6XkDh3lHsH3elfO84fS8ocO8I9g-7_pPV84N8B51KQuNV6vn9s20WUkoUuz2l5aVSvBVyaTFdJ-7VtcOBGrTnbLuY1t0R43B32JmFfsDMbsW-3byCDqwqkO7OHzE99wqXtjJi0fIS6t4ZSevHiGv7V3RkWdif2TX7Lj-9xMAAP__kHfOZg==

statement ok
CREATE STATISTICS s1 ON a FROM data

query TTIII colnames
SELECT name, columns, row_count, distinct_count, null_count FROM [SHOW STATISTICS FOR TABLE data]
----
name  columns  row_count  distinct_count  null_count
s1    {"a"}    10000      10              0

let $hist_id_1
SELECT histogram_id FROM [SHOW STATISTICS FOR TABLE data] WHERE name = 's1'

query TII colnames
SHOW HISTOGRAM $hist_id_1
----
upper_bound  num_range  num_eq
1            0          1000
2            0          1000
3            0          1000 4            0          1000 5            0          1000 6            0          1000
7            0          1000
8            0          1000
9            0          1000
10           0          1000

statement ok
CREATE STATISTICS "" ON b FROM data

query TTIII colnames
SELECT name, columns, row_count, distinct_count, null_count FROM [SHOW STATISTICS FOR TABLE data]
----
name  columns  row_count  distinct_count  null_count
s1    {"a"}    10000      10              0
NULL  {"b"}    10000      10              0

# Verify that we can package statistics into a json object and later restore them.
let $json_stats
SHOW STATISTICS USING JSON FOR TABLE data

statement ok
DELETE FROM system.table_statistics

statement ok
ALTER TABLE data INJECT STATISTICS '$json_stats'

query TTIII colnames
SELECT name, columns, row_count, distinct_count, null_count FROM [SHOW STATISTICS FOR TABLE data]
----
name  columns  row_count  distinct_count  null_count
s1    {"a"}    10000      10              0
NULL  {"b"}    10000      10              0

# Verify that any other statistics are blown away when we INJECT.
statement ok
CREATE STATISTICS s3 ON c FROM data

query TTIII colnames
SELECT name, columns, row_count, distinct_count, null_count FROM [SHOW STATISTICS FOR TABLE data]
----
name  columns  row_count  distinct_count  null_count
s1    {"a"}    10000      10              0
NULL  {"b"}    10000      10              0
s3    {"c"}    10000      10              0

statement ok
ALTER TABLE data INJECT STATISTICS '$json_stats'

query TTIII colnames
SELECT name, columns, row_count, distinct_count, null_count FROM [SHOW STATISTICS FOR TABLE data]
----
name  columns  row_count  distinct_count  null_count
s1    {"a"}    10000      10              0
NULL  {"b"}    10000      10              0
