# LogicTest: fakedist fakedist-opt fakedist-metadata

statement ok
CREATE TABLE data (a INT, b INT, c FLOAT, d DECIMAL, PRIMARY KEY (a, b, c), INDEX d_idx (d))

# Enable automatic stats
statement ok
SET experimental_automatic_statistics = true

# Generate all combinations of values 1 to 10.
statement ok
INSERT INTO data SELECT a, b, c::FLOAT, NULL FROM
   generate_series(1, 10) AS a(a),
   generate_series(1, 10) AS b(b),
   generate_series(1, 10) AS c(c)

# Give the stats update time to propagate.
sleep 500ms

query TTIII colnames,rowsort
SELECT statistics_name, column_names, row_count, distinct_count, null_count
FROM [SHOW STATISTICS FOR TABLE data] ORDER BY column_names::STRING, created
----
statistics_name  column_names  row_count  distinct_count  null_count
__auto__         {a}           1000       10              0
__auto__         {d}           1000       0               1000

# Reset the stats to look like they are over an hour old.
statement ok
UPDATE system.table_statistics SET "createdAt" = "createdAt" - '1h'::INTERVAL

# Update more than 5% of the table.
statement ok
UPDATE data SET d = 11, a = 11 WHERE a = 1 AND b > 1

# Give the stats update time to propagate.
sleep 500ms

query TTIII colnames,rowsort
SELECT statistics_name, column_names, row_count, distinct_count, null_count
FROM [SHOW STATISTICS FOR TABLE data] ORDER BY column_names::STRING, created
----
statistics_name  column_names  row_count  distinct_count  null_count
__auto__         {a}           1000       10              0
__auto__         {a}           1000       11              0
__auto__         {d}           1000       0               1000
__auto__         {d}           1000       1               910

# Reset the stats to look like they are over an hour old.
statement ok
UPDATE system.table_statistics SET "createdAt" = "createdAt" - '1h'::INTERVAL

# Upsert more than 5% of the table.
statement ok
UPSERT INTO data SELECT a, b, 1, 1 FROM
generate_series(1, 11) AS a(a),
generate_series(1, 10) AS b(b)

# Give the stats update time to propagate.
sleep 500ms

query TTIII colnames,rowsort
SELECT statistics_name, column_names, row_count, distinct_count, null_count
FROM [SHOW STATISTICS FOR TABLE data] ORDER BY column_names::STRING, created
----
statistics_name  column_names  row_count  distinct_count  null_count
__auto__         {a}           1000       10              0
__auto__         {a}           1000       11              0
__auto__         {a}           1010       11              0
__auto__         {d}           1000       0               1000
__auto__         {d}           1000       1               910
__auto__         {d}           1010       2               819

# Reset the stats to look like they are over an hour old.
statement ok
UPDATE system.table_statistics SET "createdAt" = "createdAt" - '1h'::INTERVAL

# Delete more than 5% of the table.
statement ok
DELETE FROM data WHERE c > 5

# Give the stats update time to propagate.
sleep 500ms

query TTIII colnames,rowsort
SELECT statistics_name, column_names, row_count, distinct_count, null_count
FROM [SHOW STATISTICS FOR TABLE data] ORDER BY column_names::STRING, created
----
statistics_name  column_names  row_count  distinct_count  null_count
__auto__         {a}           1000       10              0
__auto__         {a}           1000       11              0
__auto__         {a}           1010       11              0
__auto__         {a}           510        11              0
__auto__         {d}           1000       0               1000
__auto__         {d}           1000       1               910
__auto__         {d}           1010       2               819
__auto__         {d}           510        2               364
