# LogicTest: default-configs 3node-tenant !local-mixed-25.4 !local-mixed-26.1 !local-mixed-26.2

# Foreign keys backed by a unique constraint covering only a subset of the
# referenced columns (CockroachDB extension). The feature is gated on cluster
# version V26_3, so the tests are excluded from the local-mixed-* configs
# where the cluster has not yet finalized to V26_3.

# Telemetry: subset-unique FK creation bumps the
# sql.schema.subset_unique_foreign_keys counter; exact-match FK creation
# does not. Placed first in the file so the counter starts at zero and
# subsequent assertions can check exact values.
subtest subset_unique_telemetry

statement ok
CREATE TABLE telemetry_parent (
  a INT PRIMARY KEY,
  b INT,
  c INT,
  UNIQUE (b),
  UNIQUE (a, b, c)
)

# Baseline: counter is zero before any FK has been created.
query I
SELECT coalesce(sum(usage_count), 0)::INT
  FROM crdb_internal.feature_usage
 WHERE feature_name = 'sql.schema.subset_unique_foreign_keys'
----
0

# Three exact-match FKs (one per available unique constraint). None
# should bump the counter.
statement ok
CREATE TABLE telemetry_child_exact_a (a INT REFERENCES telemetry_parent (a))

statement ok
CREATE TABLE telemetry_child_exact_b (b INT REFERENCES telemetry_parent (b))

statement ok
CREATE TABLE telemetry_child_exact_abc (
  a INT, b INT, c INT,
  FOREIGN KEY (a, b, c) REFERENCES telemetry_parent (a, b, c)
)

query I
SELECT coalesce(sum(usage_count), 0)::INT
  FROM crdb_internal.feature_usage
 WHERE feature_name = 'sql.schema.subset_unique_foreign_keys'
----
0

# Subset-match FK via inline FK in CREATE TABLE: bumps the counter by 1.
# The FK references (a, c). No unique constraint covers exactly (a, c),
# but PK (a) is a strict subset, so the FK is accepted via subset matching.
statement ok
CREATE TABLE telemetry_child_subset_create (
  a INT, c INT,
  FOREIGN KEY (a, c) REFERENCES telemetry_parent (a, c)
)

query I
SELECT coalesce(sum(usage_count), 0)::INT
  FROM crdb_internal.feature_usage
 WHERE feature_name = 'sql.schema.subset_unique_foreign_keys'
----
1

# Subset-match FK via ALTER TABLE ADD CONSTRAINT: bumps the counter by 1.
# Covers the ALTER path in addition to the inline-FK path above.
statement ok
CREATE TABLE telemetry_child_subset_alter (a INT, c INT)

statement ok
ALTER TABLE telemetry_child_subset_alter
  ADD CONSTRAINT subset_fk FOREIGN KEY (a, c) REFERENCES telemetry_parent (a, c)

query I
SELECT coalesce(sum(usage_count), 0)::INT
  FROM crdb_internal.feature_usage
 WHERE feature_name = 'sql.schema.subset_unique_foreign_keys'
----
2

statement ok
DROP TABLE telemetry_child_subset_alter, telemetry_child_subset_create,
  telemetry_child_exact_abc, telemetry_child_exact_b, telemetry_child_exact_a,
  telemetry_parent

subtest end

# Creation, basic DML enforcement, and edge cases for what counts as a valid
# subset backing.
subtest subset_unique_backing

statement ok
CREATE TABLE subset_parent (a INT PRIMARY KEY, b INT, c INT)

statement ok
INSERT INTO subset_parent VALUES (1, 10, 100), (2, 20, 200), (3, 30, 300)

# Default behavior: a unique constraint on a subset of the referenced columns
# is accepted. Here parent has UNIQUE(a) (the primary key) and the FK
# references (a, b, c).
statement ok
CREATE TABLE subset_child (
  a INT, b INT, c INT,
  FOREIGN KEY (a, b, c) REFERENCES subset_parent (a, b, c)
)

# Insert satisfying the FK should succeed.
statement ok
INSERT INTO subset_child VALUES (1, 10, 100), (2, 20, 200)

# Insert with non-existent parent key (a) should fail.
statement error pq: insert on table "subset_child" violates foreign key constraint
INSERT INTO subset_child VALUES (99, 0, 0)

# Insert where parent key matches but extra columns don't should also fail
# since the extra columns are enforced as implicit equality conditions.
statement error pq: insert on table "subset_child" violates foreign key constraint
INSERT INTO subset_child VALUES (1, 999, 100)

statement error pq: insert on table "subset_child" violates foreign key constraint
INSERT INTO subset_child VALUES (1, 10, 999)

# Update on the child that violates the FK should fail.
statement error pq: update on table "subset_child" violates foreign key constraint
UPDATE subset_child SET b = 999 WHERE a = 1

# Delete from parent should be blocked by RESTRICT-by-default.
statement error pq: delete on table "subset_parent" violates foreign key constraint
DELETE FROM subset_parent WHERE a = 1

statement ok
DROP TABLE subset_child, subset_parent

# Same as above, but via ALTER TABLE ADD CONSTRAINT (exercises the
# declarative schema changer path).
statement ok
CREATE TABLE subset_parent (a INT PRIMARY KEY, b INT, c INT);
CREATE TABLE subset_child (a INT, b INT, c INT)

statement ok
ALTER TABLE subset_child ADD CONSTRAINT subset_fk FOREIGN KEY (a, b, c) REFERENCES subset_parent (a, b, c)

# pg_constraint should surface the chosen backing constraint's OID (here, the
# parent's PK) in conindid, rather than 0. Confirms the introspection path
# falls back to the subset finder for subset FKs.
query B
SELECT conindid != 0
  FROM pg_catalog.pg_constraint
 WHERE conname = 'subset_fk'
----
true

statement ok
DROP TABLE subset_child, subset_parent

# Exact-match FK creation: basic coverage that an exact-match unique
# constraint backs the FK with no special handling.
statement ok
CREATE TABLE exact_parent (a INT, b INT, PRIMARY KEY (a, b))

statement ok
CREATE TABLE exact_child (
  a INT, b INT,
  FOREIGN KEY (a, b) REFERENCES exact_parent (a, b)
)

statement ok
DROP TABLE exact_child, exact_parent

# A unique constraint covering NONE of the referenced columns is still
# rejected since the relaxation requires a non-empty subset.
statement ok
CREATE TABLE no_overlap_parent (a INT PRIMARY KEY, b INT, c INT)

statement error there is no unique constraint matching given keys for referenced table no_overlap_parent
CREATE TABLE no_overlap_child (
  b INT, c INT,
  FOREIGN KEY (b, c) REFERENCES no_overlap_parent (b, c)
)

statement ok
DROP TABLE no_overlap_parent

# Partial unique indexes are still NOT eligible to back a subset FK.
statement ok
CREATE TABLE partial_subset_parent (
  a INT, b INT,
  UNIQUE INDEX (a) WHERE b > 0
)

statement error there is no unique constraint matching given keys for referenced table partial_subset_parent
CREATE TABLE partial_subset_child (
  a INT, b INT,
  FOREIGN KEY (a, b) REFERENCES partial_subset_parent (a, b)
)

statement ok
DROP TABLE partial_subset_parent

subtest end

# SHOW CREATE TABLE round-trip and catalog back-reference protections for
# subset FKs.
subtest subset_unique_catalog

# SHOW CREATE TABLE round-trip: subset FKs should serialize as a plain
# FOREIGN KEY clause with no special markers indicating subset-cover backing.
statement ok
CREATE TABLE show_p (a INT PRIMARY KEY, b INT, c INT)

statement ok
CREATE TABLE show_c (
  a INT NOT NULL, b INT NOT NULL, c INT NOT NULL,
  CONSTRAINT show_fk FOREIGN KEY (a, b, c) REFERENCES show_p (a, b, c),
  FAMILY f1 (a, b, c)
)

onlyif config schema-locked-disabled
query TT
SHOW CREATE TABLE show_c
----
show_c  CREATE TABLE public.show_c (
          a INT8 NOT NULL,
          b INT8 NOT NULL,
          c INT8 NOT NULL,
          rowid INT8 NOT VISIBLE NOT NULL DEFAULT unique_rowid(),
          CONSTRAINT show_c_pkey PRIMARY KEY (rowid ASC),
          CONSTRAINT show_fk FOREIGN KEY (a, b, c) REFERENCES public.show_p(a, b, c),
          FAMILY f1 (a, b, c, rowid)
        );

skipif config schema-locked-disabled
query TT
SHOW CREATE TABLE show_c
----
show_c  CREATE TABLE public.show_c (
          a INT8 NOT NULL,
          b INT8 NOT NULL,
          c INT8 NOT NULL,
          rowid INT8 NOT VISIBLE NOT NULL DEFAULT unique_rowid(),
          CONSTRAINT show_c_pkey PRIMARY KEY (rowid ASC),
          CONSTRAINT show_fk FOREIGN KEY (a, b, c) REFERENCES public.show_p(a, b, c),
          FAMILY f1 (a, b, c, rowid)
        ) WITH (schema_locked = true);

statement ok
DROP TABLE show_c, show_p

# Dropping the unique constraint that backs a subset FK should fail because
# of the catalog back-reference. Same protection that applies to exact-match
# FKs and the subset extension must not bypass it.
statement ok
CREATE TABLE drop_p (id INT PRIMARY KEY, b INT, c INT, CONSTRAINT u_c UNIQUE (c))

statement ok
CREATE TABLE drop_c (
  b INT NOT NULL, c INT NOT NULL,
  CONSTRAINT drop_fk FOREIGN KEY (b, c) REFERENCES drop_p (b, c)
)

skipif config local-legacy-schema-changer
statement error pq: .* is referenced by foreign key
ALTER TABLE drop_p DROP CONSTRAINT u_c

statement ok
DROP TABLE drop_c, drop_p

# Conversely, when the parent has multiple constraints that can subset-back
# the FK, dropping one of them should succeed without CASCADE since the
# other remains as a viable replacement backing.
statement ok
CREATE TABLE replace_p (
  a INT PRIMARY KEY,
  b INT,
  CONSTRAINT u_b UNIQUE (b)
)

statement ok
CREATE TABLE replace_c (
  a INT NOT NULL, b INT NOT NULL,
  CONSTRAINT replace_fk FOREIGN KEY (a, b) REFERENCES replace_p (a, b)
)

# Both UNIQUE(b) and PRIMARY KEY(a) subset-cover the FK on (a, b). Dropping
# u_b leaves the PK as a viable replacement; the drop should succeed.
skipif config local-legacy-schema-changer
statement ok
ALTER TABLE replace_p DROP CONSTRAINT u_b

# FK is still enforced after the drop, now backed solely by the PK.
statement ok
INSERT INTO replace_p VALUES (1, 10)

statement ok
INSERT INTO replace_c VALUES (1, 10)

statement error pq: .* violates foreign key constraint
INSERT INTO replace_c VALUES (99, 0)

statement ok
DROP TABLE replace_c, replace_p

# UWOI back-ref protection: when the FK's only viable backing is a UWOI on a
# strict subset of the referenced columns, dropping that UWOI without CASCADE
# must fail with the back-ref error. Same protection as the UWI case above
# and the subset extension must not bypass it.
statement ok
SET experimental_enable_unique_without_index_constraints = true

statement ok
CREATE TABLE drop_uwoi_p (id INT PRIMARY KEY, b INT, c INT,
                          CONSTRAINT u_c UNIQUE WITHOUT INDEX (c))

statement ok
CREATE TABLE drop_uwoi_c (
  b INT NOT NULL, c INT NOT NULL,
  CONSTRAINT drop_uwoi_fk FOREIGN KEY (b, c) REFERENCES drop_uwoi_p (b, c)
)

skipif config local-legacy-schema-changer
statement error pq: .* is referenced by foreign key
ALTER TABLE drop_uwoi_p DROP CONSTRAINT u_c

statement ok
DROP TABLE drop_uwoi_c, drop_uwoi_p

statement ok
RESET experimental_enable_unique_without_index_constraints

subtest end

# UPSERT / INSERT ... ON CONFLICT goes through a different mutation path than
# plain INSERT/UPDATE. Verify the subset FK is enforced for both the insert
# and the conflict-update branches.
subtest subset_unique_upsert

statement ok
CREATE TABLE upsert_p (a INT PRIMARY KEY, b INT, c INT)

statement ok
INSERT INTO upsert_p VALUES (1, 10, 100), (2, 20, 200)

statement ok
CREATE TABLE upsert_c (
  cid INT PRIMARY KEY,
  a INT NOT NULL, b INT NOT NULL, c INT NOT NULL,
  CONSTRAINT upsert_fk FOREIGN KEY (a, b, c) REFERENCES upsert_p (a, b, c)
)

# UPSERT inserting a valid row succeeds (insert branch).
statement ok
INSERT INTO upsert_c (cid, a, b, c) VALUES (1, 1, 10, 100)
ON CONFLICT (cid) DO UPDATE SET a = excluded.a, b = excluded.b, c = excluded.c

# UPSERT inserting a row that violates the FK should fail (insert branch).
statement error pq: .* violates foreign key constraint
INSERT INTO upsert_c (cid, a, b, c) VALUES (2, 99, 0, 0)
ON CONFLICT (cid) DO UPDATE SET a = excluded.a, b = excluded.b, c = excluded.c

# UPSERT updating to a value that violates the FK should fail
# (conflict-update branch); cid=1 already exists, so this hits ON CONFLICT.
statement error pq: .* violates foreign key constraint
INSERT INTO upsert_c (cid, a, b, c) VALUES (1, 99, 0, 0)
ON CONFLICT (cid) DO UPDATE SET a = excluded.a, b = excluded.b, c = excluded.c

# UPSERT that mismatches only on the non-unique-backed column also fails
# proving the residual equality is enforced on the UPSERT path too.
statement error pq: .* violates foreign key constraint
INSERT INTO upsert_c (cid, a, b, c) VALUES (1, 1, 999, 100)
ON CONFLICT (cid) DO UPDATE SET a = excluded.a, b = excluded.b, c = excluded.c

statement ok
DROP TABLE upsert_c, upsert_p

subtest end

# NOT VALID + VALIDATE flow on subset FKs, including verification that the
# validation query enforces equality on all referenced columns (not just the
# unique-backed subset).
subtest subset_unique_validation

statement ok
CREATE TABLE notvalid_parent (a INT PRIMARY KEY, b INT);
CREATE TABLE notvalid_child (a INT, b INT);
INSERT INTO notvalid_parent VALUES (1, 10), (2, 20);
INSERT INTO notvalid_child VALUES (1, 10), (2, 20)

statement ok
ALTER TABLE notvalid_child ADD CONSTRAINT notvalid_fk FOREIGN KEY (a, b) REFERENCES notvalid_parent (a, b) NOT VALID

statement ok
ALTER TABLE notvalid_child VALIDATE CONSTRAINT notvalid_fk

# Drop the FK, insert a row that mismatches on the non-unique column, then
# re-add as NOT VALID and confirm VALIDATE catches the mismatch (proving the
# validation query enforces equality on all referenced columns, not just the
# unique-backed ones).
statement ok
ALTER TABLE notvalid_child DROP CONSTRAINT notvalid_fk

statement ok
INSERT INTO notvalid_child VALUES (1, 999)

statement ok
ALTER TABLE notvalid_child ADD CONSTRAINT notvalid_fk FOREIGN KEY (a, b) REFERENCES notvalid_parent (a, b) NOT VALID

statement error pgcode 23503 foreign key violation: "notvalid_child" row a=1, b=999, rowid=[0-9]+ has no match in "notvalid_parent"
ALTER TABLE notvalid_child VALIDATE CONSTRAINT notvalid_fk

statement ok
DROP TABLE notvalid_child, notvalid_parent

subtest end

# Cascade and inbound-FK-trigger behavior on subset FKs. Specifically verifies
# that the trigger fires correctly when a parent UPDATE changes a referenced
# column that is NOT covered by the unique constraint backing the FK, a case
# that didn't exist pre-subset-matching (where all referenced cols had to be
# unique-backed).
subtest subset_unique_cascade

# ON DELETE CASCADE works on subset FKs.
statement ok
CREATE TABLE cascade_parent (a INT PRIMARY KEY, b INT, c INT)

statement ok
CREATE TABLE cascade_child (
  a INT, b INT, c INT,
  FOREIGN KEY (a, b, c) REFERENCES cascade_parent (a, b, c) ON DELETE CASCADE
)

statement ok
INSERT INTO cascade_parent VALUES (1, 10, 100), (2, 20, 200)

statement ok
INSERT INTO cascade_child VALUES (1, 10, 100), (2, 20, 200)

statement count 1
DELETE FROM cascade_parent WHERE a = 1

query III rowsort
SELECT a, b, c FROM cascade_child
----
2  20  200

statement ok
DROP TABLE cascade_child, cascade_parent

# Parent UPDATE on a non-unique-backed referenced column must still fire the
# inbound FK trigger. With subset matching, the parent's unique constraint
# covers only some referenced cols (here, just (a)); the trigger logic must
# key on the FK's full ReferencedColumnIDs, not the unique-backed subset, or
# we'd silently let parent updates break referential integrity.

statement ok
CREATE TABLE restrict_parent (a INT PRIMARY KEY, b INT)

statement ok
CREATE TABLE restrict_child (
  a INT, b INT,
  FOREIGN KEY (a, b) REFERENCES restrict_parent (a, b)
)

statement ok
INSERT INTO restrict_parent VALUES (1, 10), (2, 20)

statement ok
INSERT INTO restrict_child VALUES (1, 10), (2, 20)

# Updating the unique-backed col on parent must fail (no parent with new key).
statement error pq: update on table "restrict_parent" violates foreign key constraint
UPDATE restrict_parent SET a = 99 WHERE a = 1

# Updating the NON-unique-backed col on parent must also fail; this is the
# subset-specific check. Without correct trigger logic this would silently
# leave child(1, 10) referencing a non-existent parent(1, 10).
statement error pq: update on table "restrict_parent" violates foreign key constraint
UPDATE restrict_parent SET b = 999 WHERE a = 1

statement ok
DROP TABLE restrict_child, restrict_parent

# Same scenario with ON UPDATE CASCADE confirming the cascade also fires on
# non-unique-backed col updates and propagates correctly.

statement ok
CREATE TABLE cascade_upd_parent (a INT PRIMARY KEY, b INT)

statement ok
CREATE TABLE cascade_upd_child (
  a INT, b INT,
  FOREIGN KEY (a, b) REFERENCES cascade_upd_parent (a, b) ON UPDATE CASCADE
)

statement ok
INSERT INTO cascade_upd_parent VALUES (1, 10), (2, 20)

statement ok
INSERT INTO cascade_upd_child VALUES (1, 10), (2, 20)

# Update the non-unique-backed col on parent; cascade should propagate to
# child.
statement count 1
UPDATE cascade_upd_parent SET b = 999 WHERE a = 1

query II rowsort
SELECT a, b FROM cascade_upd_child
----
1  999
2  20

statement ok
DROP TABLE cascade_upd_child, cascade_upd_parent

# ON DELETE SET NULL on a subset FK: deleting the parent row sets the child's
# FK columns (all of them, including non-unique-backed ones) to NULL.
statement ok
CREATE TABLE setnull_parent (a INT PRIMARY KEY, b INT, c INT)

statement ok
CREATE TABLE setnull_child (
  a INT, b INT, c INT,
  FOREIGN KEY (a, b, c) REFERENCES setnull_parent (a, b, c) ON DELETE SET NULL
)

statement ok
INSERT INTO setnull_parent VALUES (1, 10, 100), (2, 20, 200)

statement ok
INSERT INTO setnull_child VALUES (1, 10, 100), (2, 20, 200)

statement count 1
DELETE FROM setnull_parent WHERE a = 1

query III rowsort
SELECT a, b, c FROM setnull_child
----
NULL  NULL  NULL
2     20    200

statement ok
DROP TABLE setnull_child, setnull_parent

# ON DELETE SET DEFAULT on a subset FK: deleting the parent row resets the
# child's FK columns to their declared DEFAULT values. The defaults must
# themselves identify a valid parent row (here we keep a "fallback" parent
# at (0, 0, 0)).
statement ok
CREATE TABLE setdefault_parent (a INT PRIMARY KEY, b INT, c INT)

statement ok
CREATE TABLE setdefault_child (
  a INT DEFAULT 0, b INT DEFAULT 0, c INT DEFAULT 0,
  FOREIGN KEY (a, b, c) REFERENCES setdefault_parent (a, b, c) ON DELETE SET DEFAULT
)

statement ok
INSERT INTO setdefault_parent VALUES (0, 0, 0), (1, 10, 100)

statement ok
INSERT INTO setdefault_child VALUES (1, 10, 100)

statement count 1
DELETE FROM setdefault_parent WHERE a = 1

query III rowsort
SELECT a, b, c FROM setdefault_child
----
0  0  0

statement ok
DROP TABLE setdefault_child, setdefault_parent

# ON UPDATE SET NULL on a subset FK: updating any referenced column on the
# parent (including the non-unique-backed ones) sets the child's FK columns
# to NULL. Verifies the cascade fires for non-unique-backed col updates and
# uses SET NULL semantics rather than CASCADE.
statement ok
CREATE TABLE setnull_upd_parent (a INT PRIMARY KEY, b INT, c INT)

statement ok
CREATE TABLE setnull_upd_child (
  a INT, b INT, c INT,
  FOREIGN KEY (a, b, c) REFERENCES setnull_upd_parent (a, b, c) ON UPDATE SET NULL
)

statement ok
INSERT INTO setnull_upd_parent VALUES (1, 10, 100), (2, 20, 200)

statement ok
INSERT INTO setnull_upd_child VALUES (1, 10, 100), (2, 20, 200)

# Update the non-unique-backed col on parent; cascade should set the child's
# FK cols to NULL.
statement count 1
UPDATE setnull_upd_parent SET b = 999 WHERE a = 1

query III rowsort
SELECT a, b, c FROM setnull_upd_child
----
NULL  NULL  NULL
2     20    200

statement ok
DROP TABLE setnull_upd_child, setnull_upd_parent

subtest end

# MATCH SIMPLE / MATCH FULL semantics on subset FKs: the NULL-handling rules
# apply to the FULL FK column set, not just the unique-backed subset.
subtest subset_unique_match

statement ok
CREATE TABLE match_parent (a INT PRIMARY KEY, b INT, c INT)

statement ok
INSERT INTO match_parent VALUES (1, 10, 100)

# MATCH SIMPLE (default): if any FK column is NULL, the FK check is skipped
# entirely. The residual equality filter on non-unique-backed columns must
# not fire when the row is being skipped wholesale.
statement ok
CREATE TABLE match_simple_child (
  a INT, b INT, c INT,
  FOREIGN KEY (a, b, c) REFERENCES match_parent (a, b, c) MATCH SIMPLE
)

# Unique-backed col NULL → check skipped.
statement ok
INSERT INTO match_simple_child VALUES (NULL, 10, 100)

# Non-unique-backed col NULL → check also skipped (MATCH SIMPLE applies to
# the whole FK column set, including columns enforced via the residual filter
# under subset matching).
statement ok
INSERT INTO match_simple_child VALUES (1, NULL, 100)

statement ok
INSERT INTO match_simple_child VALUES (1, 10, NULL)

# All non-NULL → check enforced. Mismatch on a unique-backed col fails.
statement error pq: insert on table "match_simple_child" violates foreign key constraint
INSERT INTO match_simple_child VALUES (99, 10, 100)

# All non-NULL → check enforced. Mismatch on a non-unique-backed col fails
# (proves the residual filter still fires when no FK col is NULL).
statement error pq: insert on table "match_simple_child" violates foreign key constraint
INSERT INTO match_simple_child VALUES (1, 999, 100)

statement ok
DROP TABLE match_simple_child

# MATCH FULL: all FK columns must be all-NULL or all-non-NULL. Mixed-NULL
# rows are rejected outright with a "MATCH FULL does not allow mixing of
# null and nonnull values" error. With subset matching, this rule applies to
# the full FK column set, not just the unique-backed subset.
statement ok
CREATE TABLE match_full_child (
  a INT, b INT, c INT,
  FOREIGN KEY (a, b, c) REFERENCES match_parent (a, b, c) MATCH FULL
)

# All NULL → allowed (skipped).
statement ok
INSERT INTO match_full_child VALUES (NULL, NULL, NULL)

# All non-NULL with matching parent → succeeds.
statement ok
INSERT INTO match_full_child VALUES (1, 10, 100)

# Mixed NULL where the unique-backed col is NULL → MATCH FULL violation.
statement error MATCH FULL does not allow mixing of null and nonnull key values
INSERT INTO match_full_child VALUES (NULL, 10, 100)

# Mixed NULL where ONLY a non-unique-backed col is NULL → also a MATCH FULL
# violation. Confirms the rule applies to the full referenced column set
# under subset matching.
statement error MATCH FULL does not allow mixing of null and nonnull key values
INSERT INTO match_full_child VALUES (1, NULL, 100)

statement ok
DROP TABLE match_full_child, match_parent

subtest end

# Drop a referenced column that is not contained in any unique constraint on
# the parent (only possible with subset FKs). The usual unique-cascade path
# does not fire, so the inbound FK must be torn down on the child directly.
subtest subset_unique_drop_referenced_column_not_in_backing_unique

statement ok
CREATE TABLE drop_ref_parent (a INT PRIMARY KEY, b INT)

statement ok
CREATE TABLE drop_ref_child (
  a INT, b INT,
  CONSTRAINT drop_ref_fk FOREIGN KEY (a, b) REFERENCES drop_ref_parent (a, b)
)

# RESTRICT (default): the inbound FK must block the column drop with a
# dependent-objects error, not a panic or "constraint does not exist".
onlyif config local-legacy-schema-changer
statement error pq: cannot drop column "b" because constraint "drop_ref_fk on relation drop_ref_child" depends on it
ALTER TABLE drop_ref_parent DROP COLUMN b

skipif config local-legacy-schema-changer
statement error pq: cannot drop column.*because constraint.*drop_ref_fk.*depends on it
ALTER TABLE drop_ref_parent DROP COLUMN b

# CASCADE: the FK must be torn down on the child without trying to resolve
# the constraint name on the parent.
statement ok
ALTER TABLE drop_ref_parent DROP COLUMN b CASCADE

query TTTTB nosort
SHOW CONSTRAINTS FROM drop_ref_child
----
drop_ref_child  drop_ref_child_pkey            PRIMARY KEY  PRIMARY KEY (rowid ASC)  true
drop_ref_child  drop_ref_child_rowid_not_null  NOT NULL     NOT NULL                 true

statement ok
DROP TABLE drop_ref_child, drop_ref_parent

subtest end

# Same dispatch path as above, reached differently: the dropped column is in
# some backing unique constraints, but a remaining subset-cover spares the FK
# from the unique-cascade.
subtest subset_unique_drop_column_with_multiple_backing_constraints

statement ok
SET experimental_enable_unique_without_index_constraints = true

statement ok
CREATE TABLE uwi_inbound_parent (
  d INT,
  e INT,
  CONSTRAINT unique_e_only UNIQUE WITHOUT INDEX (e),
  CONSTRAINT unique_d_only UNIQUE WITHOUT INDEX (d),
  CONSTRAINT unique_d_e_only UNIQUE WITHOUT INDEX (d, e)
);
CREATE TABLE uwi_inbound_child (
  d INT,
  e INT,
  CONSTRAINT fk_d_e_only FOREIGN KEY (d, e) REFERENCES uwi_inbound_parent (d, e)
)

onlyif config local-legacy-schema-changer
statement error pq: "unique_d(_e)?_only" is referenced by foreign key from table "uwi_inbound_child"
ALTER TABLE uwi_inbound_parent DROP COLUMN d

skipif config local-legacy-schema-changer
statement error pq: cannot drop column.*because constraint.*fk_d_e_only.*depends on it
ALTER TABLE uwi_inbound_parent DROP COLUMN d

statement ok
ALTER TABLE uwi_inbound_parent DROP COLUMN d CASCADE

query TTTTB nosort
SHOW CONSTRAINTS FROM uwi_inbound_child
----
uwi_inbound_child  uwi_inbound_child_pkey            PRIMARY KEY  PRIMARY KEY (rowid ASC)  true
uwi_inbound_child  uwi_inbound_child_rowid_not_null  NOT NULL     NOT NULL                 true

statement ok
DROP TABLE uwi_inbound_child;
DROP TABLE uwi_inbound_parent;

statement ok
RESET experimental_enable_unique_without_index_constraints

# Verify that the sql.subset_unique_fks.enabled cluster setting can disable
# new subset-unique FK creation, that the error includes a hint pointing at
# the setting, and that flipping the setting off does NOT affect existing
# subset-unique FKs. Specifically, lookups that resolve an existing FK's
# backing unique constraint must keep honoring subset matching: DML
# enforcement on the child still validates, and a parent-side DROP
# CONSTRAINT on the backing unique still discovers the FK as a dependent.
subtest subset_unique_cluster_setting

statement ok
CREATE TABLE setting_parent (a INT PRIMARY KEY, b INT, c INT, UNIQUE (b))

statement ok
INSERT INTO setting_parent VALUES (1, 10, 100), (2, 20, 200)

# Create a subset-unique FK while the setting is at its default (true).
statement ok
CREATE TABLE setting_child_existing (
  b INT, c INT,
  CONSTRAINT subset_unique_fk FOREIGN KEY (b, c) REFERENCES setting_parent (b, c) ON DELETE CASCADE
)

statement ok
INSERT INTO setting_child_existing VALUES (10, 100), (20, 200)

# Disable the relaxation.
statement ok
SET CLUSTER SETTING sql.subset_unique_fks.enabled = false

# CREATE TABLE: a new subset-unique FK is rejected, with a hint that names
# the cluster setting so users can discover the gate.
statement error there is no unique constraint matching given keys for referenced table setting_parent\nHINT:.*sql\.subset_unique_fks\.enabled
CREATE TABLE setting_child_new (
  b INT, c INT,
  FOREIGN KEY (b, c) REFERENCES setting_parent (b, c)
)

# ALTER TABLE ADD CONSTRAINT: same gate via the declarative path.
statement ok
CREATE TABLE setting_child_new (b INT, c INT)

statement error there is no unique constraint matching given keys for referenced table setting_parent\nHINT:.*sql\.subset_unique_fks\.enabled
ALTER TABLE setting_child_new
  ADD CONSTRAINT new_fk FOREIGN KEY (b, c) REFERENCES setting_parent (b, c)

# Exact-match FKs are unaffected by the setting.
statement ok
ALTER TABLE setting_child_new
  ADD CONSTRAINT exact_fk FOREIGN KEY (b) REFERENCES setting_parent (b)

# Drop setting_child_new now so that the DROP CONSTRAINT test below has
# only subset_unique_fk (the subset-unique FK we want to exercise) depending
# on the parent's UNIQUE(b).
statement ok
DROP TABLE setting_child_new

# Existing subset-unique FK still validates DML even with the setting off.
statement error pq: insert on table "setting_child_existing" violates foreign key constraint
INSERT INTO setting_child_existing VALUES (99, 0)

statement error pq: update on table "setting_child_existing" violates foreign key constraint
UPDATE setting_child_existing SET b = 999 WHERE b = 10

# Existing subset-unique FK is still discovered as a back-reference when
# the parent row is deleted: ON DELETE CASCADE removes the corresponding
# child rows.
statement count 1
DELETE FROM setting_parent WHERE a = 1

query II rowsort
SELECT b, c FROM setting_child_existing
----
20  200

# Existing subset-unique FK is also discovered as a back-reference when
# the parent's backing unique is dropped. DROP INDEX CASCADE removes both
# the unique and the dependent FK; if the back-reference walker missed
# the FK, it would survive as a dangling reference. (DROP INDEX is used
# instead of ALTER TABLE DROP CONSTRAINT for compatibility with the
# legacy schema changer, which rejects DROP CONSTRAINT for unique
# constraints.)
#
# Confirm via information_schema that the FK is present before the DROP
# and absent after.
query I
SELECT count(*) FROM information_schema.referential_constraints
 WHERE constraint_name = 'subset_unique_fk'
----
1

statement ok
DROP INDEX setting_parent@setting_parent_b_key CASCADE

query I
SELECT count(*) FROM information_schema.referential_constraints
 WHERE constraint_name = 'subset_unique_fk'
----
0

statement ok
DROP TABLE setting_child_existing;
DROP TABLE setting_parent

statement ok
RESET CLUSTER SETTING sql.subset_unique_fks.enabled

subtest end
