# LogicTest: local

statement ok
CREATE TABLE t (
  k INT PRIMARY KEY,
  a INT,
  b INT,
  c INT,
  s STRING,
  t TIMESTAMPTZ,
  INDEX (a),
  INDEX (s),
  INDEX (t)
)

statement ok
CREATE TABLE c (
  k INT PRIMARY KEY,
  a INT,
  INDEX (a)
)

statement ok
CREATE TABLE g (
  k INT PRIMARY KEY,
  a INT,
  b INT,
  INDEX (a, b)
)

statement ok
SET plan_cache_mode = force_generic_plan

statement ok
PREPARE p AS SELECT * FROM t WHERE a = 1 AND b = 2 AND c = 3

# An ideal generic plan can be built during PREPARE for queries with no
# placeholders nor stable expressions.
query T match(plan\stype)
EXPLAIN ANALYZE EXECUTE p
----
plan type: generic, reused

statement ok
SET plan_cache_mode = force_custom_plan

# The ideal generic plan is reused even when forcing a custom plan because it
# will always be optimal.
query T match(plan\stype)
EXPLAIN ANALYZE EXECUTE p
----
plan type: generic, reused

statement ok
DEALLOCATE p

# Prepare the same query with plan_cache_mode set to force_custom_plan.
statement ok
PREPARE p AS SELECT * FROM t WHERE a = 1 AND b = 2 AND c = 3

# Execute it once with plan_cache_mode set to force_custom_plan.
query T match(plan\stype)
EXPLAIN ANALYZE EXECUTE p
----
plan type: generic, reused

statement ok
SET plan_cache_mode = force_generic_plan

# The plan is an ideal generic plan (it has no placeholders), so it can be
# reused with plan_cache_mode set to force_generic_plan.
query T match(plan\stype)
EXPLAIN ANALYZE EXECUTE p
----
plan type: generic, reused

statement ok
DEALLOCATE p

statement ok
PREPARE p AS SELECT * FROM t WHERE k = $1

# An ideal generic plan can be built during PREPARE when the placeholder
# fast-path can be used.
query T match(plan\stype)
EXPLAIN ANALYZE EXECUTE p(33)
----
plan type: generic, reused

statement ok
SET plan_cache_mode = force_custom_plan

# The ideal generic plan is reused even when forcing a custom plan because it
# will always be optimal.
query T match(plan\stype)
EXPLAIN ANALYZE EXECUTE p(33)
----
plan type: generic, reused

statement ok
SET plan_cache_mode = force_generic_plan

statement ok
DEALLOCATE p

statement ok
PREPARE p AS SELECT * FROM t WHERE a = $1 AND c = $2

# A simple generic plan can be built during EXECUTE.
query T match(plan\stype)
EXPLAIN ANALYZE EXECUTE p(1, 2)
----
plan type: generic, re-optimized

# The generic plan can be reused with different placeholder values.
query T match(plan\stype)
EXPLAIN ANALYZE EXECUTE p(11, 22)
----
plan type: generic, reused

statement ok
SET plan_cache_mode = force_custom_plan

# The generic plan is not reused when forcing a custom plan.
query T match(plan\stype)
EXPLAIN ANALYZE EXECUTE p(1, 2)
----
plan type: custom

statement ok
SET plan_cache_mode = force_generic_plan

statement ok
DEALLOCATE p

statement ok
PREPARE p AS SELECT * FROM t WHERE t = now()

# A generic plan with a stable expression.
query T match(plan\stype)
EXPLAIN ANALYZE EXECUTE p
----
plan type: generic, re-optimized

# The generic plan can be reused.
query T match(plan\stype)
EXPLAIN ANALYZE EXECUTE p
----
plan type: generic, reused

statement ok
DEALLOCATE p

statement ok
PREPARE p AS SELECT k FROM t WHERE s LIKE $1

# A suboptimal generic query plan is chosen if it is forced.
query T match(plan\stype)
EXPLAIN ANALYZE EXECUTE p('foo%')
----
plan type: generic, re-optimized

statement ok
DEALLOCATE p

statement ok
PREPARE p AS SELECT k FROM t WHERE c = $1

# A simple generic plan.
query T match(plan\stype)
EXPLAIN ANALYZE EXECUTE p(1)
----
plan type: generic, re-optimized

statement ok
ALTER TABLE t ADD COLUMN z INT

# A schema change invalidates the generic plan, and it must be re-optimized.
query T match(plan\stype)
EXPLAIN ANALYZE EXECUTE p(1)
----
plan type: generic, re-optimized

statement ok
DEALLOCATE p

statement ok
ALTER TABLE t DROP COLUMN z

statement ok
SET plan_cache_mode = auto

statement ok
PREPARE p AS SELECT * FROM t WHERE a = 1 AND b = 2 AND c = 3

# An ideal generic plan is used immediately with plan_cache_mode=auto.
query T match(plan\stype)
EXPLAIN ANALYZE EXECUTE p
----
plan type: generic, reused

statement ok
DEALLOCATE p

statement ok
PREPARE p AS SELECT * FROM t WHERE a = $1 AND c = $2

statement ok
EXECUTE p(1, 2);
EXECUTE p(10, 20);
EXECUTE p(100, 200);
EXECUTE p(1000, 2000);
EXECUTE p(10000, 20000);

# On the sixth execution a generic query plan will be generated. The cost of the
# generic plan is more than the average cost of the five custom plans (plus some
# overhead cost of optimization), so the custom plan is chosen.
query T match(plan\stype)
EXPLAIN ANALYZE EXECUTE p(10000, 20000)
----
plan type: custom

statement ok
DEALLOCATE p

# Now use a more complex query that could have multiple join orderings.
statement ok
PREPARE p AS
SELECT t.k, c.k, g.k FROM t
JOIN c ON t.k = c.a
JOIN g ON c.k = g.a
WHERE t.a = $1 AND t.c = $2

statement ok
EXECUTE p(1, 2);
EXECUTE p(10, 20);
EXECUTE p(100, 200);
EXECUTE p(1000, 2000);

# The first five executions will use a custom plan. This is the fifth.
query T match(plan\stype)
EXPLAIN ANALYZE EXECUTE p(10000, 20000)
----
plan type: custom

# On the sixth execution a generic query plan will be generated. The cost of the
# generic plan is less than the average cost of the five custom plans (plus some
# overhead cost of optimization), so the generic plan is chosen.
query T match(plan\stype)
EXPLAIN ANALYZE EXECUTE p(10000, 20000)
----
plan type: generic, re-optimized

# On the seventh execution the generic plan is reused.
query T match(plan\stype)
EXPLAIN ANALYZE EXECUTE p(10000, 20000)
----
plan type: generic, reused

statement ok
ALTER TABLE t ADD COLUMN z INT

# If a schema change occurs, the cost of both plans is reset, so the custom plan
# is used for at least 5 executions.
query T match(plan\stype)
EXPLAIN ANALYZE EXECUTE p(1, 2)
----
plan type: custom

statement ok
EXECUTE p(1, 2);
EXECUTE p(10, 20);
EXECUTE p(100, 200);
EXECUTE p(1000, 2000);

# On the sixth execution after the schema change a generic plan is built and
# used.
query T match(plan\stype)
EXPLAIN ANALYZE EXECUTE p(1, 2)
----
plan type: generic, re-optimized

# On the seventh execution after the schema change the generic plan is reused.
query T match(plan\stype)
EXPLAIN ANALYZE EXECUTE p(1, 2)
----
plan type: generic, reused

statement ok
DEALLOCATE p

# Now use a query with a bad generic query plan.
statement ok
PREPARE p AS
SELECT * FROM g WHERE a = $1 ORDER BY b LIMIT 10

statement ok
EXECUTE p(1);
EXECUTE p(10);
EXECUTE p(100);
EXECUTE p(1000);
EXECUTE p(10000);

# The generic plan is generated on the sixth execution, but is more expensive
# than the average custom plan.
query T match(plan\stype)
EXPLAIN ANALYZE EXECUTE p(10)
----
plan type: custom

statement ok
SET plan_cache_mode = force_generic_plan

# The generic plan previously generated is reused when forcing a generic plan.
query T match(plan\stype)
EXPLAIN ANALYZE EXECUTE p(10)
----
plan type: generic, reused

statement ok
DEALLOCATE p

statement ok
SET plan_cache_mode = auto

statement ok
ALTER TABLE g INJECT STATISTICS '[
  {
    "columns": ["k"],
    "created_at": "2018-01-01 1:00:00.00000+00:00",
    "row_count": 0,
    "distinct_count": 0,
    "avg_size": 1
  }
]';

statement ok
PREPARE p AS
UPDATE t SET b = 0 WHERE a IN ($1, $2) AND b > $3

statement ok
EXECUTE p(1, 10, 100);
EXECUTE p(1, 10, 100);
EXECUTE p(1, 10, 100);
EXECUTE p(1, 10, 100);
EXECUTE p(1, 10, 100);

# The generic query plan is not chosen because it has a full table scan on a
# mutating table, while the custom plan does not.
query T match((plan\stype|FULL\sSCAN))
EXPLAIN ANALYZE EXECUTE p(1, 10, 100)
----
plan type: custom

statement ok
DEALLOCATE p

statement ok
PREPARE p AS
SELECT * FROM g WHERE a IN ($1, $2) AND b > $3

statement ok
EXECUTE p(1, 10, 100);
EXECUTE p(1, 10, 100);
EXECUTE p(1, 10, 100);
EXECUTE p(1, 10, 100);
EXECUTE p(1, 10, 100);

# The generic query plan is not chosen because it has a full table scan, while
# the custom plan does not.
query T match((plan\stype|FULL\sSCAN))
EXPLAIN ANALYZE EXECUTE p(1, 10, 100)
----
plan type: custom

statement ok
DEALLOCATE p

statement ok
PREPARE p AS
SELECT * FROM g
UNION ALL
SELECT * FROM g WHERE a IN ($1, $2) AND b > $3

statement ok
EXECUTE p(1, 10, 100);
EXECUTE p(1, 10, 100);
EXECUTE p(1, 10, 100);
EXECUTE p(1, 10, 100);
EXECUTE p(1, 10, 100);

# The generic query plan is not chosen because it has two full table scans,
# while the custom plan has only one.
query T match((plan\stype|FULL\sSCAN))
EXPLAIN ANALYZE EXECUTE p(1, 10, 100)
----
plan type: custom
│     spans: FULL SCAN

statement ok
DEALLOCATE p

# Regression test for #132963. Do not cache non-reusable plans.
statement ok
SET plan_cache_mode = auto

statement ok
CREATE TABLE a (a INT PRIMARY KEY)

statement ok
PREPARE p AS SELECT create_statement FROM [SHOW CREATE TABLE a]

query T
EXECUTE p
----
CREATE TABLE public.a (
  a INT8 NOT NULL,
  CONSTRAINT a_pkey PRIMARY KEY (a ASC)
)

statement ok
ALTER TABLE a RENAME TO b

statement error pgcode 42P01 pq: relation \"a\" does not exist
EXECUTE p

statement ok
DEALLOCATE p

# Regression test for #135151. Do not build suboptimal generic plans when an
# ideal generic plan (using the placeholder fast path) was previously planned.
statement ok
CREATE TABLE t135151 (
  k INT PRIMARY KEY,
  a INT,
  b INT,
  INDEX (a, b)
);

statement ok
SET plan_cache_mode = force_custom_plan;

statement ok
PREPARE p AS SELECT k FROM t135151 WHERE a = $1 AND b = $2;

query T match(plan\stype)
EXPLAIN ANALYZE EXECUTE p(1, 2);
----
plan type: generic, reused

statement ok
ALTER TABLE t135151 INJECT STATISTICS '[
  {
    "columns": ["a"],
    "created_at": "2018-01-01 1:00:00.00000+00:00",
    "row_count": 10000,
    "distinct_count": 10,
    "avg_size": 1
  },
  {
    "columns": ["b"],
    "created_at": "2018-01-01 1:00:00.00000+00:00",
    "row_count": 10000,
    "distinct_count": 10,
    "avg_size": 1
  }
]';

query T match(plan\stype)
EXPLAIN ANALYZE EXECUTE p(1, 2);
----
plan type: custom
