# LogicTest: cockroach-go-testserver-23.1

query T nodeidx=0
SELECT crdb_internal.node_executable_version()
----
23.1

query T nodeidx=1
SELECT crdb_internal.node_executable_version()
----
23.1

query T nodeidx=2
SELECT crdb_internal.node_executable_version()
----
23.1

# ----------------------------------------------------------------------
# Test UDFs with mutations with all nodes running old binaries.
# ----------------------------------------------------------------------

statement ok
CREATE TABLE t (a INT PRIMARY KEY, b INT DEFAULT 0);

statement error pgcode 0A000 pq: unimplemented: INSERT usage inside a function definition
CREATE FUNCTION f_insert() RETURNS VOID AS $$
  INSERT INTO t VALUES (1,1);
$$ LANGUAGE SQL;

statement error pgcode 0A000 pq: unimplemented: DELETE usage inside a function definition
CREATE FUNCTION f_delete() RETURNS VOID AS $$
  DELETE FROM t WHERE a = 1;
$$ LANGUAGE SQL;

statement error pgcode 0A000 pq: unimplemented: UPDATE usage inside a function definition
CREATE FUNCTION f_update() RETURNS VOID AS $$
  UPDATE t SET b = 1 WHERE a = 1;
$$ LANGUAGE SQL;

# ----------------------------------------------------------------------
# Test UDFs with mutations with only the gateway running 23.2.
# ----------------------------------------------------------------------

upgrade 0

user root nodeidx=0

statement error pgcode 0A000 pq: unimplemented: INSERT usage inside a function definition is not supported until version 23.2
CREATE FUNCTION f_insert() RETURNS VOID AS $$
  INSERT INTO t VALUES (1,1);
$$ LANGUAGE SQL;

statement error pgcode 0A000 pq: unimplemented: DELETE usage inside a function definition is not supported until version 23.2
CREATE FUNCTION f_delete() RETURNS VOID AS $$
  DELETE FROM t WHERE a = 1;
$$ LANGUAGE SQL;

statement error pgcode 0A000 pq: unimplemented: UPDATE usage inside a function definition is not supported until version 23.2
CREATE FUNCTION f_update() RETURNS VOID AS $$
  UPDATE t SET b = 1 WHERE a = 1;
$$ LANGUAGE SQL;

user root nodeidx=1

# These statements should fail.

statement error pgcode 0A000 pq: unimplemented: INSERT usage inside a function definition
CREATE FUNCTION f_insert() RETURNS VOID AS $$
  INSERT INTO t VALUES (1,1);
$$ LANGUAGE SQL;

statement error pgcode 0A000 pq: unimplemented: DELETE usage inside a function definition
CREATE FUNCTION f_delete() RETURNS VOID AS $$
  DELETE FROM t WHERE a = 1;
$$ LANGUAGE SQL;

statement error pgcode 0A000 pq: unimplemented: UPDATE usage inside a function definition
CREATE FUNCTION f_update() RETURNS VOID AS $$
  UPDATE t SET b = 1 WHERE a = 1;
$$ LANGUAGE SQL;

# ----------------------------------------------------------------------
# Upgrade all nodes and test that creating UDFs with mutations succeeds.
# ----------------------------------------------------------------------

upgrade 1

upgrade 2

statement ok
SET CLUSTER SETTING version = crdb_internal.node_executable_version()

query B retry
SELECT crdb_internal.is_at_least_version('23.2')
----
true

statement ok
CREATE FUNCTION f_insert() RETURNS VOID AS $$
  INSERT INTO t VALUES (1,1);
$$ LANGUAGE SQL;

statement ok
CREATE FUNCTION f_delete() RETURNS VOID AS $$
  DELETE FROM t WHERE a = 1;
$$ LANGUAGE SQL;

statement ok
CREATE FUNCTION f_update() RETURNS VOID AS $$
  UPDATE t SET b = 1 WHERE a = 1;
$$ LANGUAGE SQL;
