query BB
SELECT 'foo:1,2 bar:3'::tsvector @@ 'foo <-> bar'::tsquery, 'foo <-> bar'::tsquery @@ 'foo:1,2 bar:3'::tsvector
----
true  true

statement ok
CREATE TABLE a (v tsvector, q tsquery)

statement ok
INSERT INTO a VALUES('foo:1,2 bar:4B'::tsvector, 'foo <2> bar'::tsquery)

query TT
SELECT * FROM a
----
'bar':4B 'foo':1,2  'foo' <2> 'bar'

query BB
SELECT 'foo:1,2 bar:4B'::tsvector @@ 'foo <2> bar'::tsquery, 'foo:1,2 bar:4B' @@ 'foo <-> bar'::tsquery
----
true  false

query BB
SELECT v @@ 'foo <2> bar'::tsquery, v @@ 'foo <-> bar'::tsquery FROM a
----
true  false

query B
SELECT v @@ q FROM a
----
true

# Test column modifiers.

statement ok
CREATE TABLE b (a INT PRIMARY KEY DEFAULT 1, v tsvector DEFAULT 'foo:1' ON UPDATE 'bar:2', v2 tsvector AS (v) STORED, v3 tsvector AS (v) VIRTUAL)

statement ok
CREATE TABLE c (a INT PRIMARY KEY DEFAULT 1, q tsquery DEFAULT 'foo' ON UPDATE 'bar', q2 tsquery AS (q) STORED, q3 tsquery AS (q) VIRTUAL)

statement ok
INSERT INTO b DEFAULT VALUES

statement ok
INSERT INTO c DEFAULT VALUES

query ITTT
SELECT * FROM b
----
1  'foo':1  'foo':1  'foo':1

query ITTT
SELECT * FROM c
----
1  'foo'  'foo'  'foo'

statement ok
UPDATE b SET a = 2 WHERE a = 1

statement ok
UPDATE c SET a = 2 WHERE a = 1

query ITTT
SELECT * FROM b
----
2  'bar':2  'bar':2  'bar':2

query ITTT
SELECT * FROM c
----
2  'bar'  'bar'  'bar'

statement ok
INSERT INTO b VALUES (3, 'foo:1,5 zoop:3')

statement error can't order by column type TSVECTOR
SELECT * FROM b ORDER BY v

statement error can't order by column type TSQUERY
SELECT * FROM c ORDER BY q

statement error arrays of tsvector not allowed
CREATE TABLE tsarray(a tsvector[])

statement error arrays of tsquery not allowed
CREATE TABLE tsarray(a tsquery[])

statement error unsupported comparison operator
SELECT a, v FROM b WHERE v > 'bar:2'::tsvector

statement error unsupported comparison operator
SELECT a, q FROM c WHERE q > 'abc'::tsquery

query IT
SELECT a, v FROM b WHERE v = 'bar:2'::tsvector
----
2  'bar':2

query IT
SELECT a, q FROM c WHERE q = 'bar'::tsquery
----
2  'bar'

# Ensure truncation of long position lists.
query T
SELECT ('foo:' || string_agg(g::TEXT,','))::tsvector from generate_series(1,280) g(g);
----
'foo':1,2,3,4,5,6,7,8,9,10,11,12,13,14,15,16,17,18,19,20,21,22,23,24,25,26,27,28,29,30,31,32,33,34,35,36,37,38,39,40,41,42,43,44,45,46,47,48,49,50,51,52,53,54,55,56,57,58,59,60,61,62,63,64,65,66,67,68,69,70,71,72,73,74,75,76,77,78,79,80,81,82,83,84,85,86,87,88,89,90,91,92,93,94,95,96,97,98,99,100,101,102,103,104,105,106,107,108,109,110,111,112,113,114,115,116,117,118,119,120,121,122,123,124,125,126,127,128,129,130,131,132,133,134,135,136,137,138,139,140,141,142,143,144,145,146,147,148,149,150,151,152,153,154,155,156,157,158,159,160,161,162,163,164,165,166,167,168,169,170,171,172,173,174,175,176,177,178,179,180,181,182,183,184,185,186,187,188,189,190,191,192,193,194,195,196,197,198,199,200,201,202,203,204,205,206,207,208,209,210,211,212,213,214,215,216,217,218,219,220,221,222,223,224,225,226,227,228,229,230,231,232,233,234,235,236,237,238,239,240,241,242,243,244,245,246,247,248,249,250,251,252,253,254,255,256

# Ensure truncation of large positions.
query T
SELECT 'foo:293847298347'::tsvector
----
'foo':16383

query error word is too long \(2047 bytes, max 2046 bytes\)
SELECT repeat('a', 2047)::tsvector

query error word is too long \(2047 bytes, max 2046 bytes\)
SELECT repeat('a', 2047)::tsquery

query error could not parse tsquery: distance in phrase operator must be an integer value between zero and 16384 inclusive
SELECT 'foo <23842937> bar'::tsquery

query error string is too long for tsvector
SELECT repeat('a', 1<<20)::tsvector

query error string is too long for tsquery
SELECT repeat('a', 1<<20)::tsquery

# TSVECTOR should convert to a JSON element as a string.
query T
VALUES ( json_build_array('''D'':236A,377C,622A ''SDfdZ'' ''aIjQScIT'':213A,418A,827A ''pHhJoarX'':106C,486C ''pjApqSC'' ''qXLpyjUM'':547C ''uWSPY'':10A,822B':::TSVECTOR)::JSONB
       )
----
["'D':236A,377C,622A 'SDfdZ' 'aIjQScIT':213A,418A,827A 'pHhJoarX':106C,486C 'pjApqSC' 'qXLpyjUM':547C 'uWSPY':10A,822B"]

# TSQUERY should convert to a JSON element as a string.
query T
VALUES ( json_build_array($$'cat' & 'rat'$$:::TSQUERY)::JSONB)
----
["'cat' & 'rat'"]

# Test tsvector inverted indexes.
statement ok
DROP TABLE a;
CREATE TABLE a (
  a TSVECTOR,
  b TSQUERY,
  INVERTED INDEX(a)
);
INSERT INTO a VALUES('foo:3 bar:4,5'), ('baz:1'), ('foo:3'), ('bar:2')

query T
SELECT a FROM a@a_a_idx WHERE a @@ 'foo'
----
'bar':4,5 'foo':3
'foo':3

statement error index \"a_a_idx\" is inverted and cannot be used for this query
SELECT a FROM a@a_a_idx WHERE a @@ '!foo'

query T
SELECT a FROM a@a_a_idx WHERE a @@ 'foo' OR a @@ 'bar'
----
'bar':4,5 'foo':3
'foo':3
'bar':2

query T
SELECT a FROM a@a_a_idx WHERE a @@ 'foo | bar'
----
'bar':4,5 'foo':3
'foo':3
'bar':2

query T
SELECT a FROM a@a_a_idx WHERE a @@ 'foo | bar' OR a @@ 'baz'
----
'bar':4,5 'foo':3
'baz':1
'foo':3
'bar':2

query T
SELECT a FROM a@a_a_idx WHERE a @@ 'foo & bar'
----
'bar':4,5 'foo':3

query T
SELECT a FROM a@a_a_idx WHERE a @@ 'foo <-> bar'
----
'bar':4,5 'foo':3

query T
SELECT a FROM a@a_a_idx WHERE a @@ 'bar <-> foo'
----

query T
SELECT a FROM a@a_a_idx WHERE a @@ 'foo <-> !bar'
----
'foo':3

query T
SELECT a FROM a@a_a_idx WHERE a @@ '!baz <-> bar'
----
'bar':4,5 'foo':3
'bar':2

query T
SELECT a FROM a@a_a_idx WHERE a @@ 'foo & !bar'
----
'foo':3

query T
SELECT a FROM a@a_a_idx WHERE a @@ 'ba:*'
----
'bar':4,5 'foo':3
'baz':1
'bar':2

query T
SELECT a FROM a@a_a_idx WHERE a @@ 'ba:* | foo'
----
'bar':4,5 'foo':3
'baz':1
'foo':3
'bar':2

query T
SELECT a FROM a@a_a_idx WHERE a @@ 'ba:* & foo'
----
'bar':4,5 'foo':3

# Test that tsvector indexes can't accelerate the @@ operator with no constant
# columns.
statement error index \"a_a_idx\" is inverted and cannot be used for this query
EXPLAIN SELECT * FROM a@a_a_idx WHERE a @@ b
