statement ok
CREATE TABLE f (x FLOAT)

statement ok
INSERT INTO f(x) VALUES (3/2), (1)

query R rowsort
SELECT * FROM f
----
1.5
1

statement ok
CREATE TABLE i (x INT)

statement error value type timestamptz doesn't match type int of column "x"
INSERT INTO i(x) VALUES ('1970-01-01'::timestamptz)

statement ok
INSERT INTO i(x) VALUES (2.0)

statement error numeric constant out of int64 range
INSERT INTO i(x) VALUES (9223372036854775809)

query I rowsort
SELECT * FROM i
----
2

statement ok
CREATE TABLE d (x DECIMAL)

statement ok
INSERT INTO d(x) VALUES (((9 / 3) * (1 / 3))), (2.0), (2.4 + 4.6)

query R rowsort
SELECT * FROM d
----
0.999999999999999999990000000000000000000
2.0
7.0

statement ok
UPDATE d SET x = x + 1 WHERE x + sqrt(x) >= 2 + .1

query R rowsort
SELECT * FROM d
----
0.999999999999999999990000000000000000000
3.0
8.0

statement ok
CREATE TABLE s (x STRING)

query T
SELECT * FROM s WHERE x > b'\x00'
----

statement ok
INSERT INTO s(x) VALUES (b'qwe'), ('start' || b'end')

statement ok
INSERT INTO s(x) VALUES (b'\xfffefd')

query IT rowsort
SELECT length(x), encode(x::bytes, 'escape') from s
----
3 qwe
8 startend
5 \377fefd

statement error incompatible COALESCE expressions: could not parse "foo" as type int
INSERT INTO s VALUES (COALESCE(1, 'foo'))

statement error incompatible COALESCE expressions: could not parse "foo" as type int
INSERT INTO i VALUES (COALESCE(1, 'foo'))

query error incompatible COALESCE expressions: could not parse "foo" as type int
SELECT COALESCE(1, 'foo')

query error incompatible COALESCE expressions: could not parse "foo" as type int
SELECT COALESCE(1::INT, 'foo')

query error expected 2.3 to be of type int, found type decimal
SELECT greatest(-1, 1, 2.3, 123456789, 3 + 5, -(-4))

query I
SELECT greatest(-1, 1, 2, 123456789, 3 + 5, -(-4))
----
123456789

query T
SELECT greatest('2010-09-29', '2010-09-28'::TIMESTAMP)
----
2010-09-29 00:00:00 +0000 +0000

query T
SELECT greatest('PT12H2M', 'PT12H2M'::INTERVAL, '1s')
----
12:02:00

query R
SELECT greatest(-1.123, 1.21313, 2.3, 123456789.321, 3 + 5.3213, -(-4.3213), abs(-9))
----
123456789.321

statement ok
CREATE TABLE untyped (b bool, n INT, f FLOAT, e DECIMAL, d DATE, ts TIMESTAMP, tz TIMESTAMPTZ, i INTERVAL)

statement ok
INSERT INTO untyped VALUES ('f', '42', '4.2', '4.20', '2010-09-28', '2010-09-28 12:00:00.1', '2010-09-29 12:00:00.1', 'PT12H2M')

query BIRRTTTT
SELECT * FROM untyped
----
false  42  4.2  4.20  2010-09-28 00:00:00 +0000 +0000  2010-09-28 12:00:00.1 +0000 +0000  2010-09-29 12:00:00.1 +0000 UTC  12:02:00

# Issue #14527: support string literal coercion during overload resolution
query T
SELECT ts FROM untyped WHERE ts != '2015-09-18 00:00:00'
----
2010-09-28 12:00:00.1 +0000 +0000

# Regression tests for #15050

statement error pq: parsing as type timestamp: could not parse "Not Timestamp"
CREATE TABLE t15050a (c DECIMAL DEFAULT CASE WHEN now() < 'Not Timestamp' THEN 2 ELSE 2 END);

statement error pq: parsing as type timestamp: could not parse "Not Timestamp"
CREATE TABLE t15050b (c DECIMAL DEFAULT IF(now() < 'Not Timestamp', 2, 2));

# Regression tests for #15632

statement error incompatible IFNULL expressions: could not parse "foo" as type bool
SELECT IFNULL('foo', false)

statement error incompatible IFNULL expressions: could not parse "foo" as type bool
SELECT IFNULL(true, 'foo')

query B
SELECT IFNULL(false, 'true')
----
false

query B
SELECT IFNULL('true', false)
----
true

# Regression tests for #19770

query B
SELECT 1 in (SELECT 1)
----
true

statement error could not parse "a" as type int
SELECT 1 IN (SELECT 'a')

statement error unsupported comparison operator: <int> IN <tuple{tuple{int, int}}>
SELECT 1 IN (SELECT (1, 2))

query B
SELECT (1, 2) IN (SELECT 1, 2)
----
true

query B
SELECT (1, 2) IN (SELECT (1, 2))
----
true

statement ok
CREATE TABLE t1 (a DATE)

statement ok
CREATE TABLE t2 (b TIMESTAMPTZ)

statement ok
INSERT INTO t1 VALUES (DATE '2018-01-01'); INSERT INTO t2 VALUES (TIMESTAMPTZ '2018-01-01');

# Make sure that we do not create invalid filters due to substituting columns
# with different types.
query TT
SELECT * FROM t1, t2 WHERE a = b AND age(b, TIMESTAMPTZ '2017-01-01') > INTERVAL '1 day'
----
2018-01-01 00:00:00 +0000 +0000  2018-01-01 00:00:00 +0000 UTC

# Regression test for #44181: allow left side of BETWEEN to be typed
# differently in the two comparisons.
query B
SELECT '' BETWEEN ''::BYTES AND '';
----
true

# Regression test for #44632: NULLIF should have the type of the first argument.
query I
SELECT NULLIF(NULL, 0) + NULLIF(NULL, 0)
----
NULL

query I
SELECT NULLIF(0, 0) + NULLIF(0, 0)
----
NULL

query I
SELECT NULLIF(0, NULL) + NULLIF(0, NULL)
----
0

# Regression test for #46196.
query T
SELECT max(t0.c0) FROM (VALUES (NULL), (NULL)) t0(c0)
----
NULL

query T
SELECT max(NULL) FROM (VALUES (NULL), (NULL)) t0(c0)
----
NULL

# Test qualified type references.
query IITR
SELECT 1::pg_catalog.int4, 1::pg_catalog.int8, 'aa'::pg_catalog.text, 4.2::pg_catalog.float4
----
1 1 aa 4.2

# Test fixed-length types.

query TTT
SELECT VARCHAR(4) 'foo', CHAR(2) 'bar', STRING(1) 'cat'
----
foo  ba  c

# Test that we error out referencing unknown types in pg_catalog.
query error pq: type "pg_catalog.special_int" does not exist
SELECT 1::pg_catalog.special_int

# Test that we error out trying to reference types in schemas that
# don't have types.
query error pq: type "crdb_internal.mytype" does not exist
SELECT 1::crdb_internal.mytype

# Regression test for #50978.
query T
SELECT CASE WHEN true THEN 1234:::OID ELSE COALESCE(NULL, NULL) END
----
1234

# Regression test for #51099.
query B rowsort
SELECT CASE WHEN x > 1 THEN true ELSE NULL AND true END FROM (VALUES (1), (2)) AS v(x)
----
NULL
true

query B rowsort
SELECT CASE WHEN x > 1 THEN true ELSE NULL OR false END FROM (VALUES (1), (2)) AS v(x)
----
NULL
true

# Error "cannot determine type of empty array" should apply no matter the
# operator, `>`, or `<`.
query error pq: cannot determine type of empty array\. Consider casting to the desired type, for example ARRAY\[\]::int\[\]
SELECT ARRAY[]::TIMESTAMPTZ[] >
       SOME (ARRAY[TIMESTAMPTZ '1969-12-29T21:20:13+01'], ARRAY[NULL]);

# Error "cannot determine type of empty array" should apply no matter the
# operator, `>`, or `<`.
query error pq: cannot determine type of empty array\. Consider casting to the desired type, for example ARRAY\[\]::int\[\]
SELECT ARRAY[]::TIMESTAMPTZ[] <
       SOME (ARRAY[TIMESTAMPTZ '1969-12-29T21:20:13+01'], ARRAY[NULL]);

# Regression test for #102110. Ensure CASE is typed correctly.
statement ok
CREATE TABLE t102110_1 (t TEXT);
INSERT INTO t102110_1 VALUES ('tt');

statement ok
CREATE TABLE t102110_2 (c CHAR);
INSERT INTO t102110_2 VALUES ('c');

query T
SELECT t102110_1.t FROM t102110_1, t102110_2
WHERE t102110_1.t NOT BETWEEN t102110_1.t AND
  (CASE WHEN NULL THEN t102110_2.c ELSE t102110_1.t END);
----

# IF is typed differently (Postgres does not support IF).
query T
SELECT t102110_1.t FROM t102110_1, t102110_2
WHERE t102110_1.t NOT BETWEEN t102110_1.t AND
  IF(NULL, t102110_2.c, t102110_1.t);
----
tt

# TODO(#108360): implicit casts from STRING to CHAR should use bpchar.
statement ok
CREATE TABLE t108360_1 (t TEXT);
INSERT INTO t108360_1 VALUES ('tt');

statement ok
CREATE TABLE t108360_2 (c CHAR);
INSERT INTO t108360_2 VALUES ('c');

# This returns one row with 'tt' in Postgres. The results are different because
# Postgres casts t108360_1.t to bpchar rather than char.
query T
SELECT (CASE WHEN t108360_1.t > t108360_2.c THEN t108360_1.t ELSE t108360_2.c END)
FROM t108360_1, t108360_2
WHERE t108360_1.t = (CASE WHEN t108360_1.t > t108360_2.c THEN t108360_1.t ELSE t108360_2.c END);
----
