statement ok
CREATE TABLE ab (a INT PRIMARY KEY, b INT);
INSERT INTO ab VALUES (1, 10), (2, 20), (3, 30), (4, 40);

statement ok
CREATE FUNCTION f() RETURNS INT LANGUAGE SQL AS $$
  WITH foo AS MATERIALIZED (SELECT 100) SELECT * FROM foo;
$$;

query I
SELECT f();
----
100

statement ok
DROP FUNCTION f;
CREATE FUNCTION f() RETURNS INT LANGUAGE SQL AS $$
  WITH foo AS MATERIALIZED (SELECT b FROM ab WHERE a = 3) SELECT * FROM foo;
$$;

query I
SELECT f();
----
30

# Multiple references to the CTE.
statement ok
DROP FUNCTION f;
CREATE FUNCTION f() RETURNS INT LANGUAGE SQL AS $$
  WITH foo (bar) AS (SELECT 1) SELECT foo.bar + foo2.bar FROM foo, foo foo2;
$$;

query I
SELECT f();
----
2

# CTE with multiple branches.
statement ok
DROP FUNCTION f;
CREATE FUNCTION f() RETURNS INT LANGUAGE SQL AS $$
  WITH foo (x) AS MATERIALIZED (SELECT 1),
  bar (x) AS MATERIALIZED (SELECT 2)
  SELECT foo.x + bar.x FROM foo, bar;
$$;

query I
SELECT f();
----
3

# Nested CTE expressions.
statement ok
DROP FUNCTION f;
CREATE FUNCTION f() RETURNS INT LANGUAGE SQL AS $$
  WITH foo (x) AS MATERIALIZED (SELECT 100)
  SELECT * FROM (
    WITH bar (x) AS MATERIALIZED (SELECT 200)
    SELECT foo.x + bar.x FROM foo, bar
  ) AS t;
$$;

query I
SELECT f();
----
300

# Case with an outer CTE.
statement ok
DROP FUNCTION f;
CREATE FUNCTION f() RETURNS INT LANGUAGE SQL AS $$
  WITH foo AS MATERIALIZED (SELECT 1) SELECT * FROM foo;
$$;

query II
WITH bar AS (SELECT 2) SELECT f(), * FROM bar;
----
1  2

# The outer CTE has the same name as the inner CTE.
query II
WITH foo AS (SELECT 2) SELECT f(), * FROM foo;
----
1  2

# Case with a CTE inside a subquery.
statement ok
DROP FUNCTION f;
CREATE FUNCTION f() RETURNS INT LANGUAGE SQL AS $$
  SELECT (
    WITH foo AS MATERIALIZED (SELECT b FROM ab)
    SELECT * FROM foo
  );
$$;

# Avoid causing an error due to too many rows returned.
statement ok
DELETE FROM ab WHERE a > 1;

query I
SELECT f();
----
10

statement ok
INSERT INTO ab VALUES (2, 20), (3, 30), (4, 40);

# Case with a recursive CTE.
statement ok
DROP FUNCTION f;
CREATE FUNCTION f() RETURNS INT[] LANGUAGE SQL AS $$
  WITH RECURSIVE foo (x, y) AS (
    SELECT a, b FROM ab WHERE a = 1
    UNION ALL
    SELECT a, b FROM ab WHERE a = (SELECT max(x) + 1 FROM foo)
  )
  SELECT array_agg(y) FROM foo;
$$;

query T
SELECT f();
----
{10,20,30,40}

subtest regression_138273

statement ok
CREATE SEQUENCE seq_1;

# Verify that the function can be successfully created with a CTE inside a
# scalar expression.
statement ok
CREATE FUNCTION f138273_1() RETURNS TIMESTAMP LANGUAGE PLpgSQL AS $$
  DECLARE
    decl TIMESTAMP;
  BEGIN
    WHILE false LOOP
      IF true THEN
      ELSIF EXISTS (WITH cte(col) AS (SELECT * FROM (VALUES (currval('seq_1'))) AS foo) SELECT 1 FROM cte) THEN
        RETURN decl;
      END IF;
    END LOOP;
  END;
$$;

# Test a similar function that actually executes the CTE.
statement ok
CREATE FUNCTION f138273_2() RETURNS INT LANGUAGE PLpgSQL AS $$
  BEGIN
    SELECT nextval('seq_1');
    WHILE EXISTS (WITH cte(col) AS (SELECT * FROM (VALUES (currval('seq_1'))) AS foo) SELECT 1 FROM cte) LOOP
      RETURN currval('seq_1');
    END LOOP;
  END;
$$;

query I
SELECT f138273_2();
----
1

subtest end
