# LogicTest: default parallel-stmts distsql

statement ok
CREATE TABLE kv (
  k INT PRIMARY KEY,
  v INT
)

statement ok
INSERT INTO kv VALUES (1, 1), (2, 2), (3, 3) ON CONFLICT (k) DO UPDATE SET v = excluded.v

query II
SELECT * FROM kv ORDER BY (k, v)
----
1 1
2 2
3 3

statement error multiple assignments to the same column
INSERT INTO kv VALUES (4, 4), (2, 5), (6, 6) ON CONFLICT (k) DO UPDATE SET v = 1, v = 1

statement ok
INSERT INTO kv VALUES (4, 4), (2, 5), (6, 6) ON CONFLICT (k) DO UPDATE SET v = excluded.v

statement ok
UPSERT INTO kv VALUES (7, 7), (3, 8), (9, 9)

statement ok
INSERT INTO kv VALUES (1, 10) ON CONFLICT (k) DO UPDATE SET v = (SELECT CAST(SUM(k) AS INT) FROM kv)

statement error column reference "v" is ambiguous \(candidates: excluded.v, kv.v\)
INSERT INTO kv VALUES (4, 10) ON CONFLICT (k) DO UPDATE SET v = v + 1

statement ok
INSERT INTO kv VALUES (4, 10) ON CONFLICT (k) DO UPDATE SET v = kv.v + 20

statement error there is no unique or exclusion constraint matching the ON CONFLICT specification
INSERT INTO kv VALUES (4, 10) ON CONFLICT DO UPDATE SET v = kv.v + 20

statement error duplicate key value \(k\)=\(3\) violates unique constraint "primary"
INSERT INTO kv VALUES (2, 10) ON CONFLICT (k) DO UPDATE SET k = 3, v = 10

statement ok
INSERT INTO kv VALUES (9, 9) ON CONFLICT (k) DO UPDATE SET (k, v) = (excluded.k + 2, excluded.v + 3)

statement ok
UPSERT INTO kv VALUES (10, 10), (10, 11)

query II
UPSERT INTO kv VALUES (11, 10), (11, 12) RETURNING k, v
----
11 10
11 12

statement ok
INSERT INTO kv VALUES (13, 13), (7, 8) ON CONFLICT (k) DO NOTHING

statement error there is no unique or exclusion constraint matching the ON CONFLICT specification
INSERT INTO kv VALUES (13, 13), (7, 8) ON CONFLICT DO NOTHING

statement ok
INSERT INTO kv VALUES (14, 14), (14, 15) ON CONFLICT (k) DO UPDATE SET v = excluded.v + 1

statement ok
INSERT INTO kv VALUES (15, 15), (15, 16) ON CONFLICT (k) DO UPDATE SET k = excluded.k * 10

statement ok
INSERT INTO kv VALUES (16, 16), (16, 17) ON CONFLICT (k) DO UPDATE SET k = excluded.k * 10, v = excluded.v

query II
SELECT * FROM kv ORDER BY (k, v)
----
1   32
2   5
3   8
4   24
6   6
7   7
10  11
11  12
13  13
14  16
150 15
160 17

query II rowsort
UPSERT INTO kv(k) VALUES (6), (8) RETURNING k,v
----
8 NULL

query II rowsort
INSERT INTO kv VALUES (10, 10), (11, 11) ON CONFLICT (k) DO UPDATE SET v = excluded.v RETURNING *
----
10 10
11 11

query II rowsort
INSERT INTO kv VALUES (10, 2), (10, 3) ON CONFLICT (k) DO UPDATE SET v = excluded.v + kv.v RETURNING *
----
10 12
10 15

query II rowsort
INSERT INTO kv VALUES (10, 14), (15, 15) ON CONFLICT (k) DO NOTHING RETURNING *
----
15 15

statement ok
CREATE TABLE abc (
  a INT,
  b INT,
  c INT DEFAULT 7,
  PRIMARY KEY (a, b),
  INDEX y (b),
  UNIQUE INDEX z (c)
)

statement error missing "b" primary key column
UPSERT INTO abc (a, c) VALUES (1, 1)

statement error missing "a" primary key column
UPSERT INTO abc (b, c) VALUES (1, 1)

statement ok
INSERT INTO abc VALUES (1, 2, 3)

statement ok
INSERT INTO abc VALUES (1, 2, 3) ON CONFLICT (c) DO UPDATE SET a = 4

query III
SELECT * FROM abc
----
4 2 3

statement ok
INSERT INTO abc VALUES (1, 2, 3) ON CONFLICT (c) DO UPDATE SET b = 5

statement ok
INSERT INTO abc VALUES (1, 2, 3) ON CONFLICT (c) DO UPDATE SET c = 6

query III
SELECT * FROM abc
----
4 5 6

statement ok
INSERT INTO abc (a, b) VALUES (1, 2) ON CONFLICT (a, b) DO UPDATE SET a = 1, b = 2

statement ok
INSERT INTO abc (a, b) VALUES (4, 5) ON CONFLICT (a, b) DO UPDATE SET a = 7, b = 8

query III
SELECT * FROM abc ORDER BY (a, b, c)
----
1 2 7
7 8 6

statement ok
DELETE FROM abc where a = 1

statement ok
UPSERT INTO abc VALUES (1, 2)

query III
SELECT * FROM abc ORDER BY (a, b, c)
----
1 2 7
7 8 6

statement ok
UPSERT INTO abc VALUES (1, 2, 5)

query III
SELECT * FROM abc ORDER BY (a, b, c)
----
1 2 5
7 8 6

statement ok
UPSERT INTO abc VALUES (1, 2)

query III
SELECT * FROM abc ORDER BY (a, b, c)
----
1 2 7
7 8 6

statement ok
DELETE FROM abc where a = 1

statement ok
INSERT INTO abc VALUES (7, 8, 9) ON CONFLICT (a, b) DO UPDATE SET c = DEFAULT

query III
SELECT * FROM abc ORDER BY (a, b, c)
----
7 8 7

statement ok
CREATE TABLE excluded (a INT PRIMARY KEY, b INT)

statement error ambiguous source name: "excluded"
INSERT INTO excluded VALUES (1, 1) ON CONFLICT (a) DO UPDATE SET b = excluded.b

# Also test the statement is rejected on the fast path.
statement error ambiguous source name: "excluded"
UPSERT INTO excluded VALUES (1, 1)

# Tests for upsert/on conflict returning
statement ok
CREATE TABLE upsert_returning (a INT PRIMARY KEY, b INT, c INT, d INT DEFAULT -1)

statement ok
INSERT INTO upsert_returning VALUES (1, 1, NULL)

# Handle INSERT ... ON CONFLICT ... RETURNING
query IIII rowsort
INSERT INTO upsert_returning (a, c) VALUES (1, 1), (2, 2) ON CONFLICT (a) DO UPDATE SET c = excluded.c RETURNING *
----
1 1 1 -1
2 NULL 2 -1

# Handle INSERT ... ON CONFLICT DO NOTHING ... RETURNING
query IIII
INSERT INTO upsert_returning (a, c) VALUES (1, 1), (3, 3) ON CONFLICT (a) DO NOTHING RETURNING *
----
3 NULL 3 -1

# Handle UPSERT ... RETURNING
query IIII rowsort
UPSERT INTO upsert_returning (a, c) VALUES (1, 10), (3, 30) RETURNING *
----
1 1 10 -1
3 NULL 30 -1

# Ensure returned values are inserted values after conflict resolution
query I
SELECT b FROM upsert_returning WHERE a = 1
----
1

query I
INSERT INTO upsert_returning (a, b) VALUES (1, 1) ON CONFLICT (a) DO UPDATE SET b = excluded.b + upsert_returning.b + 1 RETURNING b
----
3

# Handle expressions within returning clause
query I rowsort
UPSERT INTO upsert_returning (a, b) VALUES (1, 2), (2, 3), (4, 3) RETURNING a+b+d
----
2
4
6

# Handle upsert fast path with autocommit
query IIII rowsort
UPSERT INTO upsert_returning VALUES (1, 2, 3, 4), (5, 6, 7, 8) RETURNING *
----
1 2 3 4
5 6 7 8

# Handle upsert fast path without autocommit
statement ok
BEGIN

query IIII rowsort
upsert INTO upsert_returning VALUES (1, 5, 4, 3), (6, 5, 4, 3) RETURNING *
----
1 5 4 3
6 5 4 3

statement ok
COMMIT

# For #22300. Test UPSERT ... RETURNING with UNION.
query I rowsort
SELECT a FROM [UPSERT INTO upsert_returning VALUES (7) RETURNING a] UNION VALUES (8)
----
7
8

# For #6710. Add an unused column to disable the fast path which doesn't have this bug.
statement ok
CREATE TABLE issue_6710 (a INT PRIMARY KEY, b STRING, c INT)

statement ok
INSERT INTO issue_6710 (a, b) VALUES (1, 'foo'), (2, 'bar')

statement ok
UPSERT INTO issue_6710 (a, b) VALUES (1, 'test1'), (2, 'test2')

query IT rowsort
SELECT a, b from issue_6710
----
1 test1
2 test2

statement ok
CREATE TABLE issue_13962 (a INT PRIMARY KEY, b INT, c INT)

statement ok
INSERT INTO issue_13962 VALUES (1, 1, 1)

statement ok
INSERT INTO issue_13962 VALUES (1, 2, 2) ON CONFLICT (a) DO UPDATE SET b = excluded.b

query III
SELECT * FROM issue_13962
----
1 2 1

statement ok
CREATE TABLE issue_14052 (a INT PRIMARY KEY, b INT, c INT)

statement ok
INSERT INTO issue_14052 (a, b) VALUES (1, 1), (2, 2)

statement ok
UPSERT INTO issue_14052 (a, c) (SELECT a, b from issue_14052)

statement ok
CREATE TABLE issue_14052_2 (
  id SERIAL PRIMARY KEY,
  name VARCHAR(255),
  createdAt INT,
  updatedAt INT
)

statement ok
INSERT INTO issue_14052_2 (id, name, createdAt, updatedAt) VALUES
  (1, 'original', 1, 1)

# Make sure the fast path isn't taken (createdAt is not in the ON CONFLICT clause)
statement ok
INSERT INTO issue_14052_2 (id, name, createdAt, updatedAt) VALUES
  (1, 'UPDATED', 2, 2)
ON CONFLICT (id) DO UPDATE
  SET id = excluded.id, name = excluded.name, updatedAt = excluded.updatedAt

query ITII
SELECT * FROM issue_14052_2;
----
1  UPDATED  1  2

statement error multiple assignments to the same column
INSERT INTO issue_14052_2 (id, name, createdAt, updatedAt) VALUES
  (1, 'FOO', 3, 3)
ON CONFLICT (id) DO UPDATE
  SET id = excluded.id, name = excluded.name, name = excluded.name, name = excluded.name

# Make sure the fast path isn't taken (all clauses in the set must be of the form x = excluded.x)
statement ok
INSERT INTO issue_14052_2 (id, name, createdAt, updatedAt) VALUES
  (1, 'BAR', 4, 5)
ON CONFLICT (id) DO UPDATE
  SET name = excluded.name, createdAt = excluded.updatedAt, updatedAt = excluded.updatedAt

query ITII
SELECT * FROM issue_14052_2;
----
1  BAR  5  5

# Make sure the column types are propagated when type checking the ON CONFLICT
# expressions. See #16873.
statement ok
CREATE TABLE issue_16873 (col int PRIMARY KEY, date TIMESTAMP);

# n.b. the fully-qualified names below are required, as there are two providers of
# the column named `col` here, the original table and the `excluded` pseudo-table.
statement ok
INSERT INTO issue_16873 VALUES (1,clock_timestamp())
ON CONFLICT (col) DO UPDATE SET date = clock_timestamp() WHERE issue_16873.col = 1;

statement ok
INSERT INTO issue_16873 VALUES (1,clock_timestamp())
ON CONFLICT (col) DO UPDATE SET date = clock_timestamp() WHERE issue_16873.col = 1;

# For #17339.  Support WHERE clause in ON CONFLICT handling.
statement ok
CREATE TABLE issue_17339 (a int primary key, b int);

statement ok
INSERT INTO issue_17339 VALUES (1, 1), (2, 0);

statement ok
INSERT INTO issue_17339 VALUES (1, 0), (2, 2)
ON CONFLICT (a) DO UPDATE SET b = excluded.b WHERE excluded.b > issue_17339.b;

query II
SELECT * FROM issue_17339 ORDER BY a;
----
1 1
2 2

statement ok
INSERT INTO issue_17339 VALUES (1, 0), (2, 1)
ON CONFLICT (a) DO UPDATE SET b = excluded.b WHERE TRUE;

query II
SELECT * FROM issue_17339 ORDER BY a;
----
1 0
2 1

query TTT
EXPLAIN (PLAN,EXPRS) UPSERT INTO kv TABLE kv ORDER BY v DESC
----
upsert          ·       ·
 │              into    kv(k, v)
 └── sort       ·       ·
      │         order   -v
      └── scan  ·       ·
·               table   kv@primary
·               spans   ALL
