# Test that we don't allow FAMILY constraints with virtual columns.
statement error virtual computed column "v" cannot be part of a family
CREATE TABLE t (
  a INT PRIMARY KEY,
  b INT,
  v INT AS (a+b) VIRTUAL,
  FAMILY (a, b, v)
)

statement error virtual computed column "v" cannot be part of a family
CREATE TABLE t (
  a INT PRIMARY KEY,
  b INT,
  v INT AS (a+b) VIRTUAL,
  FAMILY (a),
  FAMILY (b),
  FAMILY (v)
)

statement error primary index column "v" cannot be virtual
CREATE TABLE t (
  a INT,
  b INT,
  v INT AS (a+b) VIRTUAL,
  PRIMARY KEY (b,v)
)

statement error index "t_b_idx" cannot store virtual column "v"
CREATE TABLE t (
  a INT PRIMARY KEY,
  b INT,
  v INT AS (a+b) VIRTUAL,
  INDEX (b) STORING (v)
)

statement ok
CREATE TABLE t (
  a INT PRIMARY KEY,
  b INT,
  v INT AS (a+b) VIRTUAL
)

statement error pgcode 42611 column "v" is not a stored computed column
ALTER TABLE t ALTER COLUMN v DROP STORED

statement ok
INSERT INTO t VALUES (1, 1)

statement ok
INSERT INTO t(a,b) VALUES (2, 2)

statement error cannot write directly to computed column
INSERT INTO t(a,b,v) VALUES (2, 2, 0)

statement error cannot write directly to computed column
INSERT INTO t VALUES (2, 2, 0)

# Ensure that the virtual column is produced.
query III colnames,rowsort
SELECT * FROM t
----
a  b  v
1  1  2
2  2  4

statement ok
DELETE FROM t WHERE a > 0

statement ok
INSERT INTO t VALUES (1, 10), (2, 20), (3, 30), (4, 40)

query I rowsort
DELETE FROM t WHERE a = 1 RETURNING v
----
11

query III colnames,rowsort
SELECT * FROM t
----
a  b   v
2  20  22
3  30  33
4  40  44

statement ok
DELETE FROM t WHERE v = 33

query III colnames,rowsort
SELECT * FROM t
----
a  b   v
2  20  22
4  40  44

statement error cannot write directly to computed column
UPDATE t SET v=1

statement ok
UPDATE t SET a=a+1

query III colnames,rowsort
SELECT * FROM t
----
a   b   v
3  20  23
5  40  45

query III colnames,rowsort
UPDATE t SET b=b+1 WHERE v=45 RETURNING a,b,v
----
a  b   v
5  41  46

# Tests with an index on the virtual column.
statement ok
CREATE TABLE t_idx (
  a INT PRIMARY KEY,
  b INT,
  c INT,
  v INT AS (a+b) VIRTUAL,
  w INT AS (c+1) VIRTUAL,
  INDEX (v),
  UNIQUE (w)
)

statement ok
INSERT INTO t_idx VALUES (1, 1, 1), (2, 8, 2), (3, 3, 3), (4, 6, 4), (5, 0, 5)

statement error duplicate key value violates unique constraint
INSERT INTO t_idx VALUES (10, 10, 1)

# Queries which should use the index on v. Note that there are corresponding
# execbuilder tests which verify the query plans.
query I rowsort
SELECT a FROM t_idx WHERE a+b=10
----
2
4

query I rowsort
SELECT a FROM t_idx WHERE v=10
----
2
4

query I rowsort
SELECT a FROM t_idx WHERE w IN (4,6)
----
3
5

statement ok
DELETE FROM t_idx WHERE v = 6

query IIIII colnames,rowsort
SELECT * FROM t_idx
----
a  b  c  v   w
1  1  1  2   2
2  8  2  10  3
4  6  4  10  5
5  0  5  5   6

statement ok
DELETE FROM t_idx WHERE a+b = 10

query IIIII colnames,rowsort
SELECT * FROM t_idx
----
a  b  c  v  w
1  1  1  2  2
5  0  5  5  6

# Update PK; ensure indexes are updated.
statement ok
UPDATE t_idx SET a=a+1

query IIIII colnames,rowsort
SELECT * FROM t_idx
----
a  b  c  v  w
2  1  1  3  2
6  0  5  6  6

query I
SELECT a FROM t_idx WHERE v=3
----
2

query I
SELECT a FROM t_idx WHERE w=2
----
2

# Update b, which affects only v.
statement ok
UPDATE t_idx SET b=b+1

query IIIII colnames,rowsort
SELECT * FROM t_idx
----
a  b  c  v  w
2  2  1  4  2
6  1  5  7  6

query I
SELECT a FROM t_idx WHERE v=4
----
2

query I
SELECT a FROM t_idx WHERE w=2
----
2

# Update c, which affects only w.
statement ok
UPDATE t_idx SET c=c+1

query IIIII colnames,rowsort
SELECT * FROM t_idx
----
a  b  c  v  w
2  2  2  4  3
6  1  6  7  7

query I
SELECT a FROM t_idx WHERE v=4
----
2

query I
SELECT a FROM t_idx WHERE w=3
----
2

statement error duplicate key value violates unique constraint
UPDATE t_idx SET c=6 WHERE a=2

# Test UPDATE .. RETURNING.
query III colnames,rowsort
UPDATE t_idx SET a=a+1 RETURNING a,v,w
----
a  v  w
3  5  3
7  8  7

query I rowsort
UPDATE t_idx SET b=b+1 RETURNING w
----
3
7

# Upsert tests on t.

statement ok
TRUNCATE t

statement error cannot write directly to computed column
UPSERT INTO t(a,b,v) VALUES (1, 1, 1)

statement error cannot write directly to computed column
UPSERT INTO t VALUES (1, 1, 1)

statement ok
UPSERT INTO t VALUES (1, 10), (2, 20), (3, 30), (4, 40)

query III colnames,rowsort
SELECT * FROM t
----
a  b   v
1  10  11
2  20  22
3  30  33
4  40  44

query I colnames,rowsort
UPSERT INTO t VALUES (3, 31), (5, 50) RETURNING v
----
v
34
55

query I colnames,rowsort
INSERT INTO t VALUES (5, 51), (6, 60) ON CONFLICT DO NOTHING RETURNING v
----
v
66

query III colnames,rowsort
SELECT * FROM t
----
a  b   v
1  10  11
2  20  22
3  31  34
4  40  44
5  50  55
6  60  66

statement ok
INSERT INTO t VALUES (4, 100), (6, 100), (7, 100) ON CONFLICT (a) DO UPDATE SET b = t.v

query III colnames,rowsort
SELECT * FROM t
----
a  b    v
1  10   11
2  20   22
3  31   34
4  44   48
5  50   55
6  66   72
7  100  107

statement ok
INSERT INTO t VALUES (2, 100), (5, 100), (8, 100) ON CONFLICT (a) DO UPDATE SET b = excluded.v

query III colnames,rowsort
SELECT * FROM t
----
a  b    v
1  10   11
2  102  104
3  31   34
4  44   48
5  105  110
6  66   72
7  100  107
8  100  108

# Upsert tests on t_idx.

statement ok
TRUNCATE t_idx

statement error cannot write directly to computed column
UPSERT INTO t_idx(a,b,v) VALUES (1, 1, 1)

statement error cannot write directly to computed column
UPSERT INTO t_idx VALUES (1, 1, 1, 1)

statement ok
UPSERT INTO t_idx VALUES (1, 10, 100), (2, 20, 200), (3, 30, 300), (4, 40, 400)

query IIIII colnames,rowsort
SELECT * FROM t_idx
----
a  b   c    v   w
1  10  100  11  101
2  20  200  22  201
3  30  300  33  301
4  40  400  44  401

query III colnames,rowsort
UPSERT INTO t_idx VALUES (3, 31, 301), (5, 50, 500) RETURNING a, v, w
----
a  v   w
3  34  302
5  55  501

# Some rows conflict on the PK, some on w.
query I colnames,rowsort
INSERT INTO t_idx VALUES (4, 41, 301), (6, 60, 600), (7, 70, 100) ON CONFLICT DO NOTHING RETURNING w
----
w
601

query IIIII colnames,rowsort
SELECT * FROM t_idx
----
a  b   c    v   w
1  10  100  11  101
2  20  200  22  201
3  31  301  34  302
4  40  400  44  401
5  50  500  55  501
6  60  600  66  601

# Conflict on a.
statement error violates unique constraint
INSERT INTO t_idx VALUES (1, 80, 900) ON CONFLICT (w) DO NOTHING

# Conflict on w.
statement error violates unique constraint
INSERT INTO t_idx VALUES (8, 80, 100) ON CONFLICT (a) DO NOTHING

# Conflict on w.
statement error violates unique constraint
INSERT INTO t_idx VALUES (4, 10, 100), (6, 10, 100), (7, 70, 700) ON CONFLICT (a) DO UPDATE SET c = 0

query IIIII colnames,rowsort
INSERT INTO t_idx VALUES (4, 10, 100), (6, 10, 100), (7, 70, 700) ON CONFLICT (a) DO UPDATE SET c = t_idx.w RETURNING a, b, c, v, w
----
a  b   c    v   w
4  40  401  44  402
6  60  601  66  602
7  70  700  77  701

query IIIII colnames,rowsort
SELECT * FROM t_idx
----
a  b   c    v   w
1  10  100  11  101
2  20  200  22  201
3  31  301  34  302
4  40  401  44  402
5  50  500  55  501
6  60  601  66  602
7  70  700  77  701

statement ok
INSERT INTO t_idx VALUES (8, 80, 800), (10, 100, 700) ON CONFLICT (w) DO UPDATE SET a = excluded.a, c = excluded.v

query IIIII colnames,rowsort
SELECT * FROM t_idx
----
a   b   c    v   w
1   10  100  11  101
2   20  200  22  201
3   31  301  34  302
4   40  401  44  402
5   50  500  55  501
6   60  601  66  602
8   80  800  88  801
10  70  110  80  111

# Verify that FK relations on virtual columns are disallowed.
statement ok
CREATE TABLE fk (
  a INT PRIMARY KEY,
  b INT,
  c INT,
  u INT UNIQUE AS (b+c) VIRTUAL
)

statement error virtual column "u" cannot be referenced by a foreign key
CREATE TABLE fk2 (
  p INT PRIMARY KEY,
  c INT REFERENCES fk(u)
)

statement error virtual column "c" cannot reference a foreign key
CREATE TABLE fk2 (
  p INT PRIMARY KEY,
  c INT AS (p+1) VIRTUAL REFERENCES fk(a)
)

statement error virtual column "u" cannot be referenced by a foreign key
CREATE TABLE fk2 (
  p INT PRIMARY KEY,
  q INT,
  r INT,
  CONSTRAINT fk FOREIGN KEY (q,r) REFERENCES fk(a,u)
)

statement ok
CREATE TABLE fk2 (
  x INT PRIMARY KEY,
  y INT,
  v INT AS (x+y) VIRTUAL
)

statement error virtual column "u" cannot be referenced by a foreign key
ALTER TABLE fk2 ADD CONSTRAINT foo FOREIGN KEY (x) REFERENCES fk(u)

statement error virtual column "v" cannot reference a foreign key
ALTER TABLE fk2 ADD CONSTRAINT foo FOREIGN KEY (v) REFERENCES fk(a)

# Tests with not null virtual columns.
subtest NotNull

statement ok
CREATE TABLE n (
  a INT PRIMARY KEY,
  b INT,
  v INT NOT NULL AS (a+b) VIRTUAL
)

statement error null value in column "v" violates not-null constraint
INSERT INTO n VALUES (1, NULL)

statement ok
INSERT INTO n VALUES (1, 1), (2, 2)

statement error null value in column "v" violates not-null constraint
UPDATE n SET b = NULL WHERE a > 0

statement error null value in column "v" violates not-null constraint
UPSERT INTO n VALUES (1, NULL)

statement error null value in column "v" violates not-null constraint
UPSERT INTO n VALUES (3, NULL)

statement ok
INSERT INTO n VALUES (1, NULL) ON CONFLICT DO NOTHING

statement error null value in column "v" violates not-null constraint
INSERT INTO n VALUES (3, NULL) ON CONFLICT DO NOTHING

statement error null value in column "v" violates not-null constraint
INSERT INTO n VALUES (1, 10) ON CONFLICT (a) DO UPDATE SET b = NULL

statement error null value in column "v" violates not-null constraint
INSERT INTO n VALUES (3, NULL) ON CONFLICT (a) DO UPDATE SET b = NULL

# Tests with check constraints on virtual columns.
subtest Checks

statement ok
CREATE TABLE t_check (
  a INT PRIMARY KEY,
  b INT,
  v INT AS (a+b) VIRTUAL CHECK (v >= 10),
  w INT AS (a*b) VIRTUAL,
  CHECK (v < w)
)

statement error failed to satisfy CHECK constraint
INSERT INTO t_check VALUES (1,1), (5,5)

statement ok
INSERT INTO t_check VALUES (5,5), (6,6)

statement error failed to satisfy CHECK constraint
UPDATE t_check SET b=b-1

statement ok
UPDATE t_check SET b=b+1

query IIII colnames,rowsort
SELECT * FROM t_check
----
a  b  v   w
5  6  11  30
6  7  13  42

statement error failed to satisfy CHECK constraint
UPSERT INTO t_check VALUES (5, 2), (8, 8)

statement error failed to satisfy CHECK constraint
UPSERT INTO t_check VALUES (5, 10), (8, 1)

statement ok
UPSERT INTO t_check VALUES (5, 10), (8, 8)

query IIII colnames,rowsort
SELECT * FROM t_check
----
a  b   v   w
5  10  15  50
6  7   13  42
8  8   16  64

statement error failed to satisfy CHECK constraint
INSERT INTO t_check VALUES (5, 1) ON CONFLICT (a) DO UPDATE SET b=3

statement ok
INSERT INTO t_check VALUES (5, 1) ON CONFLICT (a) DO UPDATE SET b=5

query IIII colnames,rowsort
SELECT * FROM t_check
----
a  b  v   w
5  5  10  25
6  7  13  42
8  8  16  64

# Tests with unique indexes and constraints involving virtual columns.
subtest NotNull

statement ok
CREATE TABLE uniq_simple (
  a INT PRIMARY KEY,
  b INT,
  v INT UNIQUE AS (a+b) VIRTUAL
)

statement ok
INSERT INTO uniq_simple VALUES (1, 10), (2, 20)

statement error duplicate key value violates unique constraint
INSERT INTO uniq_simple VALUES (3, 8)

statement error duplicate key value violates unique constraint
UPDATE uniq_simple SET b=b+11 WHERE a < 2

statement error duplicate key value violates unique constraint
UPSERT INTO uniq_simple VALUES (2, 30), (5, 6)

statement ok
INSERT INTO uniq_simple VALUES (5, 6) ON CONFLICT (v) DO UPDATE SET b=15

query III colnames,rowsort
SELECT * FROM uniq_simple
----
a  b   v
1  15  16
2  20  22

statement ok
CREATE TABLE uniq_partial (
  a INT PRIMARY KEY,
  b INT,
  v INT AS (a+b) VIRTUAL,
  UNIQUE INDEX (v) WHERE b > 10
)

statement ok
INSERT INTO uniq_partial VALUES (1, 10), (2, 20)

statement error duplicate key value violates unique constraint
INSERT INTO uniq_partial VALUES (3, 19)

statement ok
INSERT INTO uniq_partial VALUES (4, 7)

query III colnames,rowsort
SELECT * FROM uniq_partial
----
a  b   v
1  10  11
2  20  22
4  7   11

statement error duplicate key value violates unique constraint
UPDATE uniq_partial SET b = 30-a

statement ok
UPDATE uniq_partial SET b = 10-a

query III colnames,rowsort
SELECT * FROM uniq_partial
----
a  b  v
1  9  10
2  8  10
4  6  10

statement ok
UPSERT INTO uniq_partial VALUES (3, 7), (20, 20)

statement error duplicate key value violates unique constraint
UPSERT INTO uniq_partial VALUES (15, 25)

statement ok
CREATE TABLE uniq_partial_pred (
  a INT PRIMARY KEY,
  b INT,
  c INT,
  v INT AS (a+b) VIRTUAL,
  UNIQUE INDEX (c) WHERE v > 10
)

statement ok
INSERT INTO uniq_partial_pred VALUES (1, 1, 1), (2, 4, 2), (3, 3, 2), (10, 10, 1)

statement error duplicate key value violates unique constraint
INSERT INTO uniq_partial_pred VALUES (11, 9, 1)

statement error duplicate key value violates unique constraint
UPDATE uniq_partial_pred SET b=20-a

statement ok
UPDATE uniq_partial_pred SET b=10-a

statement ok
CREATE TABLE uniq_partial_multi (
  a INT PRIMARY KEY,
  b INT,
  c INT,
  v INT AS (a+b) VIRTUAL,
  UNIQUE INDEX (c, v) WHERE (v > 10)
)

statement ok
INSERT INTO uniq_partial_multi VALUES (1, 1, 1), (2, 4, 2), (3, 3, 2), (10, 10, 1)

statement error duplicate key value violates unique constraint
INSERT INTO uniq_partial_multi VALUES (15, 5, 1)

statement ok
UPSERT INTO uniq_partial_multi VALUES (4, 2, 2)

statement error duplicate key value violates unique constraint
UPSERT INTO uniq_partial_multi VALUES (4, 16, 1)

statement ok
SET experimental_enable_unique_without_index_constraints = true

statement ok
CREATE TABLE uniq_no_index (
  a INT PRIMARY KEY,
  b INT,
  v INT AS (a+b) VIRTUAL,
  UNIQUE WITHOUT INDEX (v)
)

statement ok
INSERT INTO uniq_no_index VALUES (1, 10), (2, 20)

statement error duplicate key value violates unique constraint
INSERT INTO uniq_no_index VALUES (3, 8)

statement error duplicate key value violates unique constraint
UPDATE uniq_no_index SET b=b+11 WHERE a < 2

statement error duplicate key value violates unique constraint
UPSERT INTO uniq_no_index VALUES (2, 30), (5, 6)

statement ok
INSERT INTO uniq_no_index VALUES (5, 6) ON CONFLICT (v) DO UPDATE SET b=15

query III colnames,rowsort
SELECT * FROM uniq_no_index
----
a  b   v
1  15  16
2  20  22

statement ok
CREATE TABLE uniq_no_index_multi (
  a INT PRIMARY KEY,
  b INT,
  c INT,
  v INT AS (a+b) VIRTUAL,
  UNIQUE WITHOUT INDEX (v, c)
)

statement ok
INSERT INTO uniq_no_index_multi VALUES (1, 1, 1), (2, 4, 2), (3, 3, 3)

statement error duplicate key value violates unique constraint
INSERT INTO uniq_no_index_multi VALUES (4, 2, 2)

statement error duplicate key value violates unique constraint
UPDATE uniq_no_index_multi SET c=2 WHERE a=3

statement ok
UPSERT INTO uniq_no_index_multi VALUES (3, 3, 10)

statement error duplicate key value violates unique constraint
UPSERT INTO uniq_no_index_multi VALUES (3, 3, 2)

# TODO(radu): add a test with a partial unique without index constraint.

# Test schema changes with virtual columns.
subtest SchemaChanges

statement ok
CREATE TABLE sc (a INT PRIMARY KEY, b INT)

statement ok
INSERT INTO sc VALUES (1, 10), (2, 20), (3, 30);

statement ok
ALTER TABLE sc ADD COLUMN v INT AS (a+b) VIRTUAL

query III rowsort,colnames
SELECT * FROM sc
----
a  b   v
1  10  11
2  20  22
3  30  33

statement ok
ALTER TABLE sc ADD COLUMN x INT AS (a+1) VIRTUAL, ADD COLUMN y INT AS (b+1) VIRTUAL, ADD COLUMN z INT AS (a+b) VIRTUAL

query IIIIII rowsort,colnames
SELECT * FROM sc
----
a  b   v   x  y   z
1  10  11  2  11  11
2  20  22  3  21  22
3  30  33  4  31  33

statement error computed column expression cannot reference computed columns
ALTER TABLE sc ADD COLUMN u INT AS (a+v) VIRTUAL

statement ok
ALTER TABLE sc DROP COLUMN z

query IIIII rowsort,colnames
SELECT * FROM sc
----
a  b   v   x  y
1  10  11  2  11
2  20  22  3  21
3  30  33  4  31

statement ok
ALTER TABLE sc DROP COLUMN x, DROP COLUMN y

query III rowsort,colnames
SELECT * FROM sc
----
a  b   v
1  10  11
2  20  22
3  30  33

# Add virtual columns inside an explicit transactions.
statement ok
BEGIN

statement ok
ALTER TABLE sc ADD COLUMN w1 INT AS (a*b) VIRTUAL

statement ok
ALTER TABLE sc ADD COLUMN w2 INT AS (b*2) VIRTUAL

statement ok
COMMIT

query IIIII rowsort,colnames
SELECT * FROM sc
----
a  b   v   w1  w2
1  10  11  10  20
2  20  22  40  40
3  30  33  90  60

statement ok
ALTER TABLE sc DROP COLUMN w1, DROP COLUMN w2

query III rowsort,colnames
SELECT * FROM sc
----
a  b   v
1  10  11
2  20  22
3  30  33

# Create an index on the virtual column and check that it works.
statement ok
CREATE INDEX v_idx ON sc(v)

query I rowsort
SELECT a FROM sc@v_idx
----
1
2
3

query I rowsort
SELECT a FROM sc WHERE v>20 AND v<40
----
2
3

statement ok
DROP INDEX v_idx

statement ok
ALTER TABLE sc DROP COLUMN v

# Add a column and an index on that column in the same transaction.
statement ok
BEGIN

statement ok
ALTER TABLE sc ADD COLUMN v INT AS (a+b) VIRTUAL

statement ok
CREATE INDEX v_idx ON sc(v)

statement ok
END

query I rowsort
SELECT a FROM sc@v_idx
----
1
2
3

statement ok
DROP INDEX v_idx

statement ok
ALTER TABLE sc DROP COLUMN v

# Add a column and a partial index using that column in the predicate in the
# same transaction.
statement ok
BEGIN

statement ok
ALTER TABLE sc ADD COLUMN v INT AS (a+b) VIRTUAL

statement ok
CREATE INDEX partial_idx ON sc(b) WHERE v > 20

statement ok
END

query I rowsort
SELECT a FROM sc@partial_idx WHERE v > 20
----
2
3

statement ok
DROP INDEX partial_idx

# Create a partial index on the virtual column and which uses the virtual column in the predicate.
statement ok
CREATE INDEX v_partial_idx ON sc(v) WHERE v > 20

query I rowsort
SELECT a FROM sc@v_partial_idx WHERE v > 20
----
2
3

statement ok
INSERT INTO sc VALUES (10, 10), (11, 9)

query III rowsort,colnames
SELECT * FROM sc
----
a   b   v
1   10  11
2   20  22
3   30  33
10  10  20
11  9   20

# Create a partial unique index on v which should fail.
statement error violates unique constraint
CREATE UNIQUE INDEX v_partial_idx2 ON sc(v) WHERE v > 10

# Create a check constraint which should fail.
statement error validation.*failed on row
ALTER TABLE sc ADD CONSTRAINT c CHECK (v < 30)

statement ok
ALTER TABLE sc ADD CONSTRAINT c CHECK (v < 40)

statement error failed to satisfy CHECK constraint
UPDATE sc SET b=b+10

# Add a virtual column with a check constraint.
statement error validation.*failed on row
ALTER TABLE sc ADD COLUMN w INT AS (a*b) VIRTUAL CHECK (w < 100)

statement ok
ALTER TABLE sc ADD COLUMN w INT AS (a*b) VIRTUAL CHECK (w <= 100)

statement error failed to satisfy CHECK constraint
INSERT INTO sc VALUES (20, 20)

# Test inverted indexes on virtual columns.
subtest InvertedIndexes

statement ok
CREATE TABLE inv (
  k INT PRIMARY KEY,
  i INT,
  j JSON,
  iv INT AS (i + 10) VIRTUAL,
  jv JSON AS (j->'a') VIRTUAL,
  INVERTED INDEX jv_idx (jv),
  INVERTED INDEX i_jv_idx (i, jv),
  INVERTED INDEX iv_j_idx (iv, j),
  INVERTED INDEX iv_jv_idx (iv, jv)
)

statement ok
INSERT INTO inv VALUES
  (1, 10, NULL),
  (2, 10, '1'),
  (3, 10, '"a"'),
  (4, 10, 'true'),
  (5, 10, 'null'),
  (6, 10, '{}'),
  (7, 10, '[]'),
  (8, 10, '{"a": "b"}'),
  (9, 10, '{"a": "b", "c": "d"}'),
  (10, 10, '{"a": {}, "b": "c"}'),
  (11, 10, '{"a": {"b": "c"}, "d": "e"}'),
  (12, 10, '{"a": {"b": "c", "d": "e"}}'),
  (13, 10, '{"a": [], "d": "e"}'),
  (14, 10, '{"a": ["b", "c"], "d": "e"}'),
  (15, 10, '["a"]'),
  (16, 10, '["a", "b", "c"]'),
  (17, 10, '[{"a": "b"}, "c"]')

statement ok
INSERT INTO inv
SELECT k+17, 20, j FROM inv

query IT
SELECT k, jv FROM inv@jv_idx WHERE jv @> '{"b": "c"}' ORDER BY k
----
11  {"b": "c"}
12  {"b": "c", "d": "e"}
28  {"b": "c"}
29  {"b": "c", "d": "e"}

query IT
SELECT k, jv FROM inv@jv_idx WHERE jv->'b' = '"c"' ORDER BY k
----
11  {"b": "c"}
12  {"b": "c", "d": "e"}
28  {"b": "c"}
29  {"b": "c", "d": "e"}

query IT
SELECT k, jv FROM inv@jv_idx WHERE jv @> '"b"' ORDER BY k
----
8   "b"
9   "b"
14  ["b", "c"]
25  "b"
26  "b"
31  ["b", "c"]

query IIT
SELECT k, i, jv FROM inv@i_jv_idx WHERE i IN (10, 20, 30) AND jv @> '{"b": "c"}' ORDER BY k
----
11  10  {"b": "c"}
12  10  {"b": "c", "d": "e"}
28  20  {"b": "c"}
29  20  {"b": "c", "d": "e"}

query IIT
SELECT k, i, jv FROM inv@i_jv_idx WHERE i = 20 AND jv @> '{"b": "c"}' ORDER BY k
----
28  20  {"b": "c"}
29  20  {"b": "c", "d": "e"}

query IIT
SELECT k, iv, j FROM inv@iv_j_idx WHERE iv IN (10, 20, 30) AND j @> '{"b": "c"}' ORDER BY k
----
10  20  {"a": {}, "b": "c"}
27  30  {"a": {}, "b": "c"}

query IIT
SELECT k, iv, j FROM inv@iv_j_idx WHERE iv = 20 AND j @> '{"b": "c"}' ORDER BY k
----
10  20  {"a": {}, "b": "c"}

query IIT
SELECT k, iv, jv FROM inv@iv_jv_idx WHERE iv IN (10, 20, 30) AND jv @> '{"b": "c"}' ORDER BY k
----
11  20  {"b": "c"}
12  20  {"b": "c", "d": "e"}
28  30  {"b": "c"}
29  30  {"b": "c", "d": "e"}

query IIT
SELECT k, iv, jv FROM inv@iv_jv_idx WHERE iv = 20 AND jv @> '{"b": "c"}' ORDER BY k
----
11  20  {"b": "c"}
12  20  {"b": "c", "d": "e"}

# Test that virtual computed columns which reference mutation columns cannot
# be added.
subtest referencing_mutations

statement ok
CREATE TABLE t_ref (i INT PRIMARY KEY);

statement error pgcode 0A000 virtual computed column "k" referencing columns \("j"\) added in the current transaction
ALTER TABLE t_ref ADD COLUMN j INT NOT NULL DEFAULT 42,
   ADD COLUMN k INT AS (i+j) VIRTUAL;

statement error pgcode 0A000 virtual computed column "l" referencing columns \("j", "k"\) added in the current transaction
BEGIN;
    ALTER TABLE t_ref ADD COLUMN j INT NOT NULL DEFAULT 42;
    ALTER TABLE t_ref ADD COLUMN k INT NOT NULL DEFAULT 42;
    ALTER TABLE t_ref ADD COLUMN l INT AS (i+j+k) VIRTUAL;
COMMIT;

statement ok
ROLLBACK;

# Test that adding virtual computed columns to tables which have been created
# in the current transaction is fine.

statement ok
DROP TABLE t_ref;

statement ok
BEGIN;
    CREATE TABLE t_ref (i INT PRIMARY KEY);
    ALTER TABLE t_ref ADD COLUMN j INT NOT NULL DEFAULT 42;
    ALTER TABLE t_ref ADD COLUMN k INT AS (i+j) VIRTUAL;
COMMIT;

statement ok
DROP TABLE t_ref;

# Tests for virtual computed columns that reference foreign key columns.
subtest referencing_fks

statement ok
CREATE TABLE p (p INT PRIMARY KEY)

statement ok
CREATE TABLE c_update (
  p_cascade INT REFERENCES p (p) ON UPDATE CASCADE,
  p_default INT DEFAULT 0 REFERENCES p (p) ON UPDATE SET DEFAULT,
  p_null INT REFERENCES p (p) ON UPDATE SET NULL,
  v_cascade INT AS (p_cascade + 100) VIRTUAL,
  v_default INT AS (p_default) VIRTUAL,
  v_null INT AS (p_null + 100) VIRTUAL
)

statement ok
CREATE TABLE c_delete_cascade (
  p_cascade INT REFERENCES p (p) ON DELETE CASCADE,
  v_cascade INT AS (p_cascade + 100) VIRTUAL
)

statement ok
CREATE TABLE c_delete_set (
  p_default INT DEFAULT 0 REFERENCES p (p) ON DELETE SET DEFAULT,
  p_null INT REFERENCES p (p) ON DELETE SET NULL,
  v_default INT AS (p_default) VIRTUAL,
  v_null INT AS (p_null + 100) VIRTUAL
)

statement ok
INSERT INTO p VALUES (0), (1), (2), (3)

statement ok
INSERT INTO c_update VALUES (1, 1, 1), (2, 2, 2)

statement ok
UPDATE p SET p = 10 WHERE p = 1

query IIIIII colnames,rowsort
SELECT * FROM c_update
----
p_cascade  p_default  p_null  v_cascade  v_default  v_null
2          2          2       102        2          102
10         0          NULL    110        0          NULL

statement ok
INSERT INTO c_delete_cascade VALUES (2), (3);
INSERT INTO c_delete_set VALUES (2, 2), (3, 3);

statement ok
DELETE FROM p WHERE p = 3

query II colnames,rowsort
SELECT * FROM c_delete_cascade
----
p_cascade  v_cascade
2          102

query IIII colnames,rowsort
SELECT * FROM c_delete_set
----
p_default  p_null  v_default  v_null
0          NULL    0          NULL
2          2       2          102

# Regression test for #63167. CREATE TABLE LIKE should copy VIRTUAL columns as
# VIRTUAL, not STORED.
statement ok
CREATE TABLE t63167_a (a INT, v INT AS (a + 1) VIRTUAL);
CREATE TABLE t63167_b (LIKE t63167_a INCLUDING ALL);

query T
SELECT create_statement FROM [SHOW CREATE TABLE t63167_b]
----
CREATE TABLE public.t63167_b (
   a INT8 NULL,
   v INT8 NULL AS (a + 1:::INT8) VIRTUAL,
   rowid INT8 NOT VISIBLE NOT NULL DEFAULT unique_rowid(),
   CONSTRAINT "primary" PRIMARY KEY (rowid ASC),
   FAMILY "primary" (a, rowid)
)

# Test that columns backfills to tables with virtual columns work.
subtest column_backfill

statement ok
CREATE TABLE t_65915 (i INT PRIMARY KEY, j INT AS (i + 1) VIRTUAL NOT NULL);
INSERT INTO t_65915 VALUES (1)

statement ok
ALTER TABLE t_65915 ADD COLUMN k INT DEFAULT 42;

query III
SELECT * FROM t_65915;
----
1  2  42

statement ok
DROP TABLE t_65915
