query I
SELECT (SELECT 1)
----
1

query B
SELECT 1 IN (SELECT 1)
----
true

query B
SELECT (1, 2, 3) IN (SELECT 1, 2, 3)
----
true

query B
SELECT (1, 2, 3) = (SELECT 1, 2, 3)
----
true

query B
SELECT (1, 2, 3) != (SELECT 1, 2, 3)
----
false

query error subquery must return only one column, found 2
SELECT (SELECT 1, 2)

query error subquery must return only one column, found 2
SELECT 1 IN (SELECT 1, 2)

query error subquery must return 2 columns, found 1
SELECT (1, 2) IN (SELECT 1)

statement ok
CREATE TABLE abc (a INT PRIMARY KEY, b INT, c INT)

statement ok
INSERT INTO abc VALUES (1, 2, 3), (4, 5, 6)

query error subquery must return 2 columns
SELECT (1, 2) IN (SELECT * FROM abc)

query B
SELECT (1, 2) IN (SELECT a, b FROM abc)
----
true

query B
SELECT (1, 2) IN (SELECT a, b FROM abc WHERE false)
----
false

query error subquery must return only one column
SELECT (SELECT * FROM abc)

query error more than one row returned by a subquery used as an expression
SELECT (SELECT a FROM abc)

query I
SELECT (SELECT a FROM abc WHERE false)
----
NULL

query II
VALUES (1, (SELECT (2)))
----
1 2

statement ok
INSERT INTO abc VALUES ((SELECT 7), (SELECT 8), (SELECT 9))

query III
SELECT * FROM abc WHERE a = 7
----
7 8 9

statement error value type tuple doesn't match type INT of column "a"
INSERT INTO abc VALUES ((SELECT (10, 11, 12)))

statement error subquery must return only one column, found 3
INSERT INTO abc VALUES ((SELECT 10, 11, 12))

statement ok
CREATE TABLE xyz (x INT PRIMARY KEY, y INT, z INT)

statement ok
INSERT INTO xyz SELECT * FROM abc

query III
SELECT * FROM xyz
----
1 2 3
4 5 6
7 8 9

statement ok
UPDATE xyz SET z = (SELECT 10) WHERE x = 7

query III
SELECT * FROM xyz
----
1 2 3
4 5 6
7 8 10

statement error value type tuple doesn't match type INT of column "z"
UPDATE xyz SET z = (SELECT (10, 11)) WHERE x = 7

statement error subquery must return 2 columns, found 1
UPDATE xyz SET (y, z) = (SELECT (11, 12)) WHERE x = 7

statement ok
UPDATE xyz SET (y, z) = (SELECT 11, 12) WHERE x = 7

query III
SELECT * FROM xyz
----
1 2  3
4 5  6
7 11 12

query B
SELECT 1 IN (SELECT x FROM xyz ORDER BY x DESC)
----
true

statement ok
CREATE TABLE kv (k INT PRIMARY KEY, v STRING)

statement ok
INSERT INTO kv VALUES (1, 'one')

query IT
SELECT * FROM kv WHERE k = (SELECT k FROM kv WHERE (k, v) = (1, 'one'))
----
1 one

query B
SELECT EXISTS(SELECT 1 FROM kv AS x WHERE x.k = 1)
----
true
